,ID,Date,User,Tweet,HashTags,Likes,Retweets,MentionUsers,LocationCoordinates,clean_Tweet,NLTK_Sentiment_Analysis,TextBlob_Sentiment_Analysis,Compound_Sentiment_Score,Positive_Sentiment
1119,1563759532739805184,2022-08-28 05:25:00+00:00,BearsViews,"NFL Preseason Blitz: Tom Brady plays, has a sharp series for Buccaneers #Bears #ChicagoBears #BearsNation #DaBears https://t.co/NnnUNL5Cfm","['Bears', 'ChicagoBears', 'BearsNation', 'DaBears']",0,1,,,nfl preseason blitz tom brady plays sharp series buccaneers,0.25,-0.125,0.125,True
1122,1563756763916259328,2022-08-28 05:14:00+00:00,BearsViews,Bears Preseason: Roster Risers and Fallers After Browns Game #Bears #ChicagoBears #BearsNation #DaBears https://t.co/R3bMD858tD,"['Bears', 'ChicagoBears', 'BearsNation', 'DaBears']",1,0,,,bears preseason roster risers fallers browns game,0.0,-0.4,-0.4,False
1124,1563753997420331008,2022-08-28 05:03:00+00:00,BearsViews,Cleveland Browns' guard Wyatt Teller leaves game with knee injury #Bears #ChicagoBears #BearsNation #DaBears https://t.co/QelYgxXv9l,"['Bears', 'ChicagoBears', 'BearsNation', 'DaBears']",0,0,,,cleveland browns guard wyatt teller leaves game knee injury,-0.4215,-0.4,-0.8215,False
1126,1563752783735656448,2022-08-28 04:58:11+00:00,bluegrasskings,@ThePremier20 gone have a great season! Playin all last yr just helped him get ready for this yr &amp; A different system #bears #dabears #beardown #chicagobears flus &amp; Williams really like him! That's why they ain't been playing guyz like him &amp; @TY_Real1 ext cause dey ready already https://t.co/FOPFpYMKXM,"['bears', 'dabears', 'beardown', 'chicagobears']",0,0,"[User(username='ThePremier20', id=238700646, displayname='Kindle Vildor', description=None, rawDescription=None, descriptionUrls=None, verified=None, created=None, followersCount=None, friendsCount=None, statusesCount=None, favouritesCount=None, listedCount=None, mediaCount=None, location=None, protected=None, linkUrl=None, linkTcourl=None, profileImageUrl=None, profileBannerUrl=None, label=None), User(username='TY_Real1', id=227472586, displayname='Tavon Young', description=None, rawDescription=None, descriptionUrls=None, verified=None, created=None, followersCount=None, friendsCount=None, statusesCount=None, favouritesCount=None, listedCount=None, mediaCount=None, location=None, protected=None, linkUrl=None, linkTcourl=None, profileImageUrl=None, profileBannerUrl=None, label=None)]",,gone great season playin last yr helped get ready yr amp different system flus amp williams really like thats aint playing guyz like amp ext cause dey ready already,0.92,0.2333333333333333,1.1533333333333333,True
1127,1563751898720923648,2022-08-28 04:54:40+00:00,Ol_TimeFootball,"The #49ers finished 2-12
Abe Woodson 103 yard KOR TD 
Bernie Casey TD
Lisbon made the play of the year on a screen pass vs Chicago 
#49ers were the only team to beat the #Bears 
Lisbon throws a TD
JD Smith https://t.co/FRunF1Qb3y","['49ers', '49ers', 'Bears']",5,0,,,finished 2 12 abe woodson 103 yard kor td bernie casey td lisbon made play year screen pass vs chicago team beat lisbon throws td jd smith,0.34,0.0,0.34,True
1128,1563751229490188288,2022-08-28 04:52:00+00:00,BearsViews,"NFC Notes: Bears, Teven Jenkins, Eagles, Packers #Bears #ChicagoBears #BearsNation #DaBears https://t.co/bP9BTgen8I","['Bears', 'ChicagoBears', 'BearsNation', 'DaBears']",0,0,,,nfc notes bears teven jenkins eagles packers,-0.5719,0.0,-0.5719,False
1129,1563751046517760000,2022-08-28 04:51:17+00:00,GodHandGuts,"#Bears go 3-0 in the preseason, hellz yeah! 🐻👇 #BearDown https://t.co/1YBb63nKpI","['Bears', 'BearDown']",0,0,,,go 3 0 preseason hellz yeah,0.296,0.0,0.296,True
1131,1563750737942786049,2022-08-28 04:50:03+00:00,Chi_Fans,Matt Eberflus discusses finishing preseason with win | Chicago Bears #Chicago #Bears #NFL Video: https://t.co/Pk8Saa0sp1,"['Chicago', 'Bears', 'NFL']",0,0,,,matt eberflus discusses finishing preseason win chicago bears video,0.5859,0.8,1.3859,True
1132,1563750519344087043,2022-08-28 04:49:11+00:00,JohnnyOGraddy,"@windycitysp0rts @AaronLemingNFL I still dream of Metcalf lined up across from Mooney, #Bears connection is there and he could be here in 3 years at 27…",['Bears'],2,0,"[User(username='windycitysp0rts', id=1477525461676789760, displayname='WindyCitySports', description=None, rawDescription=None, descriptionUrls=None, verified=None, created=None, followersCount=None, friendsCount=None, statusesCount=None, favouritesCount=None, listedCount=None, mediaCount=None, location=None, protected=None, linkUrl=None, linkTcourl=None, profileImageUrl=None, profileBannerUrl=None, label=None), User(username='AaronLemingNFL', id=635721381, displayname='Aaron Leming', description=None, rawDescription=None, descriptionUrls=None, verified=None, created=None, followersCount=None, friendsCount=None, statusesCount=None, favouritesCount=None, listedCount=None, mediaCount=None, location=None, protected=None, linkUrl=None, linkTcourl=None, profileImageUrl=None, profileBannerUrl=None, label=None)]",,still dream metcalf lined across mooney connection could 3 years 27,0.25,0.0,0.25,True
1134,1563749017539985411,2022-08-28 04:43:13+00:00,JohnnyOGraddy,"@PodGuyFuges 2011 Cutty before the injury at 7-3 is still the best #Bears QB I have seen in my lifetime, but Fields may be that dude.",['Bears'],1,0,"[User(username='PodGuyFuges', id=558928020, displayname='Austin F', description=None, rawDescription=None, descriptionUrls=None, verified=None, created=None, followersCount=None, friendsCount=None, statusesCount=None, favouritesCount=None, listedCount=None, mediaCount=None, location=None, protected=None, linkUrl=None, linkTcourl=None, profileImageUrl=None, profileBannerUrl=None, label=None)]",,2011 cutty injury 7 3 still best qb seen lifetime fields may dude,0.34,1.0,1.34,True
1135,1563748481726021632,2022-08-28 04:41:05+00:00,bluegrasskings,I so happy for ya @dmainy_13 📍📌💯✔💙🤗🐻⬇️💎🏆💪😂🏈 in bout to go watch ta college highlights knowing busting bout to have you looking goid wit the rest of the best wr's in the @NFL #bears #dabears #beardown #chicagobears https://t.co/CRnt9BNHkP,"['bears', 'dabears', 'beardown', 'chicagobears']",1,0,"[User(username='dmainy_13', id=290802699, displayname='dante', description=None, rawDescription=None, descriptionUrls=None, verified=None, created=None, followersCount=None, friendsCount=None, statusesCount=None, favouritesCount=None, listedCount=None, mediaCount=None, location=None, protected=None, linkUrl=None, linkTcourl=None, profileImageUrl=None, profileBannerUrl=None, label=None), User(username='NFL', id=19426551, displayname='NFL', description=None, rawDescription=None, descriptionUrls=None, verified=None, created=None, followersCount=None, friendsCount=None, statusesCount=None, favouritesCount=None, listedCount=None, mediaCount=None, location=None, protected=None, linkUrl=None, linkTcourl=None, profileImageUrl=None, profileBannerUrl=None, label=None)]",,happy ya bout go watch ta college highlights knowing busting bout looking goid wit rest best wrs,0.836,0.9,1.736,True
1136,1563745695168925698,2022-08-28 04:30:01+00:00,BearsViews,"Bears 53-man roster projection: Waiver help coming at wide receiver, cornerback? #Bears #ChicagoBears #BearsNation #DaBears https://t.co/YNdhJlXYaf","['Bears', 'ChicagoBears', 'BearsNation', 'DaBears']",0,0,,,bears 53 man roster projection waiver help coming wide receiver cornerback,0.4019,-0.1,0.30189999999999995,True
1137,1563744026578255872,2022-08-28 04:23:23+00:00,MarkPotash,"The #Bears defense is feeling pretty good about itself after handling the Browns without key starters, including Roquan Smith. “When we play Week 1 we should have everybody back,"" DT Justin Jones said, ""and that’s gonna be real scary for a lot of teams.""

https://t.co/XcebbfGzqu",['Bears'],8,0,,,defense feeling pretty good handling browns without key starters including roquan smith play week 1 everybody back dt justin jones said gonna real scary lot teams,0.743,0.039999999999999994,0.783,True
1138,1563743248945913857,2022-08-28 04:20:18+00:00,Sfakia81,The only thing Matt Nagy should be thanked for is ruining Mitch who is limited and allowing the fans to watch Fields as the QB who has a much higher ceiling. #Bears,['Bears'],2,0,,,thing matt nagy thanked ruining mitch limited allowing fans watch fields qb much higher ceiling,-0.0,0.08928571428571429,0.08928571428571429,True
1139,1563743240431566848,2022-08-28 04:20:16+00:00,Fedeguti91,"Esto muchísimos Gurus del #MundoCrypto no explican estos conceptos de liquidez

Acá un ejemplo de como #BTC fue dejando Lows iguales por debajo
Rompe estructura sacudiendo #Bulls y #Bears para finalmente distribuir a la baja
#bitcoinargentina #Criptomonedas #Trading https://t.co/0Aoe1jEDNU","['MundoCrypto', 'BTC', 'Bulls', 'Bears', 'bitcoinargentina', 'Criptomonedas', 'Trading']",0,0,,,esto much simos gurus del explican estos conceptos de liquidez ac un ejemplo de como fue dejando lows iguales por debajo rompe estructura sacudiendo para finalmente distribuir la baja,-0.2023,0.2,-0.0022999999999999965,False
1141,1563741937441464322,2022-08-28 04:15:05+00:00,JordanTSilveira,"This is the type of play I expect to see from #Bears WR Velus Jones as the season goes on

I've comped Velus Jones to Lynn Bowden Jr

Told all my Dolphins fans (you know who you are) to have faith in Bowden's ""Joker"" role. Now you see why. Hope he makes it
https://t.co/dlRtmUIW57",['Bears'],16,0,,"Coordinates(longitude=-117.746489, latitude=33.557318)",type play expect see wr velus jones season goes ive comped velus jones lynn bowden jr told dolphins fans know faith bowdens joker role see hope makes,0.8225,0.0,0.8225,True
1142,1563741789567188992,2022-08-28 04:14:30+00:00,Jonathan_A_Hand,Every time I watch this I think of last year and how much Jenkins was a real one for being the only one to defend Fields…this is what an actual change in culture looks like #Bears https://t.co/gfr0tjJmKs,['Bears'],2,0,,,every time watch think last year much jenkins real one one defend fields actual change culture looks like,0.3612,0.1,0.46120000000000005,True
1145,1563740168623951875,2022-08-28 04:08:03+00:00,der_shishkaboss,One of my favorite footballisms has to be describing people as “flyin’ around.” #Bears #NFL #football https://t.co/WJ02AjRD2f,"['Bears', 'NFL', 'football']",1,0,,,one favorite footballisms describing people flyin around,0.4588,0.5,0.9588,True
1146,1563740157928407040,2022-08-28 04:08:01+00:00,BearsViews,TFC: Bears vs Browns post-game livestream #BearsFootball #BearsTalk #DaBears #BearDown #BearsFans https://t.co/BE3EMLtYUb,"['BearsFootball', 'BearsTalk', 'DaBears', 'BearDown', 'BearsFans']",0,0,,,tfc bears vs browns post game livestream,0.0,-0.4,-0.4,False
1149,1563738356202098688,2022-08-28 04:00:51+00:00,alexanderishi,This is gonna get flagged bc I’m hot and black and queer thanks Twitter lmao #bears #queers #hot https://t.co/NT4woO9jys,"['bears', 'queers', 'hot']",6,0,,,gonna get flagged bc hot black queer thanks twitter lmao,0.7783,0.22083333333333333,0.9991333333333333,True
1151,1563737641065086976,2022-08-28 03:58:01+00:00,bears_lets,Kellen Monds’ time in Minnesota is done 🫣 What a horrible performance #Bears,['Bears'],0,0,,,kellen monds time minnesota done horrible performance,-0.5423,-1.0,-1.5423,False
1152,1563737267805589504,2022-08-28 03:56:32+00:00,patrickfinley,"Dante Pettis did good, Cairo Santos doinked a FG and the #Bears went undefeated (in the preseason): 
https://t.co/D08p5g6Ohb",['Bears'],19,3,,,dante pettis good cairo santos doinked fg went undefeated preseason,0.4404,0.7,1.1404,True
1153,1563736826153959424,2022-08-28 03:54:46+00:00,SarohaAakash,"Bears monday opening be like

#StockMarket #stocks #Index #Nifty #nifty50 #banknifty #MONEY #bears #VS #Bulls https://t.co/YTZJm5EIQH","['StockMarket', 'stocks', 'Index', 'Nifty', 'nifty50', 'banknifty', 'MONEY', 'bears', 'VS', 'Bulls']",3,1,,,bears monday opening like,0.3612,0.0,0.3612,True
1155,1563735289452978176,2022-08-28 03:48:40+00:00,HamishScotBear,"https://t.co/6LoO2T380V

Ted had a job working with Elon Musk? And was the First NASA Teddy Bear! - Ted Movie

#Animals #Bears #Britishcomedy #Comedy #ElonMusk #Entertainment #Funny #Humor #Memes #Plushies #PlushVideo #PuppetShow #TeddyBear #WebSeries","['Animals', 'Bears', 'Britishcomedy', 'Comedy', 'ElonMusk', 'Entertainment', 'Funny', 'Humor', 'Memes', 'Plushies', 'PlushVideo', 'PuppetShow', 'TeddyBear', 'WebSeries']",0,0,,,ted job working elon musk first nasa teddy bear ted movie,0.0,0.25,0.25,True
1156,1563735121605398529,2022-08-28 03:48:00+00:00,BearsViews,Makeshift Bears defense holds up vs. Browns #Bears #ChicagoBears #BearsNation #DaBears https://t.co/UlRXtZpKa2,"['Bears', 'ChicagoBears', 'BearsNation', 'DaBears']",0,1,,,makeshift bears defense holds vs browns,0.128,0.0,0.128,True
1157,1563734125621743617,2022-08-28 03:44:02+00:00,PaulSolarz,"My predictions for the Chicago #Bears 53-man Roster and 16-man Practice Squad.

- Red text = injured
- Right-aligned = try to upgrade after roster cuts
- Players in the ""Release"" column are next in line for spots
- If anyone is added to the IR, take from the ""Release"" column https://t.co/uI22J9pZbB",['Bears'],0,0,,,predictions chicago 53 man roster 16 man practice squad red text injured right aligned try upgrade roster cuts players release column next line spots anyone added ir take release column,-0.5994,0.09523809523809523,-0.5041619047619048,False
1159,1563732695418642433,2022-08-28 03:38:21+00:00,optiongladiator,So far the #Bears have out hustled all 3 opponents,['Bears'],2,0,,,far hustled 3 opponents,0.0,0.1,0.1,True
1160,1563732391004446720,2022-08-28 03:37:09+00:00,sportsmockery,VIDEO: Sam Mustipher Goes Looking For Fight After Late Hit On Fields  #Bears https://t.co/gSGkQ0Ck0T https://t.co/WnU272Zpxb,['Bears'],42,4,,,video sam mustipher goes looking fight late hit fields,-0.3818,-0.3,-0.6818,False
1161,1563732353620533250,2022-08-28 03:37:00+00:00,BearsViews,Did your expectation level rise for Justin Fields &amp; the Chicago Bears offense? | CHGO Bears Postgame #BearsFootball #BearsTalk #DaBears #BearDown #BearsFans https://t.co/TNOzrhljNg,"['BearsFootball', 'BearsTalk', 'DaBears', 'BearDown', 'BearsFans']",1,0,,,expectation level rise justin fields amp chicago bears offense chgo bears postgame,-0.25,0.0,-0.25,False
1162,1563732336885243904,2022-08-28 03:36:56+00:00,ErikLambert1,VIDEO: Sam Mustipher Goes Looking For Fight After Late Hit On Fields  #Bears https://t.co/phScYUNWF9 https://t.co/0fqBKr0FVQ,['Bears'],61,2,,,video sam mustipher goes looking fight late hit fields,-0.3818,-0.3,-0.6818,False
1164,1563731507281281029,2022-08-28 03:33:38+00:00,kimscrain,Im soooo proud of the #BEARS chi lets kick some ass ♥️♥️,['BEARS'],0,0,,,im soooo proud chi lets kick ass,-0.1027,0.8,0.6973,True
1166,1563730894292226050,2022-08-28 03:31:12+00:00,JDBuffone,"Missed the #Bears game tonight, but it was completely worth it to coach these guys down in Maryland. https://t.co/gV6Eid9TJ6",['Bears'],6,0,,,missed game tonight completely worth coach guys maryland,-0.0018,-0.05000000000000002,-0.05180000000000002,False
1167,1563730810783649798,2022-08-28 03:30:52+00:00,Just_Acy,"Feelin Good, Excited for Week 1. 😬 Let’s Go! #Bears https://t.co/AvGhTWpZzn",['Bears'],1,0,,"Coordinates(longitude=-87.940033, latitude=41.644102)",feelin good excited week 1 let go,0.6486,0.5375,1.1861,True
1168,1563729585107341313,2022-08-28 03:26:00+00:00,BearsViews,Makeshift Bears defense holds up vs. Browns #Bears #ChicagoBears #BearsNation #DaBears https://t.co/pIldXmdP8u,"['Bears', 'ChicagoBears', 'BearsNation', 'DaBears']",2,1,,,makeshift bears defense holds vs browns,0.128,0.0,0.128,True
1171,1563728421460611072,2022-08-28 03:21:23+00:00,AISportsTalkPod,"Justin Fields finishes the preseason strong!👀🐻
#NFL
#Bears https://t.co/YnClEpbvv9","['NFL', 'Bears']",2,0,,,justin fields finishes preseason strong,0.5106,0.4333333333333333,0.9439333333333333,True
1172,1563728367916298240,2022-08-28 03:21:10+00:00,LawofattrGod,"How To Erase Negative Energy and Awaken To Your Dreams... https://t.co/kEq4Xaim0s

#manifestation #spiritualsunday #PositiveVibesOnly #PositiveThoughts #positivemindset #lawofattraction #affirmations #SydneySweeney #bears #bills #SpecialMaster #cnbc https://t.co/Ee0FDyfGiL","['manifestation', 'spiritualsunday', 'PositiveVibesOnly', 'PositiveThoughts', 'positivemindset', 'lawofattraction', 'affirmations', 'SydneySweeney', 'bears', 'bills', 'SpecialMaster', 'cnbc']",0,0,,,erase negative energy awaken dreams,0.0258,-0.3,-0.2742,False
1174,1563727576182431749,2022-08-28 03:18:01+00:00,wiltfongjr,My dogs were barking to start the video! Devon's internet got a little choppy! But we powered through to share some thoughts on the nice #Bears win to close out the preseason. Thanks to @LineForLinePod1 for helping me out tonight! https://t.co/rDAyH1qTtg,['Bears'],4,2,"[User(username='LineForLinePod1', id=1332653518591823873, displayname='Line For Line Podcast', description=None, rawDescription=None, descriptionUrls=None, verified=None, created=None, followersCount=None, friendsCount=None, statusesCount=None, favouritesCount=None, listedCount=None, mediaCount=None, location=None, protected=None, linkUrl=None, linkTcourl=None, profileImageUrl=None, profileBannerUrl=None, label=None)]",,dogs barking start video devons internet got little choppy powered share thoughts nice win close preseason thanks helping tonight,0.9124,0.2425,1.1549,True
1175,1563727549477306368,2022-08-28 03:17:55+00:00,ForrestGump49er,"@StatsOnFire @JohnnyVenerable Exactly!!
9ers did not even dress 3 their starting linemen.
Hardly motioned entire preseason (compared to regular season).
Week 1 we shall see!
#49ers  #Bears","['49ers', 'Bears']",1,0,"[User(username='StatsOnFire', id=25837113, displayname='Rob “Stats” Guerrera', description=None, rawDescription=None, descriptionUrls=None, verified=None, created=None, followersCount=None, friendsCount=None, statusesCount=None, favouritesCount=None, listedCount=None, mediaCount=None, location=None, protected=None, linkUrl=None, linkTcourl=None, profileImageUrl=None, profileBannerUrl=None, label=None), User(username='JohnnyVenerable', id=118596610, displayname='Johnny Venerable', description=None, rawDescription=None, descriptionUrls=None, verified=None, created=None, followersCount=None, friendsCount=None, statusesCount=None, favouritesCount=None, listedCount=None, mediaCount=None, location=None, protected=None, linkUrl=None, linkTcourl=None, profileImageUrl=None, profileBannerUrl=None, label=None)]",,exactly 9ers even dress 3 starting linemen hardly motioned entire preseason compared regular season week 1 shall see,0.0,-0.008333333333333337,-0.008333333333333337,False
1177,1563726817420255232,2022-08-28 03:15:00+00:00,BearsViews,Roquan Smith sits out after experiencing “tightness” during a workout before the game #Bears #ChicagoBears #BearsNation #DaBears https://t.co/8Feq7vhR6e,"['Bears', 'ChicagoBears', 'BearsNation', 'DaBears']",0,0,,,roquan smith sits experiencing tightness workout game,0.0,-0.4,-0.4,False
1178,1563726772629389312,2022-08-28 03:14:49+00:00,WeeklyHumorist,CARTOON: Vlads Lads ~ by Peter Kuper  And more juggling jokes of a government... Today's cartoon by Peter Kuper. https://t.co/txjxfhQdCE #bears,['bears'],2,1,,,cartoon vlads lads peter kuper juggling jokes government todays cartoon peter kuper,0.25,0.0,0.25,True
1179,1563726675942297600,2022-08-28 03:14:26+00:00,Tom__Pappalardo,@EDuerrwaechter I thought Pettis looked a lot better tonight than a lot of the #Bears WR's from 2021 did during their season.,['Bears'],1,0,"[User(username='EDuerrwaechter', id=468874786, displayname='Erik Duerrwaechter', description=None, rawDescription=None, descriptionUrls=None, verified=None, created=None, followersCount=None, friendsCount=None, statusesCount=None, favouritesCount=None, listedCount=None, mediaCount=None, location=None, protected=None, linkUrl=None, linkTcourl=None, profileImageUrl=None, profileBannerUrl=None, label=None)]",,thought pettis looked lot better tonight lot wrs 2021 season,0.4404,0.5,0.9404,True
1180,1563726620795494405,2022-08-28 03:14:13+00:00,AlreadyTakin_20,If I got a penny for every false narrative I've seen made on twitter I would be rich #Bears,['Bears'],0,0,,,got penny every false narrative ive seen made twitter would rich,0.5574,-0.012500000000000039,0.5448999999999999,True
1181,1563726617129648128,2022-08-28 03:14:12+00:00,bluegrasskings,Mane I knew it💙y'all said we ain't got no WR's but we got the best core in the NFL @Darnell_M1 @pringle_byron @VelusJr @Equanimeous @tajaesharpe @dmainy_13 @NkealHarry15 @1z0__ @NsimbaWebster @DmoeSwagg23 &amp; @Zel5Zelly &amp; @CalvinRidley1 &amp; others wanna ball wit us #bears #dabears https://t.co/9PHd7APDwc,"['bears', 'dabears']",0,0,"[User(username='Darnell_M1', id=3228565465, displayname='Darnell Mooney', description=None, rawDescription=None, descriptionUrls=None, verified=None, created=None, followersCount=None, friendsCount=None, statusesCount=None, favouritesCount=None, listedCount=None, mediaCount=None, location=None, protected=None, linkUrl=None, linkTcourl=None, profileImageUrl=None, profileBannerUrl=None, label=None), User(username='pringle_byron', id=903344249697075200, displayname='Byron Pringle', description=None, rawDescription=None, descriptionUrls=None, verified=None, created=None, followersCount=None, friendsCount=None, statusesCount=None, favouritesCount=None, listedCount=None, mediaCount=None, location=None, protected=None, linkUrl=None, linkTcourl=None, profileImageUrl=None, profileBannerUrl=None, label=None), User(username='VelusJr', id=709382365, displayname='Velus Jones Jr.⚡️', description=None, rawDescription=None, descriptionUrls=None, verified=None, created=None, followersCount=None, friendsCount=None, statusesCount=None, favouritesCount=None, listedCount=None, mediaCount=None, location=None, protected=None, linkUrl=None, linkTcourl=None, profileImageUrl=None, profileBannerUrl=None, label=None), User(username='Equanimeous', id=600424086, displayname='Equanimeous', description=None, rawDescription=None, descriptionUrls=None, verified=None, created=None, followersCount=None, friendsCount=None, statusesCount=None, favouritesCount=None, listedCount=None, mediaCount=None, location=None, protected=None, linkUrl=None, linkTcourl=None, profileImageUrl=None, profileBannerUrl=None, label=None), User(username='tajaesharpe', id=313005431, displayname='Show', description=None, rawDescription=None, descriptionUrls=None, verified=None, created=None, followersCount=None, friendsCount=None, statusesCount=None, favouritesCount=None, listedCount=None, mediaCount=None, location=None, protected=None, linkUrl=None, linkTcourl=None, profileImageUrl=None, profileBannerUrl=None, label=None), User(username='dmainy_13', id=290802699, displayname='dante', description=None, rawDescription=None, descriptionUrls=None, verified=None, created=None, followersCount=None, friendsCount=None, statusesCount=None, favouritesCount=None, listedCount=None, mediaCount=None, location=None, protected=None, linkUrl=None, linkTcourl=None, profileImageUrl=None, profileBannerUrl=None, label=None), User(username='NkealHarry15', id=855641011, displayname='Keal', description=None, rawDescription=None, descriptionUrls=None, verified=None, created=None, followersCount=None, friendsCount=None, statusesCount=None, favouritesCount=None, listedCount=None, mediaCount=None, location=None, protected=None, linkUrl=None, linkTcourl=None, profileImageUrl=None, profileBannerUrl=None, label=None), User(username='1z0__', id=2445910502, displayname='zay coulter', description=None, rawDescription=None, descriptionUrls=None, verified=None, created=None, followersCount=None, friendsCount=None, statusesCount=None, favouritesCount=None, listedCount=None, mediaCount=None, location=None, protected=None, linkUrl=None, linkTcourl=None, profileImageUrl=None, profileBannerUrl=None, label=None), User(username='NsimbaWebster', id=1925781588, displayname='NSimba Webster 🇨🇩', description=None, rawDescription=None, descriptionUrls=None, verified=None, created=None, followersCount=None, friendsCount=None, statusesCount=None, favouritesCount=None, listedCount=None, mediaCount=None, location=None, protected=None, linkUrl=None, linkTcourl=None, profileImageUrl=None, profileBannerUrl=None, label=None), User(username='DmoeSwagg23', id=984865986, displayname='David Moore-The_OVO_Duke™', description=None, rawDescription=None, descriptionUrls=None, verified=None, created=None, followersCount=None, friendsCount=None, statusesCount=None, favouritesCount=None, listedCount=None, mediaCount=None, location=None, protected=None, linkUrl=None, linkTcourl=None, profileImageUrl=None, profileBannerUrl=None, label=None), User(username='Zel5Zelly', id=1250480924929777667, displayname='Denzel Mims', description=None, rawDescription=None, descriptionUrls=None, verified=None, created=None, followersCount=None, friendsCount=None, statusesCount=None, favouritesCount=None, listedCount=None, mediaCount=None, location=None, protected=None, linkUrl=None, linkTcourl=None, profileImageUrl=None, profileBannerUrl=None, label=None), User(username='CalvinRidley1', id=2940825399, displayname='CALVIN RIDLEY', description=None, rawDescription=None, descriptionUrls=None, verified=None, created=None, followersCount=None, friendsCount=None, statusesCount=None, favouritesCount=None, listedCount=None, mediaCount=None, location=None, protected=None, linkUrl=None, linkTcourl=None, profileImageUrl=None, profileBannerUrl=None, label=None)]",,mane knew yall said aint got wrs got best core nfl amp amp amp others wanna ball wit us,0.6369,1.0,1.6369,True
