,ID,Date,User,Tweet,HashTags,Likes,Retweets,MentionUsers,LocationCoordinates,clean_Tweet,NLTK_Sentiment_Analysis,TextBlob_Sentiment_Analysis,Compound_Sentiment_Score,Positive_Sentiment
597,1564052809259126784,2022-08-29 00:50:23+00:00,robertkschmitz,"Completely agree with Rishab — the 2022 #Bears look like they should finish within a 5-7 win “cloud”, but the important part is that they should be competitive in almost every game they play.

Way less blowouts, more close losses imho. For an under-talented team, that’s perfect! https://t.co/gSStcZL35l",['Bears'],85,1,,,completely agree rishab 2022 look like finish within 5 7 win cloud important part competitive almost every game play way less blowouts close losses imho talented team perfect,0.9538,0.34761904761904766,1.3014190476190477,True
598,1564052334237437953,2022-08-29 00:48:29+00:00,Jonathan_A_Hand,Same here I said at the beginning of camp I thought 6-7 wins if games don’t fall their way and 9-10 if they do…only thing that’s changed is I’m leaning towards the latter based on the eye test and the way this staff calls games and coaches. #bears https://t.co/SjtykZmknU,['bears'],1,0,,,said beginning camp thought 6 7 wins games fall way 9 10 thing changed leaning towards latter based eye test way staff calls games coaches,0.5719,0.15,0.7219,True
599,1564050653772750850,2022-08-29 00:41:49+00:00,WillGrayPSN,David Montgomery’s vision/cuts was some top 10 back shit yesterday. #Bears https://t.co/IqPnP0eL2W,['Bears'],1,0,,,david montgomery vision cuts top 10 back shit yesterday,-0.4588,0.09999999999999999,-0.3588,False
600,1564050260334465026,2022-08-29 00:40:15+00:00,BarroomNetwork,"Louis Riddick blocking thousands of #Bears fans who are giving him shit. And, he wanted to be the team
s GM??? He wouldn't last a season being so sensitive.",['Bears'],200,15,,,louis riddick blocking thousands fans giving shit wanted team gm wouldnt last season sensitive,-0.5859,-0.03333333333333333,-0.6192333333333333,False
601,1564049785253937152,2022-08-29 00:38:22+00:00,T_BoneSteak426,this whole thread is a must read for #Bears fans https://t.co/ZkbLpxL20h,['Bears'],2,0,,,whole thread must read fans,0.0,0.2,0.2,True
602,1564048795087695872,2022-08-29 00:34:26+00:00,JordanTSilveira,"#Bears hit this same Y wheel for Fields' 3rd TD pass.

- ""Spear"" concept for the 1st &amp; 2nd progression
- MOFO negates this⬆️desired conflict (good on CLE)
- Y Wheel (Kmet) becomes the flood ""alert""
- F (Blasingame) emulates sift block for split zone run (flat outlet)
- SOL? RUN! https://t.co/4hmJJG5BSd",['Bears'],4,1,,,hit wheel fields 3rd td pass spear concept 1st amp 2nd progression mofo negates desired conflict good cle wheel kmet becomes flood alert f blasingame emulates sift block split zone run flat outlet sol run,-0.34,0.16874999999999998,-0.17125000000000004,False
603,1564048767539707906,2022-08-29 00:34:19+00:00,LittleManPower,#ShibArmy News: #Bears Cant Tame #Bone As Exchange Listings Now Seem Imminent https://t.co/6cASNFLrvV via @theshibdream,"['ShibArmy', 'Bears', 'Bone']",2,1,"[User(username='theshibdream', id=1449246435472551936, displayname='Shib Dream * Shiba Inu News * ShibArmy.co 💎', description=None, rawDescription=None, descriptionUrls=None, verified=None, created=None, followersCount=None, friendsCount=None, statusesCount=None, favouritesCount=None, listedCount=None, mediaCount=None, location=None, protected=None, linkUrl=None, linkTcourl=None, profileImageUrl=None, profileBannerUrl=None, label=None)]",,news cant tame exchange listings seem imminent via,0.0,-0.21666666666666667,-0.21666666666666667,False
604,1564047442756370433,2022-08-29 00:29:03+00:00,michael67216479,"#Cliparts #Wall_sign #Wild #Bears #Branches bear branches clipart HQYvr High quality free Dxf files, Svg, Cdr and Ai Ready to cut for laser Cnc plasma and Download Instantly Cliparts, Wall sign, Wild, Bears, Branches https://t.co/TqCwNWcJ28 https://t.co/TJPwmgKYHM","['Cliparts', 'Wall_sign', 'Wild', 'Bears', 'Branches']",0,0,,,bear branches clipart hqyvr high quality free dxf files svg cdr ai ready cut laser cnc plasma download instantly cliparts wall sign wild bears branches,0.5719,0.172,0.7439,True
606,1564045933519708160,2022-08-29 00:23:03+00:00,ErikLambert1,"10. Final cuts are due on Tuesday, August 30th.

So it will be August 31st when waiver claims start coming in.

I expect OL, DT, WR, and CB to be potential targets for the #Bears.

They sit 7th in the waiver priority, so Ryan Poles has a chance to land some guys.",['Bears'],93,2,,,10 final cuts due tuesday august 30th august 31st waiver claims start coming expect ol dt wr cb potential targets sit 7th waiver priority ryan poles chance land guys,-0.0516,-0.041666666666666664,-0.09326666666666666,False
607,1564045931749801984,2022-08-29 00:23:03+00:00,ErikLambert1,"9. The #Bears as a team, including all three phases, committed a total of 8 penalties across three preseason games.

For context, their Week 1 opponent, the 49ers, had 11 in their preseason finale alone.

That is an excellent bit of coaching by Matt Eberflus.",['Bears'],149,8,,,9 team including three phases committed total 8 penalties across three preseason games context week 1 opponent 49ers 11 preseason finale alone excellent bit coaching matt eberflus,0.5859,0.5,1.0859,True
608,1564045927152816130,2022-08-29 00:23:02+00:00,ErikLambert1,"8. One maddening thing about Matt Nagy as a play caller was his inability to get his QB some ""freebies.""

Those are quick throws that gain 4-6 yards. It's a great way to establish a rhythm.

Luke Getsy has done that repeatedly for Fields. It makes a world of difference.  #Bears https://t.co/xPd7S9Yd9g",['Bears'],139,6,,,8 one maddening thing matt nagy play caller inability get qb freebies quick throws gain 4 6 yards great way establish rhythm luke getsy done repeatedly fields makes world difference,0.7783,0.5666666666666667,1.3449666666666666,True
609,1564045891153104897,2022-08-29 00:22:53+00:00,ErikLambert1,"7. Cornerback feels like a position the #Bears may target on waivers.

The depth behind Johnson and Gordon is suspect.

Only Greg Stroman may crack the roster. He's allowed 2 catches on 6 targets with an INT.

The injuries to Tavon Young and Thomas Graham loom large here.",['Bears'],59,4,,,7 cornerback feels like position may target waivers depth behind johnson gordon suspect greg stroman may crack roster hes allowed 2 catches 6 targets int injuries tavon young thomas graham loom large,-0.1531,-0.02857142857142859,-0.1816714285714286,False
610,1564045889605451776,2022-08-29 00:22:53+00:00,ErikLambert1,"6. Few things determine how valuable a linebacker is more than how they do in pass coverage.

Jack Sanborn was targeted 12 times, allowed only 5 catches, and had an INT.

The other is special teams.

Joe Thomas led with three tackles in punt and kick coverage.

#Bears",['Bears'],73,5,,,6 things determine valuable linebacker pass coverage jack sanborn targeted 12 times allowed 5 catches int special teams joe thomas led three tackles punt kick coverage,0.7003,0.35714285714285715,1.0574428571428571,True
611,1564045887759843333,2022-08-29 00:22:52+00:00,ErikLambert1,"5. If we're being honest, Sam Kamara and Trevon Coley should make the roster. 

They combined for 20 pressures and 3 sacks.

Khyiris Tonga had zero pressures. Mario Edwards Jr. has been hurt all month.

If this is really a competition, they lost.  #Bears",['Bears'],70,4,,,5 honest sam kamara trevon coley make roster combined 20 pressures 3 sacks khyiris tonga zero pressures mario edwards jr hurt month really competition lost,-0.7414,0.4,-0.3413999999999999,False
612,1564045881002889217,2022-08-29 00:22:51+00:00,ErikLambert1,"4. The biggest surprise of the #Bears' preseason? That has to be Isaiah Coulter.

He consistently made plays in every game, finishing with 8 catches for 112 yards. Six of those catches resulted in 1st downs.

If anybody earned it on the field, it was him. https://t.co/kQOJ6tukBC",['Bears'],78,5,,,4 biggest surprise preseason isaiah coulter consistently made plays every game finishing 8 catches 112 yards six catches resulted 1st downs anybody earned field,0.4767,-0.07500000000000001,0.4017,True
613,1564045817274634243,2022-08-29 00:22:36+00:00,ErikLambert1,"3. Teven Jenkins allowed one pressure on the QB across 31 pass-blocking snaps, and that pressure wasn't really his fault.

Again, he didn't switch to guard until AFTER the first preseason game.

His transition has been fairly remarkable.  #Bears https://t.co/RlFJmRgbUL",['Bears'],137,9,,,3 teven jenkins allowed one pressure qb across 31 pass blocking snaps pressure wasnt really fault didnt switch guard first preseason game transition fairly remarkable,0.0193,0.2,0.21930000000000002,True
614,1564045795371933699,2022-08-29 00:22:30+00:00,ErikLambert1,"2. Cole Kmet is going to be a revelation in 2022.

Across less than three quarters of football, he has five catches for 67 yards and a touchdown on six targets.

This offense utilizes him so much better, and he's demonstrating an ability to get open.

#Bears https://t.co/IBZjFCwx7d",['Bears'],168,9,,,2 cole kmet going revelation 2022 across less three quarters football five catches 67 yards touchdown six targets offense utilizes much better hes demonstrating ability get open,0.4939,0.11111111111111112,0.6050111111111112,True
615,1564045756700545030,2022-08-29 00:22:21+00:00,ErikLambert1,"1. People wanted to see progress from Justin Fields.

His passer ratings from each preseason game:

Week 1 - 78.3
Week 2 - 84.8
Week 3 - 146.9

Those numbers aren't deceiving. His improvement shows on tape too. The confidence is growing.  #Bears https://t.co/5tpjsDsKO6",['Bears'],670,66,,,1 people wanted see progress justin fields passer ratings preseason game week 1 78 3 week 2 84 8 week 3 146 9 numbers arent deceiving improvement shows tape confidence growing,0.7473,-0.4,0.34729999999999994,True
616,1564044269563924481,2022-08-29 00:16:27+00:00,FuriousGeorge94,#Bears Twitter. This is the Lions fan with egregious Bears takes. Have at him. Do your thing.,['Bears'],4,0,,,twitter lions fan egregious bears takes thing,0.3182,0.0,0.3182,True
617,1564043909537435653,2022-08-29 00:15:01+00:00,LaughOutNOW,"New Standup Comedy 101 course! Sept 8th Milwaukee, Chicago Oct 10th, Ft. Meyers Dec 15th (free night), FL January 10th  c  https://t.co/kD4RVP4IaV c https://t.co/rSyN30Xmge c https://t.co/eJLTrEurYs c #bears #chicago #bears #florida #dolphins #usa #miami #ftmyers #naplesfl","['bears', 'chicago', 'bears', 'florida', 'dolphins', 'usa', 'miami', 'ftmyers', 'naplesfl']",1,0,,,new standup comedy 101 course sept 8th milwaukee chicago oct 10th ft meyers dec 15th free night fl january 10th c c c c,0.7003,0.2681818181818182,0.9684818181818182,True
618,1564042322559524877,2022-08-29 00:08:42+00:00,StalinMeerkat,"#Learning #Animals #Bears #CareersAdvice #Comedy #Cute #Jobs #Laugh #Lol #StuffedAnimals #Teddy #TeddyBear #Toys 

Ground Control To Major Freddy - You cant be a racing car driver!

https://t.co/Sve1rI4SA1","['Learning', 'Animals', 'Bears', 'CareersAdvice', 'Comedy', 'Cute', 'Jobs', 'Laugh', 'Lol', 'StuffedAnimals', 'Teddy', 'TeddyBear', 'Toys']",0,0,,,ground control major freddy cant racing car driver,0.0,0.0625,0.0625,True
619,1564041997803032578,2022-08-29 00:07:25+00:00,BearsDieHardFan,So how bout that #Bears defense pitching a shutout missing 4 of their best players?! @espn @AdamHoge,['Bears'],1,0,"[User(username='espn', id=2557521, displayname='ESPN', description=None, rawDescription=None, descriptionUrls=None, verified=None, created=None, followersCount=None, friendsCount=None, statusesCount=None, favouritesCount=None, listedCount=None, mediaCount=None, location=None, protected=None, linkUrl=None, linkTcourl=None, profileImageUrl=None, profileBannerUrl=None, label=None), User(username='AdamHoge', id=121509578, displayname='Adam Hoge', description=None, rawDescription=None, descriptionUrls=None, verified=None, created=None, followersCount=None, friendsCount=None, statusesCount=None, favouritesCount=None, listedCount=None, mediaCount=None, location=None, protected=None, linkUrl=None, linkTcourl=None, profileImageUrl=None, profileBannerUrl=None, label=None)]","Coordinates(longitude=-83.02068, latitude=38.726819)",bout defense pitching shutout missing 4 best players,0.5423,0.4,0.9423,True
621,1564039654986358786,2022-08-28 23:58:06+00:00,Abzz_6,@LRiddickESPN our #Bears space hw assignment was to get blocked by you so I don’t wanna be that group member who does nothing and gets credit. Can you help me out here? Ain’t no way these #Bears are gonna be the worst team in the league.,"['Bears', 'Bears']",0,0,"[User(username='LRiddickESPN', id=1577522323, displayname='Louis Riddick', description=None, rawDescription=None, descriptionUrls=None, verified=None, created=None, followersCount=None, friendsCount=None, statusesCount=None, favouritesCount=None, listedCount=None, mediaCount=None, location=None, protected=None, linkUrl=None, linkTcourl=None, profileImageUrl=None, profileBannerUrl=None, label=None)]",,space hw assignment get blocked wanna group member nothing gets credit help way gonna worst team league,-0.8639,-1.0,-1.8639000000000001,False
622,1564039378544070658,2022-08-28 23:57:00+00:00,BearsViews,Justin Fields Ready for Regular Season #Bears #ChicagoBears #BearsNation #DaBears https://t.co/vBQRNeIg5i,"['Bears', 'ChicagoBears', 'BearsNation', 'DaBears']",0,0,,,justin fields ready regular season,0.3612,0.1,0.46120000000000005,True
623,1564038215119474688,2022-08-28 23:52:23+00:00,ryanbmc_,"The #Bears were the only road team to win in Preseason Week 3

Home teams went 15-1",['Bears'],1,0,,,road team win preseason week 3 home teams went 15 1,0.5859,0.8,1.3859,True
626,1564035351622066178,2022-08-28 23:41:00+00:00,BearsViews,ECD’s Takes on the Bears’ pre-season win against the Browns #BearsFootball #BearsTalk #DaBears #BearDown #BearsFans https://t.co/yBKck1IaBI,"['BearsFootball', 'BearsTalk', 'DaBears', 'BearDown', 'BearsFans']",0,0,,,ecd takes bears pre season win browns,0.5859,0.8,1.3859,True
627,1564034351062556676,2022-08-28 23:37:02+00:00,HalatekHall,"I know it’s ONLY preseason,
But leaving this right here 
#Bears https://t.co/kOO0gnQR08",['Bears'],0,0,,,know preseason leaving right,0.0,0.2857142857142857,0.2857142857142857,True
628,1564033993414172674,2022-08-28 23:35:37+00:00,paytonsun,I went to bed last night and had dreams about this throw. Luke Getsy seems like he's just what the doc ordered for Justin Fields. #Bears https://t.co/yCLHZHbYcx,['Bears'],383,17,,,went bed last night dreams throw luke getsy seems like hes doc ordered justin fields,0.6369,0.0,0.6369,True
629,1564033336032493571,2022-08-28 23:33:00+00:00,DailySkog,"School starts tomorrow, and I've devised a magnificent plan.
They'll never notice... 🤫
- - - - - - - - - -
Get your own Skoggy friend here: https://t.co/zrgnUxjUte
- - - - - - - - - -
#djungelskog #bears #panda #BackToSchool https://t.co/F4HHBxzeOj","['djungelskog', 'bears', 'panda', 'BackToSchool']",4,1,,,school starts tomorrow ive devised magnificent plan theyll never notice get skoggy friend,0.7964,1.0,1.7964,True
630,1564032326539018242,2022-08-28 23:28:59+00:00,Tylow237,"#Bears Twitter on January 12th:

""THE BEARS SHOULD HIRE LOUIS RIDDICK TO BE THE NEXT GM.""

Bears Twitter today, August 28th:

""WE'RE GOING TO FUCK WITH LOUIS RIDDICK UNTIL HE BLOCKS US ALL!""

Things change quickly in these Twitter streets.",['Bears'],157,8,,,twitter january 12th bears hire louis riddick next gm bears twitter today august 28th going fuck louis riddick blocks us things change quickly twitter streets,-0.6597,-0.022222222222222237,-0.6819222222222222,False
631,1564031699201179648,2022-08-28 23:26:30+00:00,djdurkin,"Talked about this over a year ago. Grateful that #GetsyGetsIt, #Bears fans. https://t.co/gtBd1Snd7J https://t.co/svBYNsvfTg","['GetsyGetsIt', 'Bears']",51,3,,,talked year ago grateful fans,0.4588,0.0,0.4588,True
632,1564030471436206086,2022-08-28 23:21:37+00:00,Joe_Olmo,Kyler Gordon better be special. #Bears https://t.co/12dWm992CS,['Bears'],0,0,,,kyler gordon better special,0.6808,0.4285714285714286,1.1093714285714285,True
633,1564029979524239361,2022-08-28 23:19:40+00:00,aninatrans_en,"It is a list of Youtube shooting polar bears. Please take a look by all means.

https://t.co/CT1i1OlwKa

#bears #zoo #japan","['bears', 'zoo', 'japan']",0,0,,,list youtube shooting polar bears please take look means,0.3182,-0.08333333333333333,0.23486666666666667,True
634,1564029571346956293,2022-08-28 23:18:02+00:00,raw_chili,"Cole Kmet just posted this on his IG story. Feels like there’s a culture building 😤. 
 
https://t.co/BU9HcQ0h6c
 
#Bears #Chicago #ChicagoBears #Football #Illinois #NationalFootballConference #NationalFootballConferenceNorthDivision #NationalFootballLeague #NFL https://t.co/lfDRqLErR3","['Bears', 'Chicago', 'ChicagoBears', 'Football', 'Illinois', 'NationalFootballConference', 'NationalFootballConferenceNorthDivision', 'NationalFootballLeague', 'NFL']",1,0,,,cole kmet posted ig story feels like culture building,0.3612,0.0,0.3612,True
635,1564029309492219905,2022-08-28 23:17:00+00:00,bears_insider,"The #Bears must cut the roster from 80 players to 53 by Tuesday. After watching every practice and every preseason game, Shaw Local Bears beat writer @sean_hammond attempts to predict the 53-man roster.

https://t.co/tynYO6s1bU",['Bears'],1,1,"[User(username='sean_hammond', id=44018318, displayname='Sean Hammond', description=None, rawDescription=None, descriptionUrls=None, verified=None, created=None, followersCount=None, friendsCount=None, statusesCount=None, favouritesCount=None, listedCount=None, mediaCount=None, location=None, protected=None, linkUrl=None, linkTcourl=None, profileImageUrl=None, profileBannerUrl=None, label=None)]",,must cut roster 80 players 53 tuesday watching every practice every preseason game shaw local bears beat writer attempts predict 53 man roster,-0.2732,-0.2,-0.4732,False
636,1564028561186557952,2022-08-28 23:14:01+00:00,Soxsideboys_,@kimcheesal @Disone10 @KFidds @MitchKaminski99 Dang was hoping a car OOS since 09 would have a title more recently than the #WhiteSox #Bulls #Bears to just add a cherry on top of my sports misery,"['WhiteSox', 'Bulls', 'Bears']",1,0,"[User(username='kimcheesal', id=58339654, displayname='White Sox Sal 🇹🇼🇭🇰🇺🇦⚾⚾', description=None, rawDescription=None, descriptionUrls=None, verified=None, created=None, followersCount=None, friendsCount=None, statusesCount=None, favouritesCount=None, listedCount=None, mediaCount=None, location=None, protected=None, linkUrl=None, linkTcourl=None, profileImageUrl=None, profileBannerUrl=None, label=None), User(username='Disone10', id=1024853762022801409, displayname='DISONE YAHDOG', description=None, rawDescription=None, descriptionUrls=None, verified=None, created=None, followersCount=None, friendsCount=None, statusesCount=None, favouritesCount=None, listedCount=None, mediaCount=None, location=None, protected=None, linkUrl=None, linkTcourl=None, profileImageUrl=None, profileBannerUrl=None, label=None), User(username='KFidds', id=39708882, displayname='The Reverend KFidds', description=None, rawDescription=None, descriptionUrls=None, verified=None, created=None, followersCount=None, friendsCount=None, statusesCount=None, favouritesCount=None, listedCount=None, mediaCount=None, location=None, protected=None, linkUrl=None, linkTcourl=None, profileImageUrl=None, profileBannerUrl=None, label=None), User(username='MitchKaminski99', id=902911126744293377, displayname='Mitchell Kaminski', description=None, rawDescription=None, descriptionUrls=None, verified=None, created=None, followersCount=None, friendsCount=None, statusesCount=None, favouritesCount=None, listedCount=None, mediaCount=None, location=None, protected=None, linkUrl=None, linkTcourl=None, profileImageUrl=None, profileBannerUrl=None, label=None)]",,dang hoping car oos since 09 would title recently add cherry top sports misery,-0.0258,0.25,0.2242,True
637,1564027801711398915,2022-08-28 23:11:00+00:00,BearsViews,Justin Fields sounds off on potential of a promising Bears WR ahead of 2022 season #Bears #ChicagoBears #BearsNation #DaBears https://t.co/8UMD6ooPn9,"['Bears', 'ChicagoBears', 'BearsNation', 'DaBears']",0,0,,,justin fields sounds potential promising bears wr ahead 2022 season,0.4019,0.1,0.5019,True
638,1564027487365091330,2022-08-28 23:09:45+00:00,WCGridiron,"This week's Bear &amp; Balanced from @gridironborn &amp; @wiltfongjr was their final preseason show, but they still fire off their usual categories of:

☑️Trench Tribute
☑️Sweet Tweets
☑️Caught up in a numbers game
☑️The Fields Report
☑️The 3 #Bears

🐻⬇️&amp;🔊⬆️:
 https://t.co/9u8BjJLX20",['Bears'],8,4,"[User(username='gridironborn', id=2393170344, displayname='Jeff Berckes', description=None, rawDescription=None, descriptionUrls=None, verified=None, created=None, followersCount=None, friendsCount=None, statusesCount=None, favouritesCount=None, listedCount=None, mediaCount=None, location=None, protected=None, linkUrl=None, linkTcourl=None, profileImageUrl=None, profileBannerUrl=None, label=None), User(username='wiltfongjr', id=372868698, displayname='Lester A. Wiltfong Jr.', description=None, rawDescription=None, descriptionUrls=None, verified=None, created=None, followersCount=None, friendsCount=None, statusesCount=None, favouritesCount=None, listedCount=None, mediaCount=None, location=None, protected=None, linkUrl=None, linkTcourl=None, profileImageUrl=None, profileBannerUrl=None, label=None)]",,weeks bear amp balanced amp final preseason show still fire usual categories trench tribute sweet tweets caught numbers game fields report 3 amp,0.1531,-0.07500000000000001,0.0781,True
639,1564027134267514881,2022-08-28 23:08:21+00:00,kensgotbs,"In the 2017 #Bears fans wanted rookie 1st rd draft pick Mitch Trubisky to start over the veteran free agent QB Mike Glennon. 
5 years later Trubisky signs as a FA with the #Steelers &amp; many Steelers fans want rookie Kenny Pickett to start. 

Mitch Trubisky: https://t.co/o2vXJvMbEF","['Bears', 'Steelers']",1,0,,,2017 fans wanted rookie 1st rd draft pick mitch trubisky start veteran free agent qb mike glennon 5 years later trubisky signs fa amp many steelers fans want rookie kenny pickett start mitch trubisky,0.5574,0.225,0.7824,True
640,1564025866606231553,2022-08-28 23:03:19+00:00,EDuerrwaechter,Plenty to love from Saturday night for the #Bears. But one former OC from the Windy City ain’t getting no love from me any time soon. https://t.co/fxvvSyozgS,['Bears'],2,2,,,plenty love saturday night one former oc windy city getting love time soon,0.8555,0.3333333333333333,1.1888333333333334,True
641,1564025613949747203,2022-08-28 23:02:19+00:00,BearsViews,Justin Fields Sounds Off on Potential of a Promising Bears WR Ahead of 2022 Season #Bears #ChicagoBears #BearsNation #DaBears https://t.co/QvhVThFvzn,"['Bears', 'ChicagoBears', 'BearsNation', 'DaBears']",1,0,,,justin fields sounds potential promising bears wr ahead 2022 season,0.4019,0.1,0.5019,True
642,1564025548204085249,2022-08-28 23:02:03+00:00,WCGridiron,"Our guy @EDuerrwaechter shares his thoughts on the #Bears’ pre-season finale. 

And channels his inner Jay Cutler along the way. https://t.co/MDlke0Rcji",['Bears'],4,1,"[User(username='EDuerrwaechter', id=468874786, displayname='Erik Duerrwaechter', description=None, rawDescription=None, descriptionUrls=None, verified=None, created=None, followersCount=None, friendsCount=None, statusesCount=None, favouritesCount=None, listedCount=None, mediaCount=None, location=None, protected=None, linkUrl=None, linkTcourl=None, profileImageUrl=None, profileBannerUrl=None, label=None)]",,guy shares thoughts pre season finale channels inner jay cutler along way,0.296,0.0,0.296,True
643,1564025324140118016,2022-08-28 23:01:10+00:00,BearsViews,Why David Montgomery's Physicality Is 'Game-Changer' for Bears' Offense #Bears #ChicagoBears #BearsNation #DaBears https://t.co/2z8OnDh9J5,"['Bears', 'ChicagoBears', 'BearsNation', 'DaBears']",2,0,,,david montgomerys physicality game changer bears offense,-0.25,-0.4,-0.65,False
644,1564024335941222402,2022-08-28 22:57:14+00:00,SwiftyNetwork,"Is the NFL Ready for Justin Fields and Luke Getsy?

Breakdown on Justin Fields and the 1st Team Offense

Full Film Review

Knowledge Over Narratives

#Bears #BearsNation #DaBears #NFL 

Watch:📺
https://t.co/YH4cfm9CwM","['Bears', 'BearsNation', 'DaBears', 'NFL']",24,5,,,nfl ready justin fields luke getsy breakdown justin fields 1st team offense full film review knowledge narratives watch,0.128,0.275,0.403,True
645,1564024198657413122,2022-08-28 22:56:41+00:00,EDuerrwaechter,"For all my endless tweets on the #Bears receiving corps, there’s one possibility I feel is imminent. And would help to describe why the current group is as such. 

The passing game is going to emphasize the use of tight ends in many ways. Cole Kmet will see a ton of looks.",['Bears'],5,0,,,endless tweets receiving corps one possibility feel imminent would help describe current group passing game going emphasize use tight ends many ways cole kmet see ton looks,0.4019,-0.040714285714285724,0.3611857142857143,True
646,1564023658959568897,2022-08-28 22:54:33+00:00,EDuerrwaechter,"If I had it my way, with the current group, the top receivers for the #Bears are: 

- Darnell Mooney 
- Dante Pettis 
- Velus Jones Jr. (slot to start) 

I’m maintaining my stance we’ll see Ryan Poles being active in the waiver wire for receivers, too.",['Bears'],5,0,,,way current group top receivers darnell mooney dante pettis velus jones jr slot start maintaining stance see ryan poles active waiver wire receivers,0.5423,0.12222222222222223,0.6645222222222222,True
