,ID,Date,User,Tweet,HashTags,Likes,Retweets,MentionUsers,LocationCoordinates,clean_Tweet,NLTK_Sentiment_Analysis,TextBlob_Sentiment_Analysis,Compound_Sentiment_Score,Positive_Sentiment
1899,1563676790870233090,2022-08-27 23:56:13+00:00,BearReport,That's a nice play by Vildor there. #Bears,['Bears'],2,0,,,thats nice play vildor,0.6369,0.6,1.2368999999999999,True
1900,1563676758867644417,2022-08-27 23:56:05+00:00,clayharbs82,Great protection. Great route. Great pass. Keep the Bears slander coming! I think these guys love it. #DaBears https://t.co/lKn9FEfz4R,['DaBears'],99,4,,"Coordinates(longitude=-87.940033, latitude=41.644102)",great protection great route great pass keep bears slander coming think guys love,0.9552,0.7250000000000001,1.6802000000000001,True
1901,1563676718174535681,2022-08-27 23:55:55+00:00,3PointStansPod,So hyped for Pettis &amp; the Bears WRs to show what they are made of while not having to buried behind WRs on other teams. #DABEARS,['DABEARS'],1,0,,,hyped pettis amp bears wrs show made buried behind wrs teams,0.0,-0.4,-0.4,False
1902,1563676665900843008,2022-08-27 23:55:43+00:00,jxhn________,Look.. it’s preseason. The Browns have some of their key players on the bench. None of that matters to me. Fields is out there hitting all of his spots. The #Bears look like a well oiled machine. There is real reason for optimism. https://t.co/PuylQmTwRn,['Bears'],1,0,,,look preseason browns key players bench none matters fields hitting spots look like well oiled machine real reason optimism,0.7921,0.1,0.8921,True
1903,1563676654941216772,2022-08-27 23:55:40+00:00,BearsPR,"#Bears injury update:
DL Dominique Robinson (leg) is questionable to return.",['Bears'],205,36,,,injury update dl dominique robinson leg questionable return,-0.6124,-0.5,-1.1124,False
1904,1563676544865898496,2022-08-27 23:55:14+00:00,Josh_Frydman,"Great route by Pettis, but pay attention to the clean pocket for Fields. O-line handling the 4-man rush with no problem to give Fields time and an easy pitch and catch. #Bears https://t.co/BwMdJSjm5a",['Bears'],5,3,,,great route pettis pay attention clean pocket fields line handling 4 man rush problem give fields time easy pitch catch,0.765,0.5333333333333333,1.2983333333333333,True
1905,1563676497503653891,2022-08-27 23:55:03+00:00,manolo_smolo,"Teams are scared that Justin Fields can run, hence the cheap shot taken on this play. #Bears 🐻⬇️ https://t.co/X6oqlpgHXy",['Bears'],2,1,,,teams scared justin fields run hence cheap shot taken play,-0.128,0.4,0.272,True
1906,1563676383725121541,2022-08-27 23:54:36+00:00,StanFinger,So Fields looks good against the junior varsity. #Bears,['Bears'],1,0,,,fields looks good junior varsity,0.4404,0.7,1.1404,True
1907,1563676341249212416,2022-08-27 23:54:26+00:00,Zeus_NYC,"Justin Fields is Him !!
#Bears are very disciplined and ver organized. They will surprise lot of teams despite not having household names.",['Bears'],0,0,,,justin fields disciplined ver organized surprise lot teams despite household names,0.2732,0.0,0.2732,True
1910,1563676314212519937,2022-08-27 23:54:19+00:00,JackLydon63,Pettis must must have seen Henry West’s touchdown catch last night in the @DePaulPrepFB game. Same route. Same result. #Bears,['Bears'],10,3,"[User(username='DePaulPrepFB', id=719529160855719936, displayname='DePaulPrepFB', description=None, rawDescription=None, descriptionUrls=None, verified=None, created=None, followersCount=None, friendsCount=None, statusesCount=None, favouritesCount=None, listedCount=None, mediaCount=None, location=None, protected=None, linkUrl=None, linkTcourl=None, profileImageUrl=None, profileBannerUrl=None, label=None)]",,pettis must must seen henry west touchdown catch last night game route result,0.0,-0.2,-0.2,False
1911,1563676247544123392,2022-08-27 23:54:03+00:00,ChiSportsBums,"Hot take: Bears will have a middle of the league offense and win over 5.5 games. 

#BearDown #DaBears","['BearDown', 'DaBears']",2,0,,,hot take bears middle league offense win 5 5 games,0.4215,0.35000000000000003,0.7715000000000001,True
1912,1563676246089023488,2022-08-27 23:54:03+00:00,RAEsJukeJoint,You asked for TDs well here’s the second TD throw by JF1 to Pettis. Offense looks like they were on a mission to score tonight #Bears https://t.co/ysfZGwt6V5,['Bears'],35,9,,,asked tds well second td throw jf1 pettis offense looks like mission score tonight,0.3818,0.0,0.3818,True
1913,1563676186622005250,2022-08-27 23:53:49+00:00,TcWashington3,"@bestung ""...Bears offense looking good""?  We NEVER say that.  That's what makes this refreshing.  Can't wait for the opener.  #Bears https://t.co/jdDHslknok",['Bears'],0,0,"[User(username='bestung', id=15043384, displayname='Stu Young', description=None, rawDescription=None, descriptionUrls=None, verified=None, created=None, followersCount=None, friendsCount=None, statusesCount=None, favouritesCount=None, listedCount=None, mediaCount=None, location=None, protected=None, linkUrl=None, linkTcourl=None, profileImageUrl=None, profileBannerUrl=None, label=None)]",,bears offense looking good never say thats makes refreshing cant wait opener,0.2263,0.6,0.8263,True
1914,1563676182226378760,2022-08-27 23:53:48+00:00,Abzz_6,Getsy made #Bears fans forget about that first drive quick. Uses bootleg second drive and comes back third drive with same concept but a handoff that Montgomery cuts back into for a big gain. Rhythm and variety on display with these offensive calls.,['Bears'],1,0,,,getsy made fans forget first drive quick uses bootleg second drive comes back third drive concept handoff montgomery cuts back big gain rhythm variety display offensive calls,-0.4019,0.022916666666666655,-0.37898333333333334,False
1915,1563676179374018562,2022-08-27 23:53:47+00:00,daltonvanzant,Yooooooooo. Good to see Fields in a coherent offense. -#Bears https://t.co/ftNnBJRQ03,['Bears'],0,0,,,yooooooooo good see fields coherent offense,0.2263,0.6,0.8263,True
1916,1563676159224823809,2022-08-27 23:53:42+00:00,JakePauletto,O-Line was looking rough in that first drive but has improved significantly since. Would love to see them keep it going! #Bears,['Bears'],0,0,,,line looking rough first drive improved significantly since would love see keep going,0.8074,0.25625,1.06365,True
1917,1563676152962875393,2022-08-27 23:53:41+00:00,AlreadyTakin_20,Who are these commentators today ?? Tryna send them an invite to this BBQ #Bears,['Bears'],2,0,,,commentators today tryna send invite bbq,0.1531,0.0,0.1531,True
1919,1563676122054701057,2022-08-27 23:53:33+00:00,TeamStradley,The Bears have weapons. I don’t see how people don’t see it.  They just aren’t deep yet.  Plenty of cap room next year to fix some of those issues. I’m just happy that I finally feel optimistic about their future.  #Bears #BearDown,"['Bears', 'BearDown']",9,0,,,bears weapons see people see deep yet plenty cap room next year fix issues happy finally feel optimistic future,0.4767,0.16,0.6367,True
1920,1563676121061015552,2022-08-27 23:53:33+00:00,BearsCountryPod,"DAMN.....Justin Fields Sucks! (NOT!!!!!!!!!!!!!!!!!!!)

Are the haters ready for Justin Fields to take world by storm???

#Bears #DaBears #BearDown","['Bears', 'DaBears', 'BearDown']",5,2,,,damn justin fields sucks haters ready justin fields take world storm,-0.7096,-0.04999999999999999,-0.7596,False
1921,1563676100114407426,2022-08-27 23:53:28+00:00,Matt_Horner_QL,#Bears +5 looking pretty good right now #gamblingtwitter,"['Bears', 'gamblingtwitter']",1,0,,,5 looking pretty good right,0.7269,0.41190476190476194,1.1388047619047619,True
1922,1563676066845188098,2022-08-27 23:53:20+00:00,johndietzdh,"Bears 14, Browns 0. Justin Fields looking super. Cleveland missing half its defense, but still - looks promising for #Bears fans.",['Bears'],2,0,,,bears 14 browns 0 justin fields looking super cleveland missing half defense still looks promising fans,0.7096,0.041666666666666664,0.7512666666666666,True
1923,1563676063091380224,2022-08-27 23:53:19+00:00,Wi11DeWitt,"Justin Fields is averaging 10.6 yards per pass. 

You're telling me a QB is allowed to have an average with two numbers before the decimal point? As a #Bears fan, I thought that was impossible.",['Bears'],143,6,,,justin fields averaging 10 6 yards per pass youre telling qb allowed average two numbers decimal point fan thought impossible,0.3182,-0.4083333333333333,-0.09013333333333334,False
1924,1563676048491003906,2022-08-27 23:53:16+00:00,StarkyLuv73,What's key for me is how relaxed Fields is. How *easy* he made this look. #Bears https://t.co/9HHzwzKIZW,['Bears'],1,0,,,whats key relaxed fields easy made look,0.7269,0.21666666666666667,0.9435666666666667,True
1926,1563676036595859456,2022-08-27 23:53:13+00:00,JnJ4cy,"#Bears 
2 touchdown passes by Fields and David Montgomery punishing people!! Looking like a Super Bowl season🤷🏼‍♂️🤷🏼‍♂️🤷🏼‍♂️🤷🏼‍♂️😉😉😉",['Bears'],2,0,,,2 touchdown passes fields david montgomery punishing people looking like super bowl season,0.4215,0.3333333333333333,0.7548333333333332,True
1929,1563675949027278848,2022-08-27 23:52:52+00:00,thethad13,Yeesh! With b2b TD drives you’d think this was the worst offense since the 0-16 Lions. Martz must be spewing out of his diaper at this point #Bears #DaBears #BearDown #NFL #CHIveCLE,"['Bears', 'DaBears', 'BearDown', 'NFL', 'CHIveCLE']",0,0,,,yeesh b2b td drives think worst offense since 0 16 lions martz must spewing diaper point,-0.7269,-1.0,-1.7269,False
1931,1563675946795896834,2022-08-27 23:52:52+00:00,BritBear75,"Loving JF1 finding open guys, and guys actually getting open to be found for TDs. We are not used to this 😆 #Bears",['Bears'],1,0,,"Coordinates(longitude=-3.148037, latitude=50.98599)",loving jf1 finding open guys guys actually getting open found tds used,0.5994,0.15,0.7494000000000001,True
1933,1563675913170165760,2022-08-27 23:52:44+00:00,thejezshow,"Oh damn. Two scores in the first half? 

#Bears #DaBears #BearDown #BearsPreseason #NFL #NFLPreseason #CHIvsCLE https://t.co/6X96q5vHOO","['Bears', 'DaBears', 'BearDown', 'BearsPreseason', 'NFL', 'NFLPreseason', 'CHIvsCLE']",1,0,,,oh damn two scores first half,-0.4019,0.04166666666666667,-0.3602333333333333,False
1934,1563675890432614400,2022-08-27 23:52:38+00:00,cubbienation,@WaddleandSilvy @CarmenDeFalco @thekapman We’ve seen enough right?  Take @justnfields out and let Siemian get reps with starters? #ChicagoBears #bears,"['ChicagoBears', 'bears']",1,0,"[User(username='WaddleandSilvy', id=27898683, displayname='Silvy', description=None, rawDescription=None, descriptionUrls=None, verified=None, created=None, followersCount=None, friendsCount=None, statusesCount=None, favouritesCount=None, listedCount=None, mediaCount=None, location=None, protected=None, linkUrl=None, linkTcourl=None, profileImageUrl=None, profileBannerUrl=None, label=None), User(username='CarmenDeFalco', id=229564113, displayname='Carmen DeFalco', description=None, rawDescription=None, descriptionUrls=None, verified=None, created=None, followersCount=None, friendsCount=None, statusesCount=None, favouritesCount=None, listedCount=None, mediaCount=None, location=None, protected=None, linkUrl=None, linkTcourl=None, profileImageUrl=None, profileBannerUrl=None, label=None), User(username='thekapman', id=22445483, displayname='David Kaplan', description=None, rawDescription=None, descriptionUrls=None, verified=None, created=None, followersCount=None, friendsCount=None, statusesCount=None, favouritesCount=None, listedCount=None, mediaCount=None, location=None, protected=None, linkUrl=None, linkTcourl=None, profileImageUrl=None, profileBannerUrl=None, label=None), User(username='justnfields', id=2641158161, displayname='Justin Fields', description=None, rawDescription=None, descriptionUrls=None, verified=None, created=None, followersCount=None, friendsCount=None, statusesCount=None, favouritesCount=None, listedCount=None, mediaCount=None, location=None, protected=None, linkUrl=None, linkTcourl=None, profileImageUrl=None, profileBannerUrl=None, label=None)]",,seen enough right take let siemian get reps starters,0.0,0.14285714285714285,0.14285714285714285,True
1935,1563675889405149184,2022-08-27 23:52:38+00:00,clayharbs82,Fields with a Dart to Pettis who made Greedy Williams look silly with a filthy corner route. TD Bears! Does this look like the Worst offense in history Mike Martz?  #DaBears,['DaBears'],295,19,,"Coordinates(longitude=-87.940033, latitude=41.644102)",fields dart pettis made greedy williams look silly filthy corner route td bears look like worst offense history mike martz,-0.7003,-0.7666666666666666,-1.4669666666666665,False
1936,1563675869276958720,2022-08-27 23:52:33+00:00,Casey_Ohman,"Ok, seen enough. Pull the starters. The offense has looked fantastic on back to back drives. They looked poised and confident. Love to see it! #Bears",['Bears'],0,0,,,ok seen enough pull starters offense looked fantastic back back drives looked poised confident love see,0.9217,0.2714285714285714,1.1931285714285713,True
1937,1563675862335377409,2022-08-27 23:52:31+00:00,TopFive_Sports,Me trying not to overact to this damn pre season game 🥴 #Bears https://t.co/DlfhpHDyCg,['Bears'],2,0,,,trying overact damn pre season game,-0.4019,-0.4,-0.8019000000000001,False
1938,1563675862142275586,2022-08-27 23:52:31+00:00,InquisitrGlokta,Fields looks great. We’ve seen enough. Shut down the first stringers #Bears #BearDown,"['Bears', 'BearDown']",0,0,,,fields looks great seen enough shut first stringers,0.6249,0.35000000000000003,0.9749000000000001,True
1941,1563675832710725636,2022-08-27 23:52:24+00:00,AngelGo51213648,At Least The Bears Are Doing Better Than My Eagles!!!!! #FlyEaglesFly And #DaBears!!!!! https://t.co/mSKaH23HaZ,"['FlyEaglesFly', 'DaBears']",1,0,,,least bears better eagles,0.4404,0.1,0.5404,True
1942,1563675829162237952,2022-08-27 23:52:24+00:00,bestung,#bears offense looking good. We don't say that often. Not sure how strong Cleveland's D is and I know they are resting some key starters but we can only play against who we're given. Nice job bears and #fields,"['bears', 'fields']",3,0,,,offense looking good dont say often sure strong clevelands know resting key starters play given nice job bears,0.8145,0.44666666666666666,1.2611666666666665,True
1945,1563675817871384576,2022-08-27 23:52:21+00:00,Bearsmaxx,"I’m giving huge props to #bears WR Tyke Tolbert for making these guys look legit. Even if it is PS, these routes are dirty.",['bears'],6,1,,,giving huge props wr tyke tolbert making guys look legit even ps routes dirty,0.2023,-0.09999999999999995,0.10230000000000006,True
1946,1563675808052514816,2022-08-27 23:52:18+00:00,REMILOVESPORTS,CANNOT wait til Baldy🏈 @BaldyNFL breakdown QB1 film from THIS preseason game #BearsNation #Bears🔹🔸,"['BearsNation', 'Bears']",1,0,"[User(username='BaldyNFL', id=2957214987, displayname='Brian Baldinger', description=None, rawDescription=None, descriptionUrls=None, verified=None, created=None, followersCount=None, friendsCount=None, statusesCount=None, favouritesCount=None, listedCount=None, mediaCount=None, location=None, protected=None, linkUrl=None, linkTcourl=None, profileImageUrl=None, profileBannerUrl=None, label=None)]",,cannot wait til baldy breakdown qb1 film preseason game,0.0,-0.4,-0.4,False
1948,1563675798238035968,2022-08-27 23:52:16+00:00,paytonsun,"Justin Fields looks good. If the oline can give him time, the young man will ball. Simple. #Bears",['Bears'],650,35,,,justin fields looks good oline give time young man ball simple,0.4404,0.26666666666666666,0.7070666666666667,True
1949,1563675793280192513,2022-08-27 23:52:15+00:00,EDuerrwaechter,"Overall I’m loving the route concepts and play designs from #Bears OC Luke Getsy so far. 

And don’t sleep on Dante Pettis taking a role for himself at WR. Flashed in game one. And really flashing tonight.",['Bears'],5,0,,,overall loving route concepts play designs oc luke getsy far sleep dante pettis taking role wr flashed game one really flashing tonight,0.743,0.09999999999999999,0.843,True
1950,1563675773902458883,2022-08-27 23:52:10+00:00,CHISPORTSCRAZ82,Two guys I been hyped about seeing are ESB &amp; DANTE PETTIS! @79illwill remembered we talked about him contributing to the return game and I said the man can run routes with the best of em and I hoped he would focus display it for the BEARS! #DaBears,['DaBears'],21,1,"[User(username='79illwill', id=2952649782, displayname='illwill', description=None, rawDescription=None, descriptionUrls=None, verified=None, created=None, followersCount=None, friendsCount=None, statusesCount=None, favouritesCount=None, listedCount=None, mediaCount=None, location=None, protected=None, linkUrl=None, linkTcourl=None, profileImageUrl=None, profileBannerUrl=None, label=None)]","Coordinates(longitude=-88.0966885, latitude=41.744098)",two guys hyped seeing esb amp dante pettis remembered talked contributing return game said man run routes best em hoped would focus display bears,0.7783,0.3,1.0783,True
1952,1563675763941015553,2022-08-27 23:52:08+00:00,Mybears2,"@i_bigelow TD #Bears  got ball 2nd half start   Fields to Pettis 14-0  #Bears 
🐻⬇️","['Bears', 'Bears']",0,0,"[User(username='i_bigelow', id=4700219715, displayname='Paul I Bigelow,Jr.', description=None, rawDescription=None, descriptionUrls=None, verified=None, created=None, followersCount=None, friendsCount=None, statusesCount=None, favouritesCount=None, listedCount=None, mediaCount=None, location=None, protected=None, linkUrl=None, linkTcourl=None, profileImageUrl=None, profileBannerUrl=None, label=None)]",,td got ball 2nd half start fields pettis 14 0,0.0,-0.08333333333333333,-0.08333333333333333,False
1957,1563675709109075969,2022-08-27 23:51:55+00:00,AlreadyTakin_20,"Matt Nagy would've kept running the ball out of shotgun from the first drive tryna figure out the ""why"" and shit 🤣 #Bears 

Change is good 🐻⬇️",['Bears'],49,4,,,matt nagy wouldve kept running ball shotgun first drive tryna figure shit change good,-0.1779,0.25,0.0721,True
1958,1563675700795547649,2022-08-27 23:51:53+00:00,WandaW63,Fields is lighting it up! OL giving him plenty of time. Yeah baby!#Bears 🐻⬇️,['Bears'],1,0,,,fields lighting ol giving plenty time yeah baby,0.5574,0.0,0.5574,True
1960,1563675674686246913,2022-08-27 23:51:47+00:00,manolo_smolo,"Justin Fields- 7/8 85 yards 2 TD. If he can do this when the games count, I will be thrilled. #Bears 🐻⬇️",['Bears'],0,0,,,justin fields 7 8 85 yards 2 td games count thrilled,0.4404,0.6,1.0404,True
1962,1563675644080553984,2022-08-27 23:51:39+00:00,BearsBacker,"Superb route by Dante Pettis on the 12-yard strike on a beautiful throw from Justin Fields. Offense is looking better in extended action here. 

Pettis definitely helped his case for a roster spot with that play. #Bears",['Bears'],3,1,,,superb route dante pettis 12 yard strike beautiful throw justin fields offense looking better extended action pettis definitely helped case roster spot play,0.926,0.49000000000000005,1.4160000000000001,True
1964,1563675627760254977,2022-08-27 23:51:36+00:00,LarryMayer,When I recently asked former #Bears guard and current radio analyst Tom Thayer to give me an under-the-radar player who has impressed him he said Dante Pettis.,['Bears'],36,3,,,recently asked former guard current radio analyst tom thayer give radar player impressed said dante pettis,0.4767,0.25,0.7267,True
1965,1563675626208239616,2022-08-27 23:51:35+00:00,JordanTSilveira,"Fields is cooking today. No other way to put it. Greedy isn't a bad CB. Pettis is looking to secure a spot too.

The way Pettis sold that inside head fake to get Greedy to bite before breaking it back outside to Fields was gorgeous.

Nice fun game so far for #Bears fans.",['Bears'],12,0,,"Coordinates(longitude=-117.75971, latitude=33.512428)",fields cooking today way put greedy isnt bad cb pettis looking secure spot way pettis sold inside head fake get greedy bite breaking back outside fields gorgeous nice fun game far fans,0.8248,0.05,0.8748,True
1966,1563675617094254592,2022-08-27 23:51:33+00:00,RAEsJukeJoint,Look at DMo running hard. We think he will have a big year. #Bears https://t.co/2UlcwwTq1q,['Bears'],12,4,,,look dmo running hard think big year,-0.1027,-0.14583333333333334,-0.24853333333333333,False
1967,1563675607795265536,2022-08-27 23:51:31+00:00,bcarr_13,"Great throw from Justin Fields.

Fits this ball in between two defenders.

#NFL | #Bears | #DaBears https://t.co/ynjOQjNvoM","['NFL', 'Bears', 'DaBears']",2,1,,,great throw justin fields fits ball two defenders,0.6597,0.8,1.4597,True
1968,1563675586274402304,2022-08-27 23:51:26+00:00,Mike_BHawks37,"Great route 86!
Great protection O-Line!!
&amp;
Great throw QB1 👍👍

#Bears up 14-0 💙🧡",['Bears'],6,0,,,great route 86 great protection line amp great throw qb1 14 0,0.8934,0.8000000000000002,1.6934,True
1969,1563675573737627649,2022-08-27 23:51:23+00:00,_Da_pistol,Dante Pettis shook Greedy Williams on the TD. #Bears up 14-0,['Bears'],0,0,,"Coordinates(longitude=-81.877771, latitude=41.392684)",dante pettis shook greedy williams td 14 0,-0.4019,0.0,-0.4019,False
1971,1563675571783188480,2022-08-27 23:51:22+00:00,legalskolar,Justin Fields looks pretty good. #Bears,['Bears'],0,0,,,justin fields looks pretty good,0.7269,0.475,1.2019,True
1972,1563675567655776256,2022-08-27 23:51:21+00:00,Aidenbuckets1,"Man, the Bears are playing FANTASTIC. Holy fuck #Bears",['Bears'],3,0,,,man bears playing fantastic holy fuck,0.2263,0.0,0.2263,True
1973,1563675552489283584,2022-08-27 23:51:18+00:00,jeremiahdavis10,"It’s only the preseason. It’s only preseason. Preseason, Jer. It’s preseason. Do no do this to yourself. The #Bears are gonna be bad, you already resigned yourself to this. Stop. Seek help.

…JUSTIN FIELDS dammit",['Bears'],4,0,,,preseason preseason preseason jer preseason gonna bad already resigned stop seek help justin fields dammit,-0.6124,-0.6999999999999998,-1.3123999999999998,False
1974,1563675550631268354,2022-08-27 23:51:17+00:00,Scott_A_Miller,Just realized I haven’t noticed Braxton Jones. That’s a wonderful thing. #Bears,['Bears'],1,0,,,realized noticed braxton jones wonderful thing,0.5719,1.0,1.5718999999999999,True
1975,1563675548693381120,2022-08-27 23:51:17+00:00,GayChicagoBears,#bears HAHAHAHAHA FUCK YOU MIKE MARTZ/DAN ORLOVSKY,['bears'],4,0,,,hahahahaha fuck mike martz dan orlovsky,-0.5423,-0.1,-0.6423,False
1976,1563675545778302976,2022-08-27 23:51:16+00:00,thebearsdude,"Ok, time for Justin to sit and watch he looks great. #bears",['bears'],1,0,,,ok time justin sit watch looks great,0.743,0.65,1.393,True
1977,1563675540938231809,2022-08-27 23:51:15+00:00,timomac1,"OMG. This is real football dammit!
#Bears",['Bears'],0,0,,,omg real football dammit,0.0,0.2,0.2,True
1979,1563675523292823552,2022-08-27 23:51:11+00:00,sean_hammond,"Touchdown: #Bears QB Justin Fields connects with WR Dante Pettis. 

Pettis has run a couple really nice routes in this game. Absolutely fooled the DB there.",['Bears'],39,4,,,touchdown qb justin fields connects wr dante pettis pettis run couple really nice routes game absolutely fooled db,0.0516,0.13333333333333333,0.18493333333333334,True
1981,1563675516951056384,2022-08-27 23:51:09+00:00,Abzz_6,Dante Pettis was extremely serviceable for the Niners. He’s jumped around but can be a good depth piece at receiver. #Bears sit Fields he’s good to go.,['Bears'],0,0,,,dante pettis extremely serviceable niners jumped around good depth piece receiver sit fields good go,0.7003,0.425,1.1253,True
1982,1563675510403567617,2022-08-27 23:51:08+00:00,Woody55__,"Yeah, 3 win team by the way #Bears 

14-0",['Bears'],0,0,,,yeah 3 win team way 14 0,0.7184,0.8,1.5184000000000002,True
1983,1563675504384901129,2022-08-27 23:51:06+00:00,ChrisMaltbyBD,"I think it’s safe to say that Dante Pettis has locked up a roster spot on this team.

#Bears",['Bears'],20,0,,,think safe say dante pettis locked roster spot team,0.4404,0.5,0.9404,True
1984,1563675501423738881,2022-08-27 23:51:05+00:00,Sox_Nick,"JUSTIN FIELDS TOUCHDOWN

14-0 Bears 🐻🔽

Clean route by Dante Pettis too

#DaBears",['DaBears'],3,0,,,justin fields touchdown 14 0 bears clean route dante pettis,0.4019,0.3666666666666667,0.7685666666666666,True
1985,1563675497858568195,2022-08-27 23:51:05+00:00,Bigpappa05,"Back to back solid series for the #Bears  offense.  Definitely, bounced back from an opening 3 and out.  #DaBears","['Bears', 'DaBears']",0,0,,,back back solid series offense definitely bounced back opening 3,0.3182,0.0,0.3182,True
1987,1563675494293426178,2022-08-27 23:51:04+00:00,RedHatDuck1,"#Bears Pull the starters now.  2 TD's.  We saw what we needed, now save them from injury",['Bears'],0,0,,,pull starters 2 tds saw needed save injury,0.1027,0.0,0.1027,True
1988,1563675494125551621,2022-08-27 23:51:04+00:00,mrushton78,"You can put whatever qualifier you want on it, this is exactly what you want to see out of Fields and this #Bears offense.",['Bears'],0,0,,,put whatever qualifier want exactly want see fields offense,-0.1027,0.25,0.1473,True
1989,1563675466824908811,2022-08-27 23:50:57+00:00,BearsNationPod,"If you give Justin Fields time and confidence this year, he’s a top-12 QB and the #Bears are a 9 win team",['Bears'],4,0,,,give justin fields time confidence year top 12 qb 9 win team,0.836,0.65,1.486,True
1990,1563675464278986752,2022-08-27 23:50:57+00:00,joetusio,Fields and #Bears looking sharp early vs CLE,['Bears'],0,0,,,fields looking sharp early vs cle,0.0,-0.012499999999999997,-0.012499999999999997,False
1992,1563675461015805954,2022-08-27 23:50:56+00:00,Claytoris71,Ok. I’ve seen enough of Fields. #DaBears #BearDown #Bears,"['DaBears', 'BearDown', 'Bears']",0,0,,"Coordinates(longitude=-87.940033, latitude=41.644102)",ok seen enough fields,0.296,0.25,0.546,True
