,ID,Date,User,Tweet,HashTags,Likes,Retweets,MentionUsers,LocationCoordinates,clean_Tweet,Sentiment_Analysis,Positive_Sentiment,Compound_Sentiment Score
0,1584696099146604544,2022-10-24 23:59:26+00:00,rdr2374,#bakerbros #Browns #Cleveland https://t.co/MnwuuN97tm,"['bakerbros', 'Browns', 'Cleveland']",0,0,,,,"{'neg': 0.0, 'neu': 0.0, 'pos': 0.0, 'compound': 0.0}",False,0.0
1,1584696017278357505,2022-10-24 23:59:07+00:00,Oh__Cleveland,"@TonyGrossi What are they doing with this guy?

Is the #Browns plan to get Hunt only 5 touches per game? Because that’s what they’ve averaged the past 2 games. 

At least put Hunt in the backfield with Chubb? Don’t you think opposing teams would scheme differently for that?",['Browns'],12,0,"[User(username='TonyGrossi', id=33424006, displayname='Tony Grossi', description=None, rawDescription=None, descriptionUrls=None, verified=None, created=None, followersCount=None, friendsCount=None, statusesCount=None, favouritesCount=None, listedCount=None, mediaCount=None, location=None, protected=None, linkUrl=None, linkTcourl=None, profileImageUrl=None, profileBannerUrl=None, label=None)]",,what are they doing with this guy is plan get hunt only 5 touches per game because that s what they ve averaged past 2 games at least put hunt backfield with chubb don t you think opposing teams would scheme differently that,"{'neg': 0.0, 'neu': 1.0, 'pos': 0.0, 'compound': 0.0}",False,0.0
2,1584695687304073216,2022-10-24 23:57:48+00:00,GOLFCRAZY216,"@adamthebull And this is the reason we denied Kareem a trade in the off-season.”Tough, smart and accountable” is our identity says Kevin Stefanski. Another successful season of #Browns football. #sameoldbrowns #whatajoke https://t.co/PZZ4Wm1DCI","['Browns', 'sameoldbrowns', 'whatajoke']",0,0,"[User(username='adamthebull', id=64535352, displayname='Adam the Bull', description=None, rawDescription=None, descriptionUrls=None, verified=None, created=None, followersCount=None, friendsCount=None, statusesCount=None, favouritesCount=None, listedCount=None, mediaCount=None, location=None, protected=None, linkUrl=None, linkTcourl=None, profileImageUrl=None, profileBannerUrl=None, label=None)]",,this is reason we denied kareem trade off season tough smart accountable is our identity says kevin stefanski another successful season football,"{'neg': 0.152, 'neu': 0.623, 'pos': 0.225, 'compound': 0.4767}",True,0.4767
3,1584695673261379584,2022-10-24 23:57:45+00:00,kjkoch,Tweeted byTonyGrossi: Lowers the market for Kareem Hunt. https://t.co/mJhX7jpa59 https://t.co/WrybEfC3Jp #browns,['browns'],0,0,,,tweeted bytonygrossi lowers market kareem hunt,"{'neg': 0.231, 'neu': 0.769, 'pos': 0.0, 'compound': -0.128}",False,-0.128
4,1584695637534048256,2022-10-24 23:57:36+00:00,MoneyTLK31,"Browns must want a lot for Kareem Hunt, I’m sure the Jets asked 😬 #Jets #Browns","['Jets', 'Browns']",0,0,,,browns must want lot kareem hunt i m sure jets asked,"{'neg': 0.0, 'neu': 0.66, 'pos': 0.34, 'compound': 0.3818}",True,0.3818
5,1584695636666245120,2022-10-24 23:57:36+00:00,GoganMac,Breaking ... #Seahawks sending #1 and #4 to #Browns for Amari Cooper,"['Seahawks', 'Browns']",0,0,,,breaking sending amari cooper,"{'neg': 0.0, 'neu': 1.0, 'pos': 0.0, 'compound': 0.0}",False,0.0
6,1584695340401586177,2022-10-24 23:56:26+00:00,Cuffycakes08,#Browns https://t.co/lFnLspeGhJ https://t.co/DT3MLnHhzm,['Browns'],0,0,,,,"{'neg': 0.0, 'neu': 0.0, 'pos': 0.0, 'compound': 0.0}",False,0.0
7,1584695286777393152,2022-10-24 23:56:13+00:00,Mr_Green_2022,I wonder if this will ha e any impact on the #Browns potentially trading Hunt? #BrownsTwitter https://t.co/momdgn38sq,"['Browns', 'BrownsTwitter']",0,0,,,i wonder if this will ha e any impact potentially trading hunt,"{'neg': 0.0, 'neu': 0.789, 'pos': 0.211, 'compound': 0.34}",True,0.34
8,1584695234142916609,2022-10-24 23:56:00+00:00,BrownsChat,Fans React To Report That Browns May Trade Greedy Williams #BrownsFootball #Browns #DawgPound #WeBarkTogether #Believeland https://t.co/vhNn0Ju81h,"['BrownsFootball', 'Browns', 'DawgPound', 'WeBarkTogether', 'Believeland']",0,0,,,fans react report that browns may trade greedy williams,"{'neg': 0.223, 'neu': 0.777, 'pos': 0.0, 'compound': -0.3182}",False,-0.3182
9,1584695228782739456,2022-10-24 23:55:59+00:00,SvenTheMartian,"For everyone that thinks Watson isn’t gonna be good after a year off, this was after 2 full years off of football, 1 year of being a backup and 21 months in prison. 
#Browns https://t.co/Qe5NRAeGHh",['Browns'],2,0,,,everyone that thinks watson isn t gonna be good after year off this was after 2 full years off football 1 year being backup 21 months prison,"{'neg': 0.117, 'neu': 0.78, 'pos': 0.103, 'compound': -0.1027}",False,-0.1027
10,1584695211997159424,2022-10-24 23:55:55+00:00,brownscoveragee,Looks like a 6th round pick is the market #Browns 😬 https://t.co/bRGonNjnRf,['Browns'],0,0,,,looks like 6th round pick is market,"{'neg': 0.0, 'neu': 0.706, 'pos': 0.294, 'compound': 0.3612}",True,0.3612
11,1584695154346455040,2022-10-24 23:55:41+00:00,TheBucknut,"The Browns need to

-Pay a DT
-Fire Woods ( or move him from DC ) 
-Gameplan more around Chubb 

#Browns",['Browns'],1,0,,,browns need pay dt fire woods or move him dc gameplan more around chubb,"{'neg': 0.241, 'neu': 0.759, 'pos': 0.0, 'compound': -0.4215}",False,-0.4215
12,1584695008195579904,2022-10-24 23:55:06+00:00,CornerCommishCR,But I thought #Browns fans told me the Jets were trading for Kareem Hunt? https://t.co/mbmUYt0201,['Browns'],0,0,,,but i thought fans told me jets were trading kareem hunt,"{'neg': 0.0, 'neu': 1.0, 'pos': 0.0, 'compound': 0.0}",False,0.0
13,1584694952457797633,2022-10-24 23:54:53+00:00,chadefuller,"@luvcleveland @nathanvance521 The more carries Nick Chubb receives, the better our chances of winning.  The 2 games the Browns won, were his highest carry games. 6 yards per carry and keeps D off the field. #Browns",['Browns'],1,0,"[User(username='luvcleveland', id=55906621, displayname='❤️🧡Shari❤️🧡', description=None, rawDescription=None, descriptionUrls=None, verified=None, created=None, followersCount=None, friendsCount=None, statusesCount=None, favouritesCount=None, listedCount=None, mediaCount=None, location=None, protected=None, linkUrl=None, linkTcourl=None, profileImageUrl=None, profileBannerUrl=None, label=None), User(username='nathanvance521', id=765610982672441344, displayname='Nathan Vance #D4L Browns Week 12 (3-7)', description=None, rawDescription=None, descriptionUrls=None, verified=None, created=None, followersCount=None, friendsCount=None, statusesCount=None, favouritesCount=None, listedCount=None, mediaCount=None, location=None, protected=None, linkUrl=None, linkTcourl=None, profileImageUrl=None, profileBannerUrl=None, label=None)]",,more carries nick chubb receives better our chances winning 2 games browns won were his highest carry games 6 yards per carry keeps d off field,"{'neg': 0.0, 'neu': 0.617, 'pos': 0.383, 'compound': 0.8957}",True,0.8957
14,1584694731547627521,2022-10-24 23:54:00+00:00,TheNFLSources,The #Jets immediately got on the phone after learning Breece Hall will be out for the season. I’m told they also checked in with the #Browns about Kareem Hunt and the #Rams about Cam Akers.,"['Jets', 'Browns', 'Rams']",1,0,,,immediately got phone after learning breece hall will be out season i m told they also checked with about kareem hunt about cam akers,"{'neg': 0.0, 'neu': 1.0, 'pos': 0.0, 'compound': 0.0}",False,0.0
15,1584694515864309760,2022-10-24 23:53:09+00:00,Bwomack82,"If they’re really an analytic team, then why are they not noticing that the run game has double the amount of TDs (12) compared to the passing game(6). Like…maybe run the ball a little bit more? 🤷🏾‍♂️🧐 #Browns",['Browns'],0,0,,,if they re really analytic team then why are they not noticing that run game has double amount tds 12 compared passing game 6 like maybe run ball little bit more,"{'neg': 0.0, 'neu': 0.921, 'pos': 0.079, 'compound': 0.3612}",True,0.3612
16,1584694474210353153,2022-10-24 23:52:59+00:00,CraigAFountain,So much for Kareem Hunt to the Jets. #Browns,['Browns'],42,0,,,so much kareem hunt jets,"{'neg': 0.0, 'neu': 1.0, 'pos': 0.0, 'compound': 0.0}",False,0.0
17,1584694412608929794,2022-10-24 23:52:44+00:00,Berry4XD,These E coaches got bricked up #browns https://t.co/laRVNmm7qG,['browns'],0,0,,,these e coaches got bricked up,"{'neg': 0.0, 'neu': 1.0, 'pos': 0.0, 'compound': 0.0}",False,0.0
18,1584694394195542017,2022-10-24 23:52:40+00:00,MylesOffTheEdge,"#Browns

Gotta imagine that the Bills would love to get their hands on Hunt.",['Browns'],1,0,,,gotta imagine that bills would love get their hands hunt,"{'neg': 0.0, 'neu': 0.682, 'pos': 0.318, 'compound': 0.6369}",True,0.6369
19,1584694236141613056,2022-10-24 23:52:02+00:00,MatthewPetey,"If James Robinson goes for a 6th/5th I think the Browns could get a 4th for Hunt. 

Curious to know if the Jets called the #Browns today https://t.co/TevYwqC0io",['Browns'],1,0,,,if james robinson goes 6th 5th i think browns could get 4th hunt curious know if jets called today,"{'neg': 0.0, 'neu': 0.881, 'pos': 0.119, 'compound': 0.3182}",True,0.3182
20,1584694195268505602,2022-10-24 23:51:53+00:00,NickPaulus,"Hunt is worth more… But on a 1 year deal, you might get a 4th for Hunt… Maybe
#Browns https://t.co/1VDCxaMd9A",['Browns'],2,0,,,hunt is worth more but 1 year deal you might get 4th hunt maybe,"{'neg': 0.0, 'neu': 0.892, 'pos': 0.108, 'compound': 0.1154}",True,0.1154
21,1584694169255424001,2022-10-24 23:51:46+00:00,kennyem2468,@ed_in_columbus @EricMetcalf21 I was there! It’s the craziest and loudest sporting event I’ve ever been to. Simply unbelievable #browns,['browns'],2,0,"[User(username='ed_in_columbus', id=3458600481, displayname='Ed_in_Columbus', description=None, rawDescription=None, descriptionUrls=None, verified=None, created=None, followersCount=None, friendsCount=None, statusesCount=None, favouritesCount=None, listedCount=None, mediaCount=None, location=None, protected=None, linkUrl=None, linkTcourl=None, profileImageUrl=None, profileBannerUrl=None, label=None), User(username='EricMetcalf21', id=2337146204, displayname='Eric Metcalf', description=None, rawDescription=None, descriptionUrls=None, verified=None, created=None, followersCount=None, friendsCount=None, statusesCount=None, favouritesCount=None, listedCount=None, mediaCount=None, location=None, protected=None, linkUrl=None, linkTcourl=None, profileImageUrl=None, profileBannerUrl=None, label=None)]",,i was there it s craziest loudest sporting event i ve ever been simply unbelievable,"{'neg': 0.092, 'neu': 0.769, 'pos': 0.138, 'compound': 0.1531}",True,0.1531
22,1584694011436052480,2022-10-24 23:51:09+00:00,SOFREEZEKEN,The latest rumor is actually finding the Browns loss to the Ravens in your snickers #Browns https://t.co/CpKYsv8Kbb,['Browns'],0,0,,,latest rumor is actually finding browns loss ravens your snickers,"{'neg': 0.204, 'neu': 0.796, 'pos': 0.0, 'compound': -0.3182}",False,-0.3182
23,1584693949239029760,2022-10-24 23:50:54+00:00,DawgPoundSound,#Browns players screaming there is no leadership after the game? There is a clear disconnect between them and these Coaches. Good luck Monday Night. https://t.co/0y9BWyzQHN,['Browns'],0,0,,,players screaming there is no leadership after game there is clear disconnect between them these coaches good luck monday night,"{'neg': 0.17, 'neu': 0.53, 'pos': 0.3, 'compound': 0.5719}",True,0.5719
24,1584693945535434752,2022-10-24 23:50:53+00:00,CLBrownsDan,Kareem Hunt not to worried about being traded he is at a #Browns Halloween event this evening looks like. 😂 https://t.co/f2nPG6rKsk,['Browns'],2,0,,,kareem hunt not worried about being traded he is at halloween event this evening looks like,"{'neg': 0.0, 'neu': 0.761, 'pos': 0.239, 'compound': 0.5248}",True,0.5248
25,1584693908705251328,2022-10-24 23:50:44+00:00,RefCharlesVan,Kareem Hunt will bring back about the same that James Robinson just did….#Browns,['Browns'],0,0,,,kareem hunt will bring back about same that james robinson just did,"{'neg': 0.0, 'neu': 1.0, 'pos': 0.0, 'compound': 0.0}",False,0.0
26,1584693897304760320,2022-10-24 23:50:41+00:00,crouch___,"#Browns fans talking about hiring Mike Tomlin? He would never want to coach the Browns …. right? 🧐 (I take Tomlin over Stefanski 100 times out of 100, btw) but NEVER GONNA HAPPEN………",['Browns'],0,0,,,fans talking about hiring mike tomlin he would never want coach browns right i take tomlin over stefanski 100 times out 100 btw but never gonna happen,"{'neg': 0.043, 'neu': 0.957, 'pos': 0.0, 'compound': -0.0286}",False,-0.0286
27,1584693838219616257,2022-10-24 23:50:27+00:00,TheOBR,"The #Browns asking price for Hunt is too high...or his value is too low.

Or both.",['Browns'],39,3,,,asking price hunt is too high or his value is too low or both,"{'neg': 0.127, 'neu': 0.727, 'pos': 0.145, 'compound': 0.0772}",True,0.0772
28,1584693154946875392,2022-10-24 23:47:44+00:00,FanoftheLand13,#Browns doing a great job of extending the career of Nick Chubb by not having him play in playoff games.,['Browns'],21,1,,,doing great job extending career nick chubb by not having him play playoff games,"{'neg': 0.112, 'neu': 0.662, 'pos': 0.226, 'compound': 0.4703}",True,0.4703
29,1584692970175213568,2022-10-24 23:47:00+00:00,CLBrownsDan,Would you say #Browns don’t want picks they want a player in return? https://t.co/7RvgFoXYeV,['Browns'],0,0,,,would you say don t want picks they want player return,"{'neg': 0.0, 'neu': 0.755, 'pos': 0.245, 'compound': 0.1531}",True,0.1531
30,1584692936453033984,2022-10-24 23:46:52+00:00,MoreForYou_CLE,When this tweet popped up I was so prepared for that to say #Browns Kareem Hunt https://t.co/J7IiL2f3wh,['Browns'],74,3,,,when this tweet popped up i was so prepared that say kareem hunt,"{'neg': 0.0, 'neu': 0.815, 'pos': 0.185, 'compound': 0.3593}",True,0.3593
31,1584692856497008640,2022-10-24 23:46:33+00:00,SportsManShawn,I guess Hunt won’t be going to the Jets. #Browns https://t.co/472aDbuG0c,['Browns'],0,0,,,i guess hunt won t be going jets,"{'neg': 0.0, 'neu': 0.575, 'pos': 0.425, 'compound': 0.5719}",True,0.5719
32,1584692810350874624,2022-10-24 23:46:22+00:00,misterlethal_,"If the Browns can workout a Kareem Hunt trade with the Jets where we get Elijah Moore, I’d consider that a big dub #Browns",['Browns'],0,0,,,if browns can workout kareem hunt trade with jets where we get elijah moore i d consider that big dub,"{'neg': 0.0, 'neu': 1.0, 'pos': 0.0, 'compound': 0.0}",False,0.0
33,1584692768185942016,2022-10-24 23:46:12+00:00,Ckutytweet,"A first rd pick?

Two first rd picks?

A first, a 2nd, and a third?

#Browns #Brownstwitter","['Browns', 'Brownstwitter']",0,0,,,first rd pick two first rd picks first 2nd third,"{'neg': 0.0, 'neu': 1.0, 'pos': 0.0, 'compound': 0.0}",False,0.0
34,1584692715954003969,2022-10-24 23:46:00+00:00,Local12Skinny,"#Bengals next opponent #Browns will be without starting linebacker and tight end on #MNF 
https://t.co/yNF6l950Qt
@Local12 @Bengals @Browns @NFL #NFL #RuleTheJungles","['Bengals', 'Browns', 'MNF', 'NFL', 'RuleTheJungles']",5,2,"[User(username='Local12', id=16102208, displayname='Local 12/WKRC-TV', description=None, rawDescription=None, descriptionUrls=None, verified=None, created=None, followersCount=None, friendsCount=None, statusesCount=None, favouritesCount=None, listedCount=None, mediaCount=None, location=None, protected=None, linkUrl=None, linkTcourl=None, profileImageUrl=None, profileBannerUrl=None, label=None), User(username='Bengals', id=24179879, displayname='Cincinnati Bengals', description=None, rawDescription=None, descriptionUrls=None, verified=None, created=None, followersCount=None, friendsCount=None, statusesCount=None, favouritesCount=None, listedCount=None, mediaCount=None, location=None, protected=None, linkUrl=None, linkTcourl=None, profileImageUrl=None, profileBannerUrl=None, label=None), User(username='Browns', id=40358743, displayname='Cleveland Browns', description=None, rawDescription=None, descriptionUrls=None, verified=None, created=None, followersCount=None, friendsCount=None, statusesCount=None, favouritesCount=None, listedCount=None, mediaCount=None, location=None, protected=None, linkUrl=None, linkTcourl=None, profileImageUrl=None, profileBannerUrl=None, label=None), User(username='NFL', id=19426551, displayname='NFL', description=None, rawDescription=None, descriptionUrls=None, verified=None, created=None, followersCount=None, friendsCount=None, statusesCount=None, favouritesCount=None, listedCount=None, mediaCount=None, location=None, protected=None, linkUrl=None, linkTcourl=None, profileImageUrl=None, profileBannerUrl=None, label=None)]",,next opponent will be without starting linebacker tight end,"{'neg': 0.0, 'neu': 1.0, 'pos': 0.0, 'compound': 0.0}",False,0.0
35,1584692626028396544,2022-10-24 23:45:38+00:00,SvenTheMartian,This is exactly what a lot of you #Browns fans want us to do 😂😂😂 https://t.co/6z6hGorDIc,['Browns'],1,0,,,this is exactly what lot you fans want us do,"{'neg': 0.0, 'neu': 0.874, 'pos': 0.126, 'compound': 0.0772}",True,0.0772
36,1584692609469272064,2022-10-24 23:45:34+00:00,Iwashazed03,@betJACK Go #Browns https://t.co/kqflkpxrH8,['Browns'],1,0,"[User(username='betJACK', id=1356283764176023557, displayname='betJACK', description=None, rawDescription=None, descriptionUrls=None, verified=None, created=None, followersCount=None, friendsCount=None, statusesCount=None, favouritesCount=None, listedCount=None, mediaCount=None, location=None, protected=None, linkUrl=None, linkTcourl=None, profileImageUrl=None, profileBannerUrl=None, label=None)]",,go,"{'neg': 0.0, 'neu': 1.0, 'pos': 0.0, 'compound': 0.0}",False,0.0
37,1584692566737711104,2022-10-24 23:45:24+00:00,GoganMac,"Hunt ... must be the outspoken guy in the  room .... like Baker, there's no room in the room for emotion ... THE NERDS WONT ACCEPT IT .... #browns @browns https://t.co/JPYvfYSciS https://t.co/jpJ7ph6Xds",['browns'],0,0,"[User(username='Browns', id=40358743, displayname='Cleveland Browns', description=None, rawDescription=None, descriptionUrls=None, verified=None, created=None, followersCount=None, friendsCount=None, statusesCount=None, favouritesCount=None, listedCount=None, mediaCount=None, location=None, protected=None, linkUrl=None, linkTcourl=None, profileImageUrl=None, profileBannerUrl=None, label=None)]",,hunt must be outspoken guy room like baker theres no room room emotion nerds wont accept it,"{'neg': 0.21, 'neu': 0.67, 'pos': 0.12, 'compound': -0.2225}",False,-0.2225
38,1584692463934939136,2022-10-24 23:45:00+00:00,ThisIsBLVLND,"Browns listening to offers on two players. 
#NFL #Browns 
https://t.co/hqGtT39F6g","['NFL', 'Browns']",0,1,,,browns listening offers two players,"{'neg': 0.0, 'neu': 1.0, 'pos': 0.0, 'compound': 0.0}",False,0.0
39,1584692325498122240,2022-10-24 23:44:27+00:00,IdiotvilleSport,#FireJoeWoods #Browns https://t.co/ORvMHcGCYw,"['FireJoeWoods', 'Browns']",3,1,,,,"{'neg': 0.0, 'neu': 0.0, 'pos': 0.0, 'compound': 0.0}",False,0.0
40,1584692065509998592,2022-10-24 23:43:25+00:00,naturjays,@StainbrookNFL @TheOBR we could really use Ed and they would have more than enough ammo to win the super bowl #Browns #Billsmafia,"['Browns', 'Billsmafia']",0,0,"[User(username='StainbrookNFL', id=1022651479918751745, displayname='Brad Stainbrook', description=None, rawDescription=None, descriptionUrls=None, verified=None, created=None, followersCount=None, friendsCount=None, statusesCount=None, favouritesCount=None, listedCount=None, mediaCount=None, location=None, protected=None, linkUrl=None, linkTcourl=None, profileImageUrl=None, profileBannerUrl=None, label=None), User(username='TheOBR', id=1650681, displayname='Orange and Brown Rpt', description=None, rawDescription=None, descriptionUrls=None, verified=None, created=None, followersCount=None, friendsCount=None, statusesCount=None, favouritesCount=None, listedCount=None, mediaCount=None, location=None, protected=None, linkUrl=None, linkTcourl=None, profileImageUrl=None, profileBannerUrl=None, label=None)]",,we could really use ed they would have more than enough ammo win super bowl,"{'neg': 0.0, 'neu': 0.628, 'pos': 0.372, 'compound': 0.8271}",True,0.8271
41,1584691977119207424,2022-10-24 23:43:04+00:00,b3_era,"@jayoooo365 2 things I’ve been banging the drums about since training camp:
1 - Resign Jarvis Landry and don’t penny pinch, because with this team you’re going to need his leadership. 

2 - Focus on now, quit waiting on a savior. Watson should be a addition not the answer. 👇👇👇 #Browns https://t.co/XIz3IYv2UU",['Browns'],3,1,"[User(username='jayoooo365', id=1379031663892705280, displayname='Jay-0', description=None, rawDescription=None, descriptionUrls=None, verified=None, created=None, followersCount=None, friendsCount=None, statusesCount=None, favouritesCount=None, listedCount=None, mediaCount=None, location=None, protected=None, linkUrl=None, linkTcourl=None, profileImageUrl=None, profileBannerUrl=None, label=None)]",,2 things i ve been banging drums about since training camp 1 resign jarvis landry don t penny pinch because with this team you re going need his leadership 2 focus now quit waiting savior watson should be addition not answer,"{'neg': 0.064, 'neu': 0.936, 'pos': 0.0, 'compound': -0.34}",False,-0.34
42,1584691802287706114,2022-10-24 23:42:22+00:00,BrownOrangeWkly,"We're back with a new pod, discussing a similar result. #Browns https://t.co/ZHyVPZ7QZ4",['Browns'],0,0,,,were back with new pod discussing similar result,"{'neg': 0.0, 'neu': 1.0, 'pos': 0.0, 'compound': 0.0}",False,0.0
43,1584691773099880448,2022-10-24 23:42:15+00:00,naturjays,@StainbrookNFL @TheOBR hear me out… i wouldn’t mind this if we traded Kareem for Ed Oliver #Browns,['Browns'],0,0,"[User(username='StainbrookNFL', id=1022651479918751745, displayname='Brad Stainbrook', description=None, rawDescription=None, descriptionUrls=None, verified=None, created=None, followersCount=None, friendsCount=None, statusesCount=None, favouritesCount=None, listedCount=None, mediaCount=None, location=None, protected=None, linkUrl=None, linkTcourl=None, profileImageUrl=None, profileBannerUrl=None, label=None), User(username='TheOBR', id=1650681, displayname='Orange and Brown Rpt', description=None, rawDescription=None, descriptionUrls=None, verified=None, created=None, followersCount=None, friendsCount=None, statusesCount=None, favouritesCount=None, listedCount=None, mediaCount=None, location=None, protected=None, linkUrl=None, linkTcourl=None, profileImageUrl=None, profileBannerUrl=None, label=None)]",,hear me out i wouldn t mind this if we traded kareem ed oliver,"{'neg': 0.0, 'neu': 1.0, 'pos': 0.0, 'compound': 0.0}",False,0.0
44,1584691649544073217,2022-10-24 23:41:46+00:00,killakwal59,@StainbrookNFL Won’t the #browns get a 3rd round compensatory pick if he leaves in FA?,['browns'],1,0,"[User(username='StainbrookNFL', id=1022651479918751745, displayname='Brad Stainbrook', description=None, rawDescription=None, descriptionUrls=None, verified=None, created=None, followersCount=None, friendsCount=None, statusesCount=None, favouritesCount=None, listedCount=None, mediaCount=None, location=None, protected=None, linkUrl=None, linkTcourl=None, profileImageUrl=None, profileBannerUrl=None, label=None)]",,won t get 3rd round compensatory pick if he leaves fa,"{'neg': 0.0, 'neu': 0.709, 'pos': 0.291, 'compound': 0.5719}",True,0.5719
45,1584691458900107266,2022-10-24 23:41:00+00:00,BrownsChat,4 teams who could call Browns about Kareem Hunt trade #BrownsFootball #Browns #DawgPound #WeBarkTogether #Believeland https://t.co/GutPBiuiqJ,"['BrownsFootball', 'Browns', 'DawgPound', 'WeBarkTogether', 'Believeland']",0,0,,,4 teams who could call browns about kareem hunt trade,"{'neg': 0.0, 'neu': 1.0, 'pos': 0.0, 'compound': 0.0}",False,0.0
46,1584690741653409792,2022-10-24 23:38:09+00:00,Mleiby1,"@Pchopz_ @___Colb___ ....and there it is!! This loser, Chops cant keep Bakers crank out of his mouth after every loss. Its like clockwork. #Browns",['Browns'],2,0,"[User(username='Pchopz_', id=27540803, displayname='Football Chopz', description=None, rawDescription=None, descriptionUrls=None, verified=None, created=None, followersCount=None, friendsCount=None, statusesCount=None, favouritesCount=None, listedCount=None, mediaCount=None, location=None, protected=None, linkUrl=None, linkTcourl=None, profileImageUrl=None, profileBannerUrl=None, label=None), User(username='___Colb___', id=1177731299219509250, displayname='Colb', description=None, rawDescription=None, descriptionUrls=None, verified=None, created=None, followersCount=None, friendsCount=None, statusesCount=None, favouritesCount=None, listedCount=None, mediaCount=None, location=None, protected=None, linkUrl=None, linkTcourl=None, profileImageUrl=None, profileBannerUrl=None, label=None)]",,there it is this loser chops cant keep bakers crank out his mouth after every loss its like clockwork,"{'neg': 0.254, 'neu': 0.645, 'pos': 0.101, 'compound': -0.5859}",False,-0.5859
