,ID,Date,User,Tweet,HashTags,Likes,Retweets,MentionUsers,LocationCoordinates,clean_Tweet,Sentiment_Analysis,Positive_Sentiment,Compound_Sentiment Score
260,1584632574646755328,2022-10-24 19:47:01+00:00,BrownsorDie,"I do believe with Watson at QB you win a lot of those games we have lost this year. 

#Browns x #NFL","['Browns', 'NFL']",8,0,,,i do believe with watson at qb you win lot those games we have lost this year x,"{'neg': 0.114, 'neu': 0.697, 'pos': 0.189, 'compound': 0.3612}",True,0.3612
261,1584632354923982849,2022-10-24 19:46:09+00:00,Rob_Shenanigans,"""That's normal football."" - Kevin Stefanski #Browns https://t.co/DRMqFmWGHL",['Browns'],6,1,,,thats normal football kevin stefanski,"{'neg': 0.0, 'neu': 1.0, 'pos': 0.0, 'compound': 0.0}",False,0.0
262,1584631812370104320,2022-10-24 19:43:59+00:00,C_J_Money_,"This sums it all up right now 
#ForTheLand #LetEmKnow  #Browns https://t.co/5DfkTZQqlo","['ForTheLand', 'LetEmKnow', 'Browns']",2,0,,,this sums it all up right now,"{'neg': 0.0, 'neu': 1.0, 'pos': 0.0, 'compound': 0.0}",False,0.0
263,1584631563681243136,2022-10-24 19:43:00+00:00,BrownsChat,Scott Petrak: The offense is not getting help from the defense or special teams so they have to go out and make plays #ClevelandBrowns #Browns #BrownsNation #GoBrowns #yahoo https://t.co/LkzOPrKk3H,"['ClevelandBrowns', 'Browns', 'BrownsNation', 'GoBrowns', 'yahoo']",0,0,,,scott petrak offense is not getting help defense or special teams so they have go out make plays,"{'neg': 0.241, 'neu': 0.557, 'pos': 0.201, 'compound': 0.0186}",True,0.0186
264,1584631060196900877,2022-10-24 19:41:00+00:00,BrownsChat,Stefanski fails to call Chubb's number at crucial time in loss to Ravens | Jeff Schudel #ClevelandBrowns #Browns #BrownsNation #GoBrowns #yahoo https://t.co/H2aH4piuRw,"['ClevelandBrowns', 'Browns', 'BrownsNation', 'GoBrowns', 'yahoo']",0,0,,,stefanski fails call chubbs number at crucial time loss ravens jeff schudel,"{'neg': 0.331, 'neu': 0.584, 'pos': 0.084, 'compound': -0.5859}",False,-0.5859
265,1584630986025107456,2022-10-24 19:40:42+00:00,ChubbNHunt,I dont really know how to explain this but the #Browns need to be both Sellers and Buyers at the deadline.  Need to sell Hunt or Conklin for picks and/or package one of those 2 with JJ3 or Greedy for a dude on a long term deal.,['Browns'],0,0,,,i dont really know how explain this but need be both sellers buyers at deadline need sell hunt or conklin picks or package one those 2 with jj3 or greedy dude long term deal,"{'neg': 0.087, 'neu': 0.913, 'pos': 0.0, 'compound': -0.4497}",False,-0.4497
266,1584630980782227456,2022-10-24 19:40:41+00:00,lockerroomtal13,Then you should fire yourself for this disaster #Browns https://t.co/I1btsXriGb,['Browns'],0,0,,,then you should fire yourself this disaster,"{'neg': 0.565, 'neu': 0.435, 'pos': 0.0, 'compound': -0.7579}",False,-0.7579
267,1584630863270400000,2022-10-24 19:40:13+00:00,roachizm13,The Njoku thing is really tough. Dude was absolutely proving he was worth that extension. Rest up Chief #Browns,['Browns'],174,6,,,njoku thing is really tough dude was absolutely proving he was worth that extension rest up chief,"{'neg': 0.096, 'neu': 0.802, 'pos': 0.102, 'compound': 0.0276}",True,0.0276
268,1584630471589494784,2022-10-24 19:38:40+00:00,JackMcCurry08,"Checked into a space 

Speaker said “If Sean Payton says I want to coach the Cleveland Browns…..”

Immediately left the space because #Browns fans live…… https://t.co/ayISk9tGDU",['Browns'],3,0,,,checked into space speaker said if sean payton says i want coach cleveland browns immediately left space because fans live,"{'neg': 0.0, 'neu': 0.933, 'pos': 0.067, 'compound': 0.0772}",True,0.0772
269,1584630423241752577,2022-10-24 19:38:28+00:00,T_johnson_TJ,"D'Ernest Johnson backup RB

James Hudson lll the new RT

The #Browns get Elijah Moore I would be interested in this trade 👀. https://t.co/difDGSFZn7",['Browns'],8,1,,,dernest johnson backup rb james hudson lll new rt get elijah moore i would be interested this trade,"{'neg': 0.0, 'neu': 0.856, 'pos': 0.144, 'compound': 0.4019}",True,0.4019
270,1584630357525409792,2022-10-24 19:38:12+00:00,lockerroomtal13,They haven’t used him anyway. A contender will be after him. Good for Kareem. Like to see him flourish #Browns https://t.co/yfQ6GE5ZYE,['Browns'],1,0,,,they haven t used him anyway contender will be after him good kareem like see him flourish,"{'neg': 0.0, 'neu': 0.653, 'pos': 0.347, 'compound': 0.7096}",True,0.7096
271,1584630283856678912,2022-10-24 19:37:55+00:00,NickPedone12,Should the #Browns fire Kevin Stefanski?,['Browns'],7,1,,,should fire kevin stefanski,"{'neg': 0.444, 'neu': 0.556, 'pos': 0.0, 'compound': -0.34}",False,-0.34
272,1584630103161520128,2022-10-24 19:37:12+00:00,BenjiiiD7,"No matter the record, Hope NEVER dies in the Land 🐶 still a lot of games to be played. #Browns https://t.co/tdvwFcB7Aj",['Browns'],0,0,,"Coordinates(longitude=-76.334287, latitude=36.820791)",no matter record hope never dies land still lot games be played,"{'neg': 0.133, 'neu': 0.482, 'pos': 0.386, 'compound': 0.4939}",True,0.4939
273,1584629893455024128,2022-10-24 19:36:22+00:00,emtb123,"@KenCarman In that case I DID have a great time in Baltimore yesterday.

Side note: Not Breaking News but #Browns fans are everywhere.",['Browns'],0,0,"[User(username='KenCarman', id=115201330, displayname='Ken Carman', description=None, rawDescription=None, descriptionUrls=None, verified=None, created=None, followersCount=None, friendsCount=None, statusesCount=None, favouritesCount=None, listedCount=None, mediaCount=None, location=None, protected=None, linkUrl=None, linkTcourl=None, profileImageUrl=None, profileBannerUrl=None, label=None)]",,that case i did have great time baltimore yesterday side note not breaking news but fans are everywhere,"{'neg': 0.0, 'neu': 0.863, 'pos': 0.137, 'compound': 0.3716}",True,0.3716
274,1584629883178668032,2022-10-24 19:36:19+00:00,JackDuffin,"Tempted to see how desperate the Jets are to keep their push going:

Jets get: Hunt &amp; Conklin
#Browns get: Moore

Win win for both side 🤔",['Browns'],373,13,,,tempted see how desperate jets are keep their push going jets get hunt amp conklin get moore win win both side,"{'neg': 0.082, 'neu': 0.645, 'pos': 0.272, 'compound': 0.743}",True,0.743
275,1584629327080980480,2022-10-24 19:34:07+00:00,lockerroomtal13,😞 but I would love him to lay for a contender #Browns https://t.co/yd8sEgZzr2,['Browns'],0,0,,,but i would love him lay contender,"{'neg': 0.0, 'neu': 0.346, 'pos': 0.654, 'compound': 0.8201}",True,0.8201
276,1584629261129990148,2022-10-24 19:33:51+00:00,MatthewPetey,"Question for #Browns fans:

I would only trade Kareem Hunt for a ___ round pick",['Browns'],0,0,,,question fans i would only trade kareem hunt round pick,"{'neg': 0.0, 'neu': 1.0, 'pos': 0.0, 'compound': 0.0}",False,0.0
277,1584629046016585729,2022-10-24 19:33:00+00:00,ultCLEsports,"There's not much of a difference between Kevin Stefanski and Jacoby Brissett in late game situations for the #Browns | @Gbush91 #UCSS

https://t.co/n5RadUSFjR https://t.co/JU0PlcJteE","['Browns', 'UCSS']",8,0,"[User(username='Gbush91', id=86643419, displayname='Garrett Bush', description=None, rawDescription=None, descriptionUrls=None, verified=None, created=None, followersCount=None, friendsCount=None, statusesCount=None, favouritesCount=None, listedCount=None, mediaCount=None, location=None, protected=None, linkUrl=None, linkTcourl=None, profileImageUrl=None, profileBannerUrl=None, label=None)]",,theres not much difference between kevin stefanski jacoby brissett late game situations,"{'neg': 0.0, 'neu': 1.0, 'pos': 0.0, 'compound': 0.0}",False,0.0
278,1584628906237505536,2022-10-24 19:32:26+00:00,girlincle,The apathy around the #Browns is alarming.,['Browns'],9,0,,,apathy around is alarming,"{'neg': 0.649, 'neu': 0.351, 'pos': 0.0, 'compound': -0.4019}",False,-0.4019
279,1584628885878345728,2022-10-24 19:32:22+00:00,PJOBrownie,@djrbrownsfan79 Sometimes that underdawg will maximize his talent &amp; do all the little things right #Browns,['Browns'],1,0,"[User(username='djrbrownsfan79', id=719261120515719169, displayname='Gooch', description=None, rawDescription=None, descriptionUrls=None, verified=None, created=None, followersCount=None, friendsCount=None, statusesCount=None, favouritesCount=None, listedCount=None, mediaCount=None, location=None, protected=None, linkUrl=None, linkTcourl=None, profileImageUrl=None, profileBannerUrl=None, label=None)]",,sometimes that underdawg will maximize his talent amp do all little things right,"{'neg': 0.0, 'neu': 0.811, 'pos': 0.189, 'compound': 0.4215}",True,0.4215
280,1584628795981578240,2022-10-24 19:32:00+00:00,BrownsChat,NFL World Reacts To Browns' Running Back Trade Rumor News #ClevelandBrowns #Browns #BrownsNation #GoBrowns https://t.co/fAGTDlKX7K,"['ClevelandBrowns', 'Browns', 'BrownsNation', 'GoBrowns']",0,0,,,nfl world reacts browns running back trade rumor news,"{'neg': 0.0, 'neu': 1.0, 'pos': 0.0, 'compound': 0.0}",False,0.0
281,1584628755363860481,2022-10-24 19:31:50+00:00,GuardsIn4,Dream scenario for the #Browns during the fall of Dan Snyder major dirt on Jimmy Haslam comes out and he is also forced out of the NFL. Team will never stand a chance under his ownership.,['Browns'],2,0,,,dream scenario during fall dan snyder major dirt jimmy haslam comes out he is also forced out nfl team will never stand chance under his ownership,"{'neg': 0.229, 'neu': 0.706, 'pos': 0.064, 'compound': -0.6298}",False,-0.6298
282,1584628712573530112,2022-10-24 19:31:40+00:00,JThrock45_,Every year……#Browns https://t.co/u7GOA1EQ6p,['Browns'],23,1,,,every year,"{'neg': 0.0, 'neu': 1.0, 'pos': 0.0, 'compound': 0.0}",False,0.0
283,1584628610014793729,2022-10-24 19:31:16+00:00,junkitagawa7,@Browns No can’t do! #Browns fire woods!!! Nobody believes in the coaches,['Browns'],0,0,"[User(username='Browns', id=40358743, displayname='Cleveland Browns', description=None, rawDescription=None, descriptionUrls=None, verified=None, created=None, followersCount=None, friendsCount=None, statusesCount=None, favouritesCount=None, listedCount=None, mediaCount=None, location=None, protected=None, linkUrl=None, linkTcourl=None, profileImageUrl=None, profileBannerUrl=None, label=None)]",,no can t do fire woods nobody believes coaches,"{'neg': 0.434, 'neu': 0.566, 'pos': 0.0, 'compound': -0.5574}",False,-0.5574
284,1584628543853584384,2022-10-24 19:31:00+00:00,BrownsChat,NFL World Reacts To Browns' Significant Injury News #ClevelandBrowns #Browns #BrownsNation #GoBrowns https://t.co/fmx9Ri5VwT,"['ClevelandBrowns', 'Browns', 'BrownsNation', 'GoBrowns']",0,0,,,nfl world reacts browns significant injury news,"{'neg': 0.292, 'neu': 0.521, 'pos': 0.188, 'compound': -0.25}",False,-0.25
285,1584628364203425792,2022-10-24 19:30:17+00:00,T_johnson_TJ,"It’s hilarious to me the amount of people that:

1. Want and believe that Kevin Stefanski should be fired. 

2. Think Sean Payton would be interested in coaching this team.

3. Don’t understand the team would have to give up draft picks to acquire him #Browns.",['Browns'],21,2,,,it s hilarious me amount people that 1 want believe that kevin stefanski should be fired 2 think sean payton would be interested coaching this team 3 don t understand team would have give up draft picks acquire him,"{'neg': 0.089, 'neu': 0.744, 'pos': 0.166, 'compound': 0.2732}",True,0.2732
286,1584628279558180865,2022-10-24 19:29:57+00:00,MarcusHarvey_,"Alijah Vera-Tucker suffered a season ending injury on Sunday. It is time to place the phone call to the Jets.

It’s the only way that they find an appropriate replacement along the offensive line.

Get it done #Browns https://t.co/MhoMUT3GSQ",['Browns'],1,0,,,alijah vera tucker suffered season ending injury sunday it is time place phone call jets it s only way that they find appropriate replacement along offensive line get it done,"{'neg': 0.257, 'neu': 0.743, 'pos': 0.0, 'compound': -0.8402}",False,-0.8402
287,1584628149031256070,2022-10-24 19:29:26+00:00,923TheFan,".@NathanZegura on @afternoon923FAN: #Browns more of a seller than a buyer at deadline; it's been a botched season to this point, have yet to play a complete game https://t.co/b3y8VHEmni",['Browns'],6,3,"[User(username='NathanZegura', id=67971206, displayname='Nathan Zegura', description=None, rawDescription=None, descriptionUrls=None, verified=None, created=None, followersCount=None, friendsCount=None, statusesCount=None, favouritesCount=None, listedCount=None, mediaCount=None, location=None, protected=None, linkUrl=None, linkTcourl=None, profileImageUrl=None, profileBannerUrl=None, label=None), User(username='afternoon923FAN', id=385745691, displayname='AfternoonDrive', description=None, rawDescription=None, descriptionUrls=None, verified=None, created=None, followersCount=None, friendsCount=None, statusesCount=None, favouritesCount=None, listedCount=None, mediaCount=None, location=None, protected=None, linkUrl=None, linkTcourl=None, profileImageUrl=None, profileBannerUrl=None, label=None)]",,more seller than buyer at deadline its been botched season this point have yet play complete game,"{'neg': 0.0, 'neu': 0.87, 'pos': 0.13, 'compound': 0.34}",True,0.34
288,1584628066231283713,2022-10-24 19:29:06+00:00,sayanovsky,#Browns ...so maybe Baker wasn't the problem? lol,['Browns'],0,0,,,so maybe baker wasnt problem lol,"{'neg': 0.271, 'neu': 0.466, 'pos': 0.263, 'compound': -0.0191}",False,-0.0191
289,1584628052952174593,2022-10-24 19:29:03+00:00,Flint521466,@nflplaya77 Same Old #Browns szn,['Browns'],1,0,"[User(username='nflplaya77', id=23236188, displayname='Big Hoss (Jamyson like the whiskey)🏈🏀⚾💪', description=None, rawDescription=None, descriptionUrls=None, verified=None, created=None, followersCount=None, friendsCount=None, statusesCount=None, favouritesCount=None, listedCount=None, mediaCount=None, location=None, protected=None, linkUrl=None, linkTcourl=None, profileImageUrl=None, profileBannerUrl=None, label=None)]",,same old szn,"{'neg': 0.0, 'neu': 1.0, 'pos': 0.0, 'compound': 0.0}",False,0.0
290,1584627764627316737,2022-10-24 19:27:54+00:00,JohnnyOhio,"It’s fun seeing everyone saying the 3rd and 2 pass was a touchdown. 

Because I thought touchdowns gave you 6 points. They got -10 yards #Browns lost. Part of the risk on calling that is OPI and they called it. 

Not a touchdown. They lost. https://t.co/oN26A8GIIz",['Browns'],0,0,,,it s fun seeing everyone saying 3rd 2 pass was touchdown because i thought touchdowns gave you 6 points they got 10 yards lost part risk calling that is opi they called it not touchdown they lost,"{'neg': 0.172, 'neu': 0.744, 'pos': 0.085, 'compound': -0.34}",False,-0.34
291,1584627730804457473,2022-10-24 19:27:46+00:00,cuarto_down,"Los @Browns estarían escuchando ofertas de trade por su RB Kareem Hunt y su CB Greedy Williams 🏈

#Browns
#NFLTwitter 
#NFL https://t.co/6TJAC9uXIw","['Browns', 'NFLTwitter', 'NFL']",0,0,"[User(username='Browns', id=40358743, displayname='Cleveland Browns', description=None, rawDescription=None, descriptionUrls=None, verified=None, created=None, followersCount=None, friendsCount=None, statusesCount=None, favouritesCount=None, listedCount=None, mediaCount=None, location=None, protected=None, linkUrl=None, linkTcourl=None, profileImageUrl=None, profileBannerUrl=None, label=None)]",,los estar escuchando ofertas de trade por su rb kareem hunt y su cb greedy williams,"{'neg': 0.141, 'neu': 0.859, 'pos': 0.0, 'compound': -0.3182}",False,-0.3182
292,1584627434275893249,2022-10-24 19:26:35+00:00,MarcusHarvey_,Conklin for Moore. Get it done. #Browns https://t.co/dI1AjBZTMB,['Browns'],2,0,,,conklin moore get it done,"{'neg': 0.0, 'neu': 1.0, 'pos': 0.0, 'compound': 0.0}",False,0.0
293,1584627357029015552,2022-10-24 19:26:17+00:00,TheDawgLand,Check out @JackMcCurry08 on Sports4CLE this afternoon! #Browns https://t.co/7yTXEVPAZX,['Browns'],0,0,"[User(username='JackMcCurry08', id=918549869232574464, displayname='Jackson McCurry', description=None, rawDescription=None, descriptionUrls=None, verified=None, created=None, followersCount=None, friendsCount=None, statusesCount=None, favouritesCount=None, listedCount=None, mediaCount=None, location=None, protected=None, linkUrl=None, linkTcourl=None, profileImageUrl=None, profileBannerUrl=None, label=None)]",,check out sports4cle this afternoon,"{'neg': 0.0, 'neu': 1.0, 'pos': 0.0, 'compound': 0.0}",False,0.0
294,1584627353044811778,2022-10-24 19:26:16+00:00,Meta_Sports_,@StainbrookNFL #Browns,['Browns'],0,0,"[User(username='StainbrookNFL', id=1022651479918751745, displayname='Brad Stainbrook', description=None, rawDescription=None, descriptionUrls=None, verified=None, created=None, followersCount=None, friendsCount=None, statusesCount=None, favouritesCount=None, listedCount=None, mediaCount=None, location=None, protected=None, linkUrl=None, linkTcourl=None, profileImageUrl=None, profileBannerUrl=None, label=None)]",,,"{'neg': 0.0, 'neu': 0.0, 'pos': 0.0, 'compound': 0.0}",False,0.0
295,1584627296421711872,2022-10-24 19:26:03+00:00,dawgpounddaily,#Browns place two big names on trade block (via @gnewland52) https://t.co/PTed77iVM1,['Browns'],2,0,"[User(username='Gnewland52', id=186304576, displayname='Greg Newland', description=None, rawDescription=None, descriptionUrls=None, verified=None, created=None, followersCount=None, friendsCount=None, statusesCount=None, favouritesCount=None, listedCount=None, mediaCount=None, location=None, protected=None, linkUrl=None, linkTcourl=None, profileImageUrl=None, profileBannerUrl=None, label=None)]",,place two big names trade block via,"{'neg': 0.326, 'neu': 0.674, 'pos': 0.0, 'compound': -0.4404}",False,-0.4404
296,1584627273361428480,2022-10-24 19:25:57+00:00,BurgessBros,How about we play them to try and win some games?! Go #Browns https://t.co/tFK7lHzPUI,['Browns'],1,0,,,how about we play them try win some games go,"{'neg': 0.0, 'neu': 0.563, 'pos': 0.437, 'compound': 0.7351}",True,0.7351
297,1584626840437940224,2022-10-24 19:24:14+00:00,AntMattix51,"@_MLFootball Kareem Hunt and Jack Conklin to #jets 

Elijah Moore and Denzel Mims to #Browns","['jets', 'Browns']",1,0,"[User(username='_MLFootball', id=1494072723001286658, displayname='MLFootball', description=None, rawDescription=None, descriptionUrls=None, verified=None, created=None, followersCount=None, friendsCount=None, statusesCount=None, favouritesCount=None, listedCount=None, mediaCount=None, location=None, protected=None, linkUrl=None, linkTcourl=None, profileImageUrl=None, profileBannerUrl=None, label=None)]",,kareem hunt jack conklin elijah moore denzel mims,"{'neg': 0.0, 'neu': 1.0, 'pos': 0.0, 'compound': 0.0}",False,0.0
298,1584626553543364608,2022-10-24 19:23:05+00:00,SissyCharlie5,Hunt and Williams are on the block!! #Browns,['Browns'],0,0,,,hunt williams are block,"{'neg': 0.492, 'neu': 0.508, 'pos': 0.0, 'compound': -0.4404}",False,-0.4404
299,1584626468004384768,2022-10-24 19:22:45+00:00,KOTBill11,"Just saying, watch the Gus edwards TD run. When you give 0 effort, you get 0 results. When your LB has to push you out of the way to try and make a tackle, just maybe you aren’t giving 100 percent….#Browns https://t.co/t2o2mJFK6y",['Browns'],1,0,,,just saying watch gus edwards td run when you give 0 effort you get 0 results when your lb has push you out way try make tackle just maybe you aren t giving 100 percent,"{'neg': 0.0, 'neu': 0.928, 'pos': 0.072, 'compound': 0.34}",True,0.34
300,1584626334906847234,2022-10-24 19:22:13+00:00,GopackgoJ,#Browns https://t.co/8A4RJ1k8u4,['Browns'],1,1,,,,"{'neg': 0.0, 'neu': 0.0, 'pos': 0.0, 'compound': 0.0}",False,0.0
301,1584626281072689154,2022-10-24 19:22:00+00:00,BrownsChat,[Stainbrook] Browns listening to offers for RB Kareem Hunt and DB Greedy Williams #BrownsReddit #BrownsFans #BrownsOpinion #Browns #BrownsFan #Believeland #TheLand https://t.co/ZheKvidYV4,"['BrownsReddit', 'BrownsFans', 'BrownsOpinion', 'Browns', 'BrownsFan', 'Believeland', 'TheLand']",0,0,,,browns listening offers rb kareem hunt db greedy williams,"{'neg': 0.223, 'neu': 0.777, 'pos': 0.0, 'compound': -0.3182}",False,-0.3182
302,1584626069852024832,2022-10-24 19:21:10+00:00,Mr_B15,"You’re not going to get much back, especially for Greedy, but #Browns can’t let guys walk in free agency without getting something back in return https://t.co/EB6qxHbgvt",['Browns'],0,0,,,you re not going get much back especially greedy but can t let guys walk free agency without getting something back return,"{'neg': 0.071, 'neu': 0.753, 'pos': 0.176, 'compound': 0.5652}",True,0.5652
303,1584626041913589770,2022-10-24 19:21:03+00:00,BrownsChat,Stat Shows Nick Chubb’s Importance To Browns Offense #BrownsFootball #Browns #DawgPound #WeBarkTogether #Believeland https://t.co/C5PNa8ffOw,"['BrownsFootball', 'Browns', 'DawgPound', 'WeBarkTogether', 'Believeland']",0,0,,,stat shows nick chubb s importance browns offense,"{'neg': 0.211, 'neu': 0.526, 'pos': 0.263, 'compound': 0.128}",True,0.128
304,1584626006538997760,2022-10-24 19:20:55+00:00,Rob_Shenanigans,The Bengals game on Monday night (Halloween) is literally a must-win for the #Browns. No team in NFL history has ever made the playoffs after starting out 2-6. https://t.co/avjjs4yVge,['Browns'],10,0,,,bengals game monday night halloween is literally must win no team nfl history has ever made playoffs after starting out 2 6,"{'neg': 0.092, 'neu': 0.75, 'pos': 0.158, 'compound': 0.3818}",True,0.3818
305,1584625999555489792,2022-10-24 19:20:53+00:00,Chief_Ace7,"@Kwen_C Man please stop. It’s not about how many times he touches the ball it’s when. If it’s 3 and 2 why not have the best running back in football on the field? The D can show blitz and drop into coverage. So just bcuz they show 7 in the box, doesn’t mean everyone is blitzing #Browns",['Browns'],34,0,"[User(username='Kwen_C', id=227156168, displayname='Quincy Carrier', description=None, rawDescription=None, descriptionUrls=None, verified=None, created=None, followersCount=None, friendsCount=None, statusesCount=None, favouritesCount=None, listedCount=None, mediaCount=None, location=None, protected=None, linkUrl=None, linkTcourl=None, profileImageUrl=None, profileBannerUrl=None, label=None)]",,man please stop it s not about how many times he touches ball it s when if it s 3 2 why not have best running back football field d can show blitz drop into coverage so just bcuz they show 7 box doesn t mean everyone is blitzing,"{'neg': 0.163, 'neu': 0.788, 'pos': 0.049, 'compound': -0.6562}",False,-0.6562
306,1584625996309094400,2022-10-24 19:20:53+00:00,FDPodcastCLE,"JOK graded out at a 90.6 this week per @PFF 👀

📸: @Browns | @j_owuu | #Browns https://t.co/aB80kXP0HN",['Browns'],216,16,"[User(username='PFF', id=87954771, displayname='PFF', description=None, rawDescription=None, descriptionUrls=None, verified=None, created=None, followersCount=None, friendsCount=None, statusesCount=None, favouritesCount=None, listedCount=None, mediaCount=None, location=None, protected=None, linkUrl=None, linkTcourl=None, profileImageUrl=None, profileBannerUrl=None, label=None), User(username='Browns', id=40358743, displayname='Cleveland Browns', description=None, rawDescription=None, descriptionUrls=None, verified=None, created=None, followersCount=None, friendsCount=None, statusesCount=None, favouritesCount=None, listedCount=None, mediaCount=None, location=None, protected=None, linkUrl=None, linkTcourl=None, profileImageUrl=None, profileBannerUrl=None, label=None), User(username='j_owuu', id=497298301, displayname='JOK', description=None, rawDescription=None, descriptionUrls=None, verified=None, created=None, followersCount=None, friendsCount=None, statusesCount=None, favouritesCount=None, listedCount=None, mediaCount=None, location=None, protected=None, linkUrl=None, linkTcourl=None, profileImageUrl=None, profileBannerUrl=None, label=None)]",,jok graded out at 90 6 this week per,"{'neg': 0.0, 'neu': 1.0, 'pos': 0.0, 'compound': 0.0}",False,0.0
307,1584625922103250944,2022-10-24 19:20:35+00:00,Sports4Cle,"@ScottPetrak &amp; @JackMcCurry08 join today's show to discuss what went wrong in the #Browns loss to the Ravens, where they go from here, and more

We are live at 4 pm ET on @clevelanddotcom 

https://t.co/IFK3JnzPYg",['Browns'],1,1,"[User(username='ScottPetrak', id=115413666, displayname='Scott Petrak ct', description=None, rawDescription=None, descriptionUrls=None, verified=None, created=None, followersCount=None, friendsCount=None, statusesCount=None, favouritesCount=None, listedCount=None, mediaCount=None, location=None, protected=None, linkUrl=None, linkTcourl=None, profileImageUrl=None, profileBannerUrl=None, label=None), User(username='JackMcCurry08', id=918549869232574464, displayname='Jackson McCurry', description=None, rawDescription=None, descriptionUrls=None, verified=None, created=None, followersCount=None, friendsCount=None, statusesCount=None, favouritesCount=None, listedCount=None, mediaCount=None, location=None, protected=None, linkUrl=None, linkTcourl=None, profileImageUrl=None, profileBannerUrl=None, label=None), User(username='clevelanddotcom', id=14267944, displayname='clevelanddotcom', description=None, rawDescription=None, descriptionUrls=None, verified=None, created=None, followersCount=None, friendsCount=None, statusesCount=None, favouritesCount=None, listedCount=None, mediaCount=None, location=None, protected=None, linkUrl=None, linkTcourl=None, profileImageUrl=None, profileBannerUrl=None, label=None)]",,amp join todays show discuss what went wrong loss ravens where they go here more we are live at 4 pm et,"{'neg': 0.211, 'neu': 0.703, 'pos': 0.086, 'compound': -0.4939}",False,-0.4939
