,ID,Date,User,Tweet,HashTags,Likes,Retweets,MentionUsers,LocationCoordinates,clean_Tweet,Sentiment_Analysis,Positive_Sentiment,Compound_Sentiment Score
132,1584661895671611392,2022-10-24 21:43:32+00:00,angryindiansfan,"@NickWilsonSays In the words of Mike Priefer himself, #browns fans “should round up this underachieving coach, send him to an island, and then nuke it until it glows.”",['browns'],0,0,"[User(username='NickWilsonSays', id=362641934, displayname='Nick Wilson', description=None, rawDescription=None, descriptionUrls=None, verified=None, created=None, followersCount=None, friendsCount=None, statusesCount=None, favouritesCount=None, listedCount=None, mediaCount=None, location=None, protected=None, linkUrl=None, linkTcourl=None, profileImageUrl=None, profileBannerUrl=None, label=None)]",,words mike priefer himself fans should round up this underachieving coach send him island then nuke it until it glows,"{'neg': 0.0, 'neu': 1.0, 'pos': 0.0, 'compound': 0.0}",False,0.0
133,1584661817887838208,2022-10-24 21:43:13+00:00,62010Mullins,#Browns starting to sell… welp that was fun,['Browns'],0,0,,,starting sell welp that was fun,"{'neg': 0.0, 'neu': 0.602, 'pos': 0.398, 'compound': 0.5106}",True,0.5106
134,1584661662719561728,2022-10-24 21:42:36+00:00,JerryBuckeye,"@DawgPound1946 IMO, #Browns have a player problem, not a coaching problem!",['Browns'],3,0,"[User(username='DawgPound1946', id=1429211177029148678, displayname='Cleveland Sports Guy', description=None, rawDescription=None, descriptionUrls=None, verified=None, created=None, followersCount=None, friendsCount=None, statusesCount=None, favouritesCount=None, listedCount=None, mediaCount=None, location=None, protected=None, linkUrl=None, linkTcourl=None, profileImageUrl=None, profileBannerUrl=None, label=None)]",,imo have player problem not coaching problem,"{'neg': 0.519, 'neu': 0.481, 'pos': 0.0, 'compound': -0.6597}",False,-0.6597
135,1584661533719932928,2022-10-24 21:42:05+00:00,burpeesRfun,"BERNIE!!!!!! #Browns at the @TimRyan event with @davematthewsbnd 🥰🥰🥰🥰 love you, @BernieKosarQB 💙💙💙 https://t.co/tHin5dfDAf",['Browns'],8,2,"[User(username='TimRyan', id=466532637, displayname='Tim Ryan', description=None, rawDescription=None, descriptionUrls=None, verified=None, created=None, followersCount=None, friendsCount=None, statusesCount=None, favouritesCount=None, listedCount=None, mediaCount=None, location=None, protected=None, linkUrl=None, linkTcourl=None, profileImageUrl=None, profileBannerUrl=None, label=None), User(username='davematthewsbnd', id=44030337, displayname='dave matthews band', description=None, rawDescription=None, descriptionUrls=None, verified=None, created=None, followersCount=None, friendsCount=None, statusesCount=None, favouritesCount=None, listedCount=None, mediaCount=None, location=None, protected=None, linkUrl=None, linkTcourl=None, profileImageUrl=None, profileBannerUrl=None, label=None), User(username='BernieKosarQB', id=358305500, displayname='Bernie Kosar', description=None, rawDescription=None, descriptionUrls=None, verified=None, created=None, followersCount=None, friendsCount=None, statusesCount=None, favouritesCount=None, listedCount=None, mediaCount=None, location=None, protected=None, linkUrl=None, linkTcourl=None, profileImageUrl=None, profileBannerUrl=None, label=None)]",,bernie at event with love you,"{'neg': 0.0, 'neu': 0.543, 'pos': 0.457, 'compound': 0.6369}",True,0.6369
136,1584661259496062981,2022-10-24 21:41:00+00:00,BrownsChat,Browns Defender Is Expected To Miss Rest Of The Season #ClevelandBrowns #Browns #BrownsNation #GoBrowns https://t.co/JGProfywoc,"['ClevelandBrowns', 'Browns', 'BrownsNation', 'GoBrowns']",1,0,,,browns defender is expected miss rest season,"{'neg': 0.2, 'neu': 0.625, 'pos': 0.175, 'compound': -0.0516}",False,-0.0516
137,1584660925214515201,2022-10-24 21:39:40+00:00,Det_Stavros,@Champ_Dawg9 @BrownsTherapy it's so weird...he didn't even lay a hand on the runner. JJ3 was within 3 ft of the runner and never even tried to reach out with his arm to tackle the guy ??? #browns,['browns'],2,0,"[User(username='Champ_Dawg9', id=71875415, displayname='Champ', description=None, rawDescription=None, descriptionUrls=None, verified=None, created=None, followersCount=None, friendsCount=None, statusesCount=None, favouritesCount=None, listedCount=None, mediaCount=None, location=None, protected=None, linkUrl=None, linkTcourl=None, profileImageUrl=None, profileBannerUrl=None, label=None), User(username='BrownsTherapy', id=2935611274, displayname='BrownsTherapy', description=None, rawDescription=None, descriptionUrls=None, verified=None, created=None, followersCount=None, friendsCount=None, statusesCount=None, favouritesCount=None, listedCount=None, mediaCount=None, location=None, protected=None, linkUrl=None, linkTcourl=None, profileImageUrl=None, profileBannerUrl=None, label=None)]",,its so weird he didnt even lay hand runner jj3 was within 3 ft runner never even tried reach out with his arm tackle guy,"{'neg': 0.213, 'neu': 0.787, 'pos': 0.0, 'compound': -0.5712}",False,-0.5712
138,1584660270798233600,2022-10-24 21:37:04+00:00,roachizm13,"I just thought locker room bullshit was behind us, silly me. Clearly the biggest locker room issue was never dealt with and now that the losing has started its getting worse. There's plenty of talent for the future but massive changes are needed. Get JJ3 outta here man #Browns",['Browns'],95,5,,,i just thought locker room bullshit was behind us silly me clearly biggest locker room issue was never dealt with now that losing has started its getting worse theres plenty talent future but massive changes are needed get jj3 outta here man,"{'neg': 0.136, 'neu': 0.76, 'pos': 0.104, 'compound': -0.3506}",False,-0.3506
139,1584659247656214529,2022-10-24 21:33:00+00:00,BrownsChat,This is above and beyond what I expected #BrownsReddit #BrownsFans #BrownsOpinion #Browns #BrownsFan #Believeland #TheLand https://t.co/StvIcuqkuC,"['BrownsReddit', 'BrownsFans', 'BrownsOpinion', 'Browns', 'BrownsFan', 'Believeland', 'TheLand']",0,0,,,this is above beyond what i expected,"{'neg': 0.0, 'neu': 1.0, 'pos': 0.0, 'compound': 0.0}",False,0.0
140,1584659159718543361,2022-10-24 21:32:39+00:00,twithersAP,"#Browns fuming, frustrated following another close loss (from @AP) https://t.co/tuFXm8gBuf",['Browns'],5,1,"[User(username='AP', id=51241574, displayname='The Associated Press', description=None, rawDescription=None, descriptionUrls=None, verified=None, created=None, followersCount=None, friendsCount=None, statusesCount=None, favouritesCount=None, listedCount=None, mediaCount=None, location=None, protected=None, linkUrl=None, linkTcourl=None, profileImageUrl=None, profileBannerUrl=None, label=None)]",,fuming frustrated following another close loss,"{'neg': 0.758, 'neu': 0.242, 'pos': 0.0, 'compound': -0.8555}",False,-0.8555
141,1584659074494664704,2022-10-24 21:32:19+00:00,dawgpoundduck,The shotgun was bad. But how was my chief slam? @David_Njoku80  #browns #dawgsssss https://t.co/9Jqm0nVbWu,"['browns', 'dawgsssss']",1,0,"[User(username='David_Njoku80', id=883401296, displayname='Chief David Njoku', description=None, rawDescription=None, descriptionUrls=None, verified=None, created=None, followersCount=None, friendsCount=None, statusesCount=None, favouritesCount=None, listedCount=None, mediaCount=None, location=None, protected=None, linkUrl=None, linkTcourl=None, profileImageUrl=None, profileBannerUrl=None, label=None)]",,shotgun was bad but how was my chief slam,"{'neg': 0.447, 'neu': 0.553, 'pos': 0.0, 'compound': -0.6858}",False,-0.6858
142,1584658746151534593,2022-10-24 21:31:01+00:00,BrownsChat,"Browns’ defensive snap counts, stats, and notes: Week 7 #BrownsFootball #Browns #DawgPound #WeBarkTogether #Believeland https://t.co/2McIoe1f0m","['BrownsFootball', 'Browns', 'DawgPound', 'WeBarkTogether', 'Believeland']",0,0,,,browns defensive snap counts stats notes week 7,"{'neg': 0.0, 'neu': 0.845, 'pos': 0.155, 'compound': 0.0258}",True,0.0258
143,1584658457738633216,2022-10-24 21:29:52+00:00,JohnnyOhio,"Only about 10 teams per year have a FG kick blocked 31%

#Browns have one almost every year w/ ST Coach Priefer 

Guess how many also have an onside kick recovered &amp; a muffed punt?

Only one OSK recovered so far this year makes it easy. Rare stuff they are doing on Special Teams https://t.co/CdblHgxG6N",['Browns'],0,0,,,only about 10 teams per year have fg kick blocked 31 have one almost every year w st coach priefer guess how many also have onside kick recovered amp muffed punt only one osk recovered so far this year makes it easy rare stuff they are doing special teams,"{'neg': 0.04, 'neu': 0.854, 'pos': 0.106, 'compound': 0.5423}",True,0.5423
144,1584658437795090432,2022-10-24 21:29:47+00:00,StuffNThings216,@MattFontana83 @RealDCunningham leadership is like respect… it’s earned not given. If they don’t have leadership it’s bc nobody has earned in in the locker room #Browns,['Browns'],0,0,"[User(username='MattFontana83', id=201009917, displayname='Matt Fontana', description=None, rawDescription=None, descriptionUrls=None, verified=None, created=None, followersCount=None, friendsCount=None, statusesCount=None, favouritesCount=None, listedCount=None, mediaCount=None, location=None, protected=None, linkUrl=None, linkTcourl=None, profileImageUrl=None, profileBannerUrl=None, label=None), User(username='RealDCunningham', id=2581493186, displayname='Danny Cunningham', description=None, rawDescription=None, descriptionUrls=None, verified=None, created=None, followersCount=None, friendsCount=None, statusesCount=None, favouritesCount=None, listedCount=None, mediaCount=None, location=None, protected=None, linkUrl=None, linkTcourl=None, profileImageUrl=None, profileBannerUrl=None, label=None)]",,leadership is like respect it s earned not given if they don t have leadership it s bc nobody has earned locker room,"{'neg': 0.0, 'neu': 0.763, 'pos': 0.237, 'compound': 0.6808}",True,0.6808
145,1584658015277371392,2022-10-24 21:28:07+00:00,Playlikeajet1,@ivanwh I wonder if #Jets could get a Hunt/Conklin combo from #Browns.,"['Jets', 'Browns']",4,0,"[User(username='ivanwh', id=17029695, displayname='Ivan Del Ducca', description=None, rawDescription=None, descriptionUrls=None, verified=None, created=None, followersCount=None, friendsCount=None, statusesCount=None, favouritesCount=None, listedCount=None, mediaCount=None, location=None, protected=None, linkUrl=None, linkTcourl=None, profileImageUrl=None, profileBannerUrl=None, label=None)]",,i wonder if could get hunt conklin combo,"{'neg': 0.0, 'neu': 1.0, 'pos': 0.0, 'compound': 0.0}",False,0.0
146,1584657719839293444,2022-10-24 21:26:56+00:00,RR0DY,Remember when we were told for two years Chubb and Hunt would be on the field together? #Browns https://t.co/zf3315zxTA,['Browns'],0,0,,,remember when we were told two years chubb hunt would be field together,"{'neg': 0.0, 'neu': 1.0, 'pos': 0.0, 'compound': 0.0}",False,0.0
147,1584656832966320128,2022-10-24 21:23:25+00:00,tERWiLLIgerking,"What’s the only constant in the #Browns failure?

The fans.

Losing record: 2012-2019
Winning record: 2020 (no fans)
Losing record: 2021-2022

Discuss amongst yourselves…",['Browns'],0,0,,,what s only constant failure fans losing record 2012 2019 winning record 2020 no fans losing record 2021 2022 discuss amongst yourselves,"{'neg': 0.355, 'neu': 0.532, 'pos': 0.113, 'compound': -0.743}",False,-0.743
148,1584656625033310208,2022-10-24 21:22:35+00:00,RyanGiles_,"@ElGobEagle Diwali so class, pisses the old people off x2, hate the fireworks and the #browns",['browns'],1,1,"[User(username='ElGobEagle', id=1463988213668790272, displayname='El Gobshite', description=None, rawDescription=None, descriptionUrls=None, verified=None, created=None, followersCount=None, friendsCount=None, statusesCount=None, favouritesCount=None, listedCount=None, mediaCount=None, location=None, protected=None, linkUrl=None, linkTcourl=None, profileImageUrl=None, profileBannerUrl=None, label=None)]",,diwali so class pisses old people off x2 hate fireworks,"{'neg': 0.444, 'neu': 0.556, 'pos': 0.0, 'compound': -0.749}",False,-0.749
149,1584656573833834496,2022-10-24 21:22:23+00:00,Playlikeajet1,"Just texted @JaredKMueller who brought up a good point: #Browns could solve #Jets RB &amp; OT problems at once with a Hunt/Conklin combo. 

Conklin could give #Jets help now &amp; as a relatively inexpensive RT option in 2023. 

Question is asking price, but it's an intriguing scenario.","['Browns', 'Jets', 'Jets']",77,2,"[User(username='JaredKMueller', id=348805008, displayname='Jared Mueller', description=None, rawDescription=None, descriptionUrls=None, verified=None, created=None, followersCount=None, friendsCount=None, statusesCount=None, favouritesCount=None, listedCount=None, mediaCount=None, location=None, protected=None, linkUrl=None, linkTcourl=None, profileImageUrl=None, profileBannerUrl=None, label=None)]",,just texted who brought up good point could solve rb amp ot problems at once with hunt conklin combo conklin could give help now amp as relatively inexpensive rt option 2023 question is asking price but its intriguing scenario,"{'neg': 0.044, 'neu': 0.832, 'pos': 0.124, 'compound': 0.3291}",True,0.3291
150,1584656554363846658,2022-10-24 21:22:18+00:00,dawgpounddaily,#Browns fans: Who are you 100% sure gets traded by the deadline?,['Browns'],8,2,,,fans who are you 100 sure gets traded by deadline,"{'neg': 0.0, 'neu': 0.796, 'pos': 0.204, 'compound': 0.3182}",True,0.3182
151,1584656499816615936,2022-10-24 21:22:05+00:00,LB_XII_,Sell your #Browns tickets and go to a #Cavs game instead. It’s good for the soul.,"['Browns', 'Cavs']",4,0,,,sell your tickets go game instead it s good soul,"{'neg': 0.0, 'neu': 0.734, 'pos': 0.266, 'compound': 0.4404}",True,0.4404
152,1584656478086086656,2022-10-24 21:22:00+00:00,BrownsChat,"Browns’ offensive snap counts, stats, and notes: Week 7 #BrownsFootball #Browns #DawgPound #WeBarkTogether #Believeland https://t.co/4qLbgbmHDw","['BrownsFootball', 'Browns', 'DawgPound', 'WeBarkTogether', 'Believeland']",0,0,,,browns offensive snap counts stats notes week 7,"{'neg': 0.333, 'neu': 0.667, 'pos': 0.0, 'compound': -0.4588}",False,-0.4588
153,1584656235848253440,2022-10-24 21:21:02+00:00,BrownsChat,NFL Fans React To Kareem Hunt Trade Report #BrownsFootball #Browns #DawgPound #WeBarkTogether #Believeland https://t.co/hMOpCmMJgG,"['BrownsFootball', 'Browns', 'DawgPound', 'WeBarkTogether', 'Believeland']",0,0,,,nfl fans react kareem hunt trade report,"{'neg': 0.0, 'neu': 1.0, 'pos': 0.0, 'compound': 0.0}",False,0.0
154,1584656122019196928,2022-10-24 21:20:35+00:00,MylesOffTheEdge,"#Browns

The Ivy Leaguers aren’t getting the job done in Berea. 

And that pressure is going to be ENORMOUS once massage boy is playing football again. 

And the problem is, Andrew Berry will be rebuilding a team that he built.",['Browns'],3,0,,,ivy leaguers aren t getting job done berea that pressure is going be enormous once massage boy is playing football again problem is andrew berry will be rebuilding team that he built,"{'neg': 0.141, 'neu': 0.807, 'pos': 0.052, 'compound': -0.4767}",False,-0.4767
155,1584655992519675905,2022-10-24 21:20:04+00:00,emu_cards,"@NFLGrandheer Sounds like a great idea! It’s not like it will keep the #Browns out of the #SuperBowl they haven’t been to one yet. 
I have yelled at the Browns for their calls for years, not that I could do better, but felt like I couldn’t do worse.","['Browns', 'SuperBowl']",0,0,"[User(username='NFLGrandheer', id=1479215862964006913, displayname='Kevin Grandheer', description=None, rawDescription=None, descriptionUrls=None, verified=None, created=None, followersCount=None, friendsCount=None, statusesCount=None, favouritesCount=None, listedCount=None, mediaCount=None, location=None, protected=None, linkUrl=None, linkTcourl=None, profileImageUrl=None, profileBannerUrl=None, label=None)]",,sounds like great idea it s not like it will keep out they haven t been one yet i have yelled at browns their calls years not that i could do better but felt like i couldn t do worse,"{'neg': 0.096, 'neu': 0.645, 'pos': 0.259, 'compound': 0.6249}",True,0.6249
156,1584655037175058432,2022-10-24 21:16:16+00:00,typestruth,"The most #Browns thing ever tweeted 😂😂😂

Mike Tomlin took a Championship caliber team and turned it into a complete “shitshack” 

Cleveland is already a shithole team,, so of course their fans want more 
0-16 seasons 😂 #Steelers https://t.co/yiTNiYWscK","['Browns', 'Steelers']",0,0,,,most thing ever tweeted mike tomlin took championship caliber team turned it into complete shitshack cleveland is already shithole team so course their fans want more 0 16 seasons,"{'neg': 0.0, 'neu': 0.861, 'pos': 0.139, 'compound': 0.4939}",True,0.4939
157,1584654983831916544,2022-10-24 21:16:04+00:00,cripplercrssfce,"If the #Steelers let go of Mike Tomlin at the end of the season , I’m firing Stefanski ASAP #Browns","['Steelers', 'Browns']",439,20,,,if let go mike tomlin at end season i m firing stefanski asap,"{'neg': 0.194, 'neu': 0.806, 'pos': 0.0, 'compound': -0.34}",False,-0.34
158,1584654923228008448,2022-10-24 21:15:49+00:00,ESPNCleveland,"A Monday edition of ECT with @MattFontana83, @RealDCunningham &amp; @NickPaulus is off and running on 850 @ESPNCleveland &amp; the ESPN App! 

STREAM: https://t.co/fB76CEdMw0 

Question of the Night: Is the #Browns season over in your mind?",['Browns'],2,0,"[User(username='MattFontana83', id=201009917, displayname='Matt Fontana', description=None, rawDescription=None, descriptionUrls=None, verified=None, created=None, followersCount=None, friendsCount=None, statusesCount=None, favouritesCount=None, listedCount=None, mediaCount=None, location=None, protected=None, linkUrl=None, linkTcourl=None, profileImageUrl=None, profileBannerUrl=None, label=None), User(username='RealDCunningham', id=2581493186, displayname='Danny Cunningham', description=None, rawDescription=None, descriptionUrls=None, verified=None, created=None, followersCount=None, friendsCount=None, statusesCount=None, favouritesCount=None, listedCount=None, mediaCount=None, location=None, protected=None, linkUrl=None, linkTcourl=None, profileImageUrl=None, profileBannerUrl=None, label=None), User(username='NickPaulus', id=627603538, displayname='Nick Paulus', description=None, rawDescription=None, descriptionUrls=None, verified=None, created=None, followersCount=None, friendsCount=None, statusesCount=None, favouritesCount=None, listedCount=None, mediaCount=None, location=None, protected=None, linkUrl=None, linkTcourl=None, profileImageUrl=None, profileBannerUrl=None, label=None), User(username='ESPNCleveland', id=43144932, displayname='ESPN Cleveland', description=None, rawDescription=None, descriptionUrls=None, verified=None, created=None, followersCount=None, friendsCount=None, statusesCount=None, favouritesCount=None, listedCount=None, mediaCount=None, location=None, protected=None, linkUrl=None, linkTcourl=None, profileImageUrl=None, profileBannerUrl=None, label=None)]",,monday edition ect with amp is off running 850 amp espn app stream question night is season over your mind,"{'neg': 0.0, 'neu': 1.0, 'pos': 0.0, 'compound': 0.0}",False,0.0
159,1584654491172970496,2022-10-24 21:14:06+00:00,dancollins1031,@josh_paul12 The offense will have plenty of leadership when 4 gets back - it’s the defense that has major $$$ on good but not great game changing players (Ward and Myles) #browns,['browns'],0,0,"[User(username='josh_paul12', id=366928812, displayname='Josh Schneider', description=None, rawDescription=None, descriptionUrls=None, verified=None, created=None, followersCount=None, friendsCount=None, statusesCount=None, favouritesCount=None, listedCount=None, mediaCount=None, location=None, protected=None, linkUrl=None, linkTcourl=None, profileImageUrl=None, profileBannerUrl=None, label=None)]",,offense will have plenty leadership when 4 gets back it s defense that has major good but not great game changing players ward myles,"{'neg': 0.219, 'neu': 0.663, 'pos': 0.118, 'compound': -0.5777}",False,-0.5777
160,1584654452556169216,2022-10-24 21:13:57+00:00,ChatSports,"On today's edition of NFL Daily:

@WillScott44 breaks down 5 trade destinations for RB Kareem Hunt!

Will the #Browns trade their star RB? If so, what team would be the best fit?

Subscribe for nonstop coverage leading up to the deadline!

WATCH NOW: https://t.co/9vwb2rNbFa https://t.co/sMKhsfXkTh",['Browns'],4,1,"[User(username='WillScott44', id=523672566, displayname='Will Scott', description=None, rawDescription=None, descriptionUrls=None, verified=None, created=None, followersCount=None, friendsCount=None, statusesCount=None, favouritesCount=None, listedCount=None, mediaCount=None, location=None, protected=None, linkUrl=None, linkTcourl=None, profileImageUrl=None, profileBannerUrl=None, label=None)]",,todays edition nfl daily breaks down 5 trade destinations rb kareem hunt will trade their star rb if so what team would be best fit subscribe nonstop coverage leading up deadline watch now,"{'neg': 0.0, 'neu': 0.817, 'pos': 0.183, 'compound': 0.7717}",True,0.7717
161,1584654325523304448,2022-10-24 21:13:27+00:00,CJMabry1,"Man, fuck the Cleveland Browns, I’ll be rooting for Buffalo this year #Browns",['Browns'],1,0,,,man fuck cleveland browns i ll be rooting buffalo this year,"{'neg': 0.28, 'neu': 0.72, 'pos': 0.0, 'compound': -0.5423}",False,-0.5423
162,1584654315032965120,2022-10-24 21:13:24+00:00,etalkinghead,"Stefanski bros out in full force today. He’s done so little with this roster it’s inexcusable. And let’s skip the “backup qb” argument because there’s coaches out there right now doing far more with far less than what Stefanski has.

#Browns",['Browns'],1,0,,,stefanski bros out full force today he s done so little with this roster it s inexcusable let s skip backup qb argument because there s coaches out there right now doing far more with far less than what stefanski has,"{'neg': 0.065, 'neu': 0.935, 'pos': 0.0, 'compound': -0.3612}",False,-0.3612
163,1584654292908056576,2022-10-24 21:13:19+00:00,Playlikeajet1,"Kareem Hunt is perfect for #Jets offense &amp; IMHO the best option for keeping it afloat the rest of the season. Unless the price is unreasonable, JD should get aggressive &amp; find a way to make a deal with #Browns. https://t.co/pl0n63anbU","['Jets', 'Browns']",43,3,,,kareem hunt is perfect offense amp imho best option keeping it afloat rest season unless price is unreasonable jd should get aggressive amp find way make deal with,"{'neg': 0.101, 'neu': 0.676, 'pos': 0.223, 'compound': 0.743}",True,0.743
164,1584654194405167104,2022-10-24 21:12:56+00:00,althea_4017,I didn't know this but it's pretty telling considering the #Browns have been within striking distance in every game but one. And yet he still leads the league in rushing. This squarely sits on the shoulders of the coaching staff. https://t.co/3tXoe9MO0N,['Browns'],1,0,,,i didnt know this but its pretty telling considering have been within striking distance every game but one yet he still leads league rushing this squarely sits shoulders coaching staff,"{'neg': 0.0, 'neu': 0.867, 'pos': 0.133, 'compound': 0.6486}",True,0.6486
165,1584654069830127617,2022-10-24 21:12:26+00:00,artg213,It’s funny watching how the #Browns ruin people’s lives. Just saw a tweet over we took the wrong OT in a draft. Get a life people.,['Browns'],2,0,,,it s funny watching how ruin people s lives just saw tweet over we took wrong ot draft get life people,"{'neg': 0.267, 'neu': 0.62, 'pos': 0.112, 'compound': -0.6124}",False,-0.6124
166,1584653961105137665,2022-10-24 21:12:00+00:00,BrownsChat,Monday Rewind with Michael Keefe! #BrownsPodcast #BrownsOpinion #BrownsFans #Browns#BrownsFan #Believeland #TheLand https://t.co/vdDLXsUw9Q,"['BrownsPodcast', 'BrownsOpinion', 'BrownsFans', 'Believeland', 'TheLand']",0,0,,,monday rewind with michael keefe,"{'neg': 0.0, 'neu': 1.0, 'pos': 0.0, 'compound': 0.0}",False,0.0
167,1584653959074959360,2022-10-24 21:11:59+00:00,KWright_17,"You can take us out of OH, but you can’t take the OH out of us! 😀Sports Day @BrentwoodMESE #browns #OH https://t.co/bIp1gFs4vW","['browns', 'OH']",11,1,"[User(username='BrentwoodMESE', id=1855075141, displayname='Brentwood Elementary', description=None, rawDescription=None, descriptionUrls=None, verified=None, created=None, followersCount=None, friendsCount=None, statusesCount=None, favouritesCount=None, listedCount=None, mediaCount=None, location=None, protected=None, linkUrl=None, linkTcourl=None, profileImageUrl=None, profileBannerUrl=None, label=None)]",,you can take us out oh but you can t take oh out us sports day,"{'neg': 0.0, 'neu': 1.0, 'pos': 0.0, 'compound': 0.0}",False,0.0
168,1584653947054493698,2022-10-24 21:11:57+00:00,MaryKayCabot,Confirming that #Browns LB Jacob Phillips' previously-reported likely season-ending pec injury is indeed a tear that will likely need to be repaired.,['Browns'],78,8,,,confirming that lb jacob phillips previously reported likely season ending pec injury is indeed tear that will likely need be repaired,"{'neg': 0.123, 'neu': 0.877, 'pos': 0.0, 'compound': -0.4215}",False,-0.4215
