,ID,Date,User,Tweet,HashTags,Likes,Retweets,MentionUsers,LocationCoordinates,clean_Tweet,Sentiment_Analysis,Positive_Sentiment,Compound_Sentiment Score
269,1584522628156751873,2022-10-24 12:30:08+00:00,B_Yamz,"Dear @Jaguars, Do we not have a coach in charge of reviewing and challenging close plays? How did we now lose two football games by simply NOT THROWING A RED HANKY ONTO THE FIELD?!? This is not okay. Sincerely, Every #Jaguars Fan in existence. #FixTheShit https://t.co/EsNbUpNTnz","['Jaguars', 'FixTheShit']",1,0,"[User(username='Jaguars', id=59471027, displayname='Jacksonville Jaguars', description=None, rawDescription=None, descriptionUrls=None, verified=None, created=None, followersCount=None, friendsCount=None, statusesCount=None, favouritesCount=None, listedCount=None, mediaCount=None, location=None, protected=None, linkUrl=None, linkTcourl=None, profileImageUrl=None, profileBannerUrl=None, label=None)]",,dear do we not have coach charge reviewing challenging close plays how did we now lose two football games by simply not throwing red hanky onto field this is not okay sincerely every fan existence,"{'neg': 0.159, 'neu': 0.645, 'pos': 0.196, 'compound': 0.1481}",True,0.1481
270,1584522546644652032,2022-10-24 12:29:48+00:00,GeneFrenette,My #Jaguars report card vs. G-Men is a dishonor roll: https://t.co/V7lrERKJo0,['Jaguars'],0,0,,,my report card vs g men is dishonor roll,"{'neg': 0.0, 'neu': 1.0, 'pos': 0.0, 'compound': 0.0}",False,0.0
271,1584521365146988544,2022-10-24 12:25:07+00:00,beeyamz,How is everybody so off the mark … how is everybody not going absolutely INSANE about the fact the #Jaguars got a 1st down two plays in row &amp;our coach failed to challenge. exact same way we lost vs #Texans. Clearly the Jags have a Challenge Guy problem. That’s the story. https://t.co/JI6g0VNYRM,"['Jaguars', 'Texans']",1,1,,,how is everybody so off mark how is everybody not going absolutely insane about fact got 1st down two plays row amp our coach failed challenge exact same way we lost vs clearly jags have challenge guy problem that s story,"{'neg': 0.166, 'neu': 0.639, 'pos': 0.195, 'compound': -0.1344}",False,-0.1344
272,1584517481498316800,2022-10-24 12:09:41+00:00,GeneFrenette,"Early lines: #Jaguars 4-point favorite over Broncos in London, @GeorgiaFootball whopping 21.5-point pick over @GatorsFB",['Jaguars'],3,1,"[User(username='GeorgiaFootball', id=321586997, displayname='Georgia Football', description=None, rawDescription=None, descriptionUrls=None, verified=None, created=None, followersCount=None, friendsCount=None, statusesCount=None, favouritesCount=None, listedCount=None, mediaCount=None, location=None, protected=None, linkUrl=None, linkTcourl=None, profileImageUrl=None, profileBannerUrl=None, label=None), User(username='GatorsFB', id=39533864, displayname='Florida Gators Football', description=None, rawDescription=None, descriptionUrls=None, verified=None, created=None, followersCount=None, friendsCount=None, statusesCount=None, favouritesCount=None, listedCount=None, mediaCount=None, location=None, protected=None, linkUrl=None, linkTcourl=None, profileImageUrl=None, profileBannerUrl=None, label=None)]",,early lines 4 point favorite over broncos london whopping 21 5 point pick over,"{'neg': 0.0, 'neu': 0.786, 'pos': 0.214, 'compound': 0.4588}",True,0.4588
273,1584516961131954177,2022-10-24 12:07:37+00:00,TheFFFanatics3,"#Jaguars RB Snap Count

Travis Etienne- 80%
James Robinson- 17%",['Jaguars'],3,0,,,rb snap count travis etienne 80 james robinson 17,"{'neg': 0.0, 'neu': 1.0, 'pos': 0.0, 'compound': 0.0}",False,0.0
274,1584516052582420480,2022-10-24 12:04:00+00:00,GeneFrenette,"Pederson 4th down decision with only half-yard to go is easy to question in Hindsight, but u honestly have to ask this: since FG would have kept it 1-score game, how many NFL coaches would have kicked in that situation? Probably less than half. #Jaguars",['Jaguars'],4,0,,,pederson 4th down decision with only half yard go is easy question hindsight but u honestly have ask this since fg would have kept it 1 score game how many nfl coaches would have kicked that situation probably less than half,"{'neg': 0.0, 'neu': 0.861, 'pos': 0.139, 'compound': 0.714}",True,0.714
275,1584514832518197248,2022-10-24 11:59:09+00:00,THanswillemenke,The #broncos are trying to fill hole after hole with new injuries every week. Will be interesting to see them play the #Jaguars live in London this Sunday! https://t.co/k0kuxdKGOM,"['broncos', 'Jaguars']",3,0,,,are trying fill hole after hole with new injuries every week will be interesting see them play live london this sunday,"{'neg': 0.0, 'neu': 0.788, 'pos': 0.212, 'compound': 0.6249}",True,0.6249
276,1584514826826526720,2022-10-24 11:59:08+00:00,cdbfootball,#broncoscountry and the #jaguars will play in Wembley on Sunday and the game will be on ESPN+…. This is anti American. Against the constitution and there’s probably something against this in the Bible as-well. Outrageous decision on the #NFL part #NFLTwitter,"['broncoscountry', 'jaguars', 'NFL', 'NFLTwitter']",1,0,,,will play wembley sunday game will be espn this is anti american against constitution there s probably something against this bible as well outrageous decision part,"{'neg': 0.172, 'neu': 0.682, 'pos': 0.146, 'compound': -0.2023}",False,-0.2023
277,1584514294187978755,2022-10-24 11:57:01+00:00,JaguarsViews,Giants’ Brian Daboll not satisfied with win: ‘Tougher than it needed to be’ #JacksonvilleJaguars #Jaguars #Jags #GoJags #JagsFans https://t.co/7GVRN0gU34,"['JacksonvilleJaguars', 'Jaguars', 'Jags', 'GoJags', 'JagsFans']",1,0,,,giants brian daboll not satisfied with win tougher than it needed be,"{'neg': 0.336, 'neu': 0.559, 'pos': 0.106, 'compound': -0.5725}",False,-0.5725
278,1584513516362379274,2022-10-24 11:53:55+00:00,Demetrius82,"#Jaguars RB James Robinson played just 12 snaps yesterday against the Giants.

That marked the third-lowest snap total in his career. The other two lows were 11 snaps against NYJ (Achilles injury) and 8 snaps against Seahawks (heel). Both last season.",['Jaguars'],54,6,,,rb james robinson played just 12 snaps yesterday against giants that marked third lowest snap total his career other two lows were 11 snaps against nyj achilles injury 8 snaps against seahawks heel both last season,"{'neg': 0.177, 'neu': 0.764, 'pos': 0.059, 'compound': -0.5859}",False,-0.5859
279,1584510165772300288,2022-10-24 11:40:36+00:00,James_Byrd904,This is the best 2-5 team I have ever seen. #Jaguars,['Jaguars'],0,0,,,this is best 2 5 team i have ever seen,"{'neg': 0.0, 'neu': 0.588, 'pos': 0.412, 'compound': 0.6369}",True,0.6369
280,1584501370605907968,2022-10-24 11:05:40+00:00,MattArrington36,@MJD 1 of my all time favorite NFL running backs ever. 💯💯 #MJD  #Raiders #Jaguars #UCLA #DeLaSalle https://t.co/fmBL7tSAvA,"['MJD', 'Raiders', 'Jaguars', 'UCLA', 'DeLaSalle']",1,0,"[User(username='MJD', id=45605747, displayname='Maurice Jones-Drew', description=None, rawDescription=None, descriptionUrls=None, verified=None, created=None, followersCount=None, friendsCount=None, statusesCount=None, favouritesCount=None, listedCount=None, mediaCount=None, location=None, protected=None, linkUrl=None, linkTcourl=None, profileImageUrl=None, profileBannerUrl=None, label=None)]",,1 my all time favorite nfl running backs ever,"{'neg': 0.118, 'neu': 0.588, 'pos': 0.294, 'compound': 0.4215}",True,0.4215
281,1584499672370253824,2022-10-24 10:58:55+00:00,LauraLH216,"Patrick Mahomes is gonna run all over us, it’s gonna be ugly #Jaguars 🤢#DUUUVAL","['Jaguars', 'DUUUVAL']",0,0,,,patrick mahomes is gonna run all over us it s gonna be ugly,"{'neg': 0.231, 'neu': 0.769, 'pos': 0.0, 'compound': -0.5106}",False,-0.5106
282,1584497681392873473,2022-10-24 10:51:00+00:00,JaguarsViews,"Giants stop Jaguars at 1-yard line for 23-17 win, get to 6-1 #JacksonvilleJaguars #Jaguars #Jags #GoJags #JagsFans https://t.co/MGaNUvqrKb","['JacksonvilleJaguars', 'Jaguars', 'Jags', 'GoJags', 'JagsFans']",1,0,,,giants stop jaguars at 1 yard line 23 17 win get 6 1,"{'neg': 0.157, 'neu': 0.571, 'pos': 0.271, 'compound': 0.3818}",True,0.3818
283,1584487393125888000,2022-10-24 10:10:07+00:00,VrginX,"2 #NFL games streaming this week...

Week 8: #TNFonPrime: #Ravens/#Buccaneers 
Baltimore: WMAR 2
Tampa: WTVT 13
Also: Prime Video, Twitch, NFL+

#Broncos/#Jaguars in London
Denver: KMGH 7
Jacksonville: WJXT 4
Also: ESPN+, NFL+

#RavensFlock #GoBucs #TNF #BroncosCountry #DUUUVAL https://t.co/sbS5EWXxFf","['NFL', 'TNFonPrime', 'Ravens', 'Buccaneers', 'Broncos', 'Jaguars', 'RavensFlock', 'GoBucs', 'TNF', 'BroncosCountry', 'DUUUVAL']",1,0,,,2 games streaming this week week 8 baltimore wmar 2 tampa wtvt 13 also prime video twitch nfl london denver kmgh 7 jacksonville wjxt 4 also espn nfl,"{'neg': 0.0, 'neu': 1.0, 'pos': 0.0, 'compound': 0.0}",False,0.0
284,1584483844983750656,2022-10-24 09:56:01+00:00,JaguarsViews,"Giants-Jaguars Week 7: Offense, defense and special teams snap counts #JacksonvilleJaguars #Jaguars #Jags #GoJags #JagsFans https://t.co/b8CW6qQ0va","['JacksonvilleJaguars', 'Jaguars', 'Jags', 'GoJags', 'JagsFans']",0,0,,,giants jaguars week 7 offense defense special teams snap counts,"{'neg': 0.164, 'neu': 0.492, 'pos': 0.344, 'compound': 0.296}",True,0.296
285,1584482474519719936,2022-10-24 09:50:34+00:00,99BenBray1,Absolutely buzzing for Sunday! One of my favourite days of the year is seeing my team play in London! Despite our recent losses think we will have too much for the Broncos this weekend! LET’S GOOOOOO! #DUUUVAL #Jaguars #DENvsJAX #NFLUK https://t.co/dUxVwQ8CRZ,"['DUUUVAL', 'Jaguars', 'DENvsJAX', 'NFLUK']",1,0,,,absolutely buzzing sunday one my favourite days year is seeing my team play london despite our recent losses think we will have too much broncos this weekend let s goooooo,"{'neg': 0.0, 'neu': 0.853, 'pos': 0.147, 'compound': 0.5659}",True,0.5659
286,1584481080962215942,2022-10-24 09:45:02+00:00,JaguarsViews,Jaguars drop to 2-5 with a wrenching home loss to Giants #JacksonvilleJaguars #Jaguars #Jags #GoJags #JagsFans https://t.co/8fD6vZ2usJ,"['JacksonvilleJaguars', 'Jaguars', 'Jags', 'GoJags', 'JagsFans']",0,1,,,jaguars drop 2 5 with wrenching home loss giants,"{'neg': 0.468, 'neu': 0.532, 'pos': 0.0, 'compound': -0.5267}",False,-0.5267
287,1584480327267135488,2022-10-24 09:42:02+00:00,raw_chili,"""Sad #Jacksonville #Jaguars mascot"" courtesy of DALL-E. Pain. 
 
https://t.co/rCTw08OH8V
 
#AmericanFootballConference #AmericanFootballConferenceSouthDivision #Florida #Football #JacksonvilleJaguars #NationalFootballLeague #NFL https://t.co/awbEpnyHVO","['Jacksonville', 'Jaguars', 'AmericanFootballConference', 'AmericanFootballConferenceSouthDivision', 'Florida', 'Football', 'JacksonvilleJaguars', 'NationalFootballLeague', 'NFL']",0,0,,,sad mascot courtesy dall e pain,"{'neg': 0.587, 'neu': 0.183, 'pos': 0.229, 'compound': -0.5994}",False,-0.5994
288,1584472767646564352,2022-10-24 09:12:00+00:00,JaguarsViews,Jaguars Up-Down Drill: More downs than ups as New York Giants stave off Jacksonville #JacksonvilleJaguars #Jaguars #Jags #GoJags #JagsFans https://t.co/1XsIQ3TDRd,"['JacksonvilleJaguars', 'Jaguars', 'Jags', 'GoJags', 'JagsFans']",0,0,,,jaguars up down drill more downs than ups as new york giants stave off jacksonville,"{'neg': 0.0, 'neu': 1.0, 'pos': 0.0, 'compound': 0.0}",False,0.0
289,1584470075351842822,2022-10-24 09:01:18+00:00,JaguarsViews,Daniel Jones after win over Jacksonville: 'We've got confidence that we're going to find ways to win' | Giants Post Game #JacksonvilleJaguars #Jaguars #Jags #GoJags #JagsFans https://t.co/GvwE4Wj1Ad,"['JacksonvilleJaguars', 'Jaguars', 'Jags', 'GoJags', 'JagsFans']",0,0,,,daniel jones after win over jacksonville weve got confidence that were going find ways win giants post game,"{'neg': 0.0, 'neu': 0.579, 'pos': 0.421, 'compound': 0.8979}",True,0.8979
290,1584467236730773505,2022-10-24 08:50:01+00:00,JaguarsViews,Hernández: Healthy dose of reality for injury-ravaged Chargers — They're mediocre #JacksonvilleJaguars #Jaguars #Jags #GoJags #JagsFans https://t.co/txvxZk8oKY,"['JacksonvilleJaguars', 'Jaguars', 'Jags', 'GoJags', 'JagsFans']",1,0,,,hern ndez healthy dose reality injury ravaged chargers theyre mediocre,"{'neg': 0.207, 'neu': 0.593, 'pos': 0.2, 'compound': -0.0258}",False,-0.0258
291,1584464463041740800,2022-10-24 08:39:00+00:00,JaguarsViews,Xavier McKinney details the last play of the game in Giants' win over Jaguars | Giants Post Game #JacksonvilleJaguars #Jaguars #Jags #GoJags #JagsFans https://t.co/8PWP611dJh,"['JacksonvilleJaguars', 'Jaguars', 'Jags', 'GoJags', 'JagsFans']",1,0,,,xavier mckinney details last play game giants win over jaguars giants post game,"{'neg': 0.0, 'neu': 0.64, 'pos': 0.36, 'compound': 0.7351}",True,0.7351
292,1584461697653575680,2022-10-24 08:28:01+00:00,JaguarsViews,"NFL Week 7: Bengals, Joe Burrow get their groove back; more Sunday lessons #JacksonvilleJaguars #Jaguars #Jags #GoJags https://t.co/r8yFinXZap","['JacksonvilleJaguars', 'Jaguars', 'Jags', 'GoJags']",1,0,,,nfl week 7 bengals joe burrow get their groove back more sunday lessons,"{'neg': 0.0, 'neu': 1.0, 'pos': 0.0, 'compound': 0.0}",False,0.0
293,1584458927517097985,2022-10-24 08:17:00+00:00,JaguarsViews,NFL Week 7 Takeaways: Josh Jacobs Can Revive Raiders' Playoff Hopes #JacksonvilleJaguars #Jaguars #Jags #GoJags #JagsFans https://t.co/rrAbIIZ51j,"['JacksonvilleJaguars', 'Jaguars', 'Jags', 'GoJags', 'JagsFans']",0,0,,,nfl week 7 takeaways josh jacobs can revive raiders playoff hopes,"{'neg': 0.0, 'neu': 0.606, 'pos': 0.394, 'compound': 0.6369}",True,0.6369
294,1584456158630117376,2022-10-24 08:06:00+00:00,JaguarsViews,Gene Frenette: Same old story — Jaguars failing to come through in clutch moments #JacksonvilleJaguars #Jaguars #Jags #GoJags #JagsFans https://t.co/kSn6QvHApb,"['JacksonvilleJaguars', 'Jaguars', 'Jags', 'GoJags', 'JagsFans']",0,0,,,gene frenette same old story jaguars failing come through clutch moments,"{'neg': 0.248, 'neu': 0.752, 'pos': 0.0, 'compound': -0.5106}",False,-0.5106
295,1584453395162677249,2022-10-24 07:55:01+00:00,JaguarsViews,Jaguars' blunders fuel Giants' winning attitude #JacksonvilleJaguars #Jaguars #Jags #GoJags #JagsFans https://t.co/awkQsdyALJ,"['JacksonvilleJaguars', 'Jaguars', 'Jags', 'GoJags', 'JagsFans']",0,0,,,jaguars blunders fuel giants winning attitude,"{'neg': 0.0, 'neu': 0.595, 'pos': 0.405, 'compound': 0.5267}",True,0.5267
296,1584450621532688385,2022-10-24 07:44:00+00:00,JaguarsViews,NFL Insider says Giants 'were not satisfied' with how they beat the Jaguars | Connor Hughes #JacksonvilleJaguars #Jaguars #Jags #GoJags #JagsFans https://t.co/XJl675sbCY,"['JacksonvilleJaguars', 'Jaguars', 'Jags', 'GoJags', 'JagsFans']",0,0,,,nfl insider says giants were not satisfied with how they beat jaguars connor hughes,"{'neg': 0.152, 'neu': 0.848, 'pos': 0.0, 'compound': -0.3252}",False,-0.3252
297,1584436851515224064,2022-10-24 06:49:17+00:00,JaguarsViews,NFL Week 7 Takeaways: Josh Jacobs Can Revive Raiders' Playoff Hopes #JacksonvilleJaguars #Jaguars #Jags #GoJags #JagsFans https://t.co/SIS5hBcqNT,"['JacksonvilleJaguars', 'Jaguars', 'Jags', 'GoJags', 'JagsFans']",0,0,,,nfl week 7 takeaways josh jacobs can revive raiders playoff hopes,"{'neg': 0.0, 'neu': 0.606, 'pos': 0.394, 'compound': 0.6369}",True,0.6369
298,1584434016844845056,2022-10-24 06:38:01+00:00,JaguarsViews,Gene Frenette: Same old story -- Jaguars failing to come through in clutch moments #JacksonvilleJaguars #Jaguars #Jags #GoJags #JagsFans https://t.co/rmGRSi7bTF,"['JacksonvilleJaguars', 'Jaguars', 'Jags', 'GoJags', 'JagsFans']",0,0,,,gene frenette same old story jaguars failing come through clutch moments,"{'neg': 0.248, 'neu': 0.752, 'pos': 0.0, 'compound': -0.5106}",False,-0.5106
299,1584431248876847104,2022-10-24 06:27:01+00:00,JaguarsViews,Game-sealing stop exemplifies Giants' winning identity #JacksonvilleJaguars #Jaguars #Jags #GoJags #JagsFans https://t.co/l4Dsg7zcFA,"['JacksonvilleJaguars', 'Jaguars', 'Jags', 'GoJags', 'JagsFans']",0,0,,,game sealing stop exemplifies giants winning identity,"{'neg': 0.208, 'neu': 0.472, 'pos': 0.321, 'compound': 0.296}",True,0.296
300,1584428480099295232,2022-10-24 06:16:01+00:00,JaguarsViews,Inside the Jaguars' Failed Late Game Decision-Making vs. the Giants #JacksonvilleJaguars #Jaguars #Jags #GoJags #JagsFans https://t.co/lRL8lUnMau,"['JacksonvilleJaguars', 'Jaguars', 'Jags', 'GoJags', 'JagsFans']",0,0,,,inside jaguars failed late game decision making vs giants,"{'neg': 0.292, 'neu': 0.708, 'pos': 0.0, 'compound': -0.5106}",False,-0.5106
301,1584425708058595328,2022-10-24 06:05:00+00:00,JaguarsViews,Giants' defense makes sure longest yard is one Jacksonville could not get on game's final play #JacksonvilleJaguars #Jaguars #Jags #GoJags #JagsFans https://t.co/8kalZCMblL,"['JacksonvilleJaguars', 'Jaguars', 'Jags', 'GoJags', 'JagsFans']",0,0,,,giants defense makes sure longest yard is one jacksonville could not get games final play,"{'neg': 0.0, 'neu': 0.659, 'pos': 0.341, 'compound': 0.6369}",True,0.6369
302,1584422939197202432,2022-10-24 05:54:00+00:00,JaguarsViews,The NY Giants keep thriving by living on the edge and rallying to win | Analysis #JacksonvilleJaguars #Jaguars #Jags #GoJags #JagsFans https://t.co/e7sI0Kek6Y,"['JacksonvilleJaguars', 'Jaguars', 'Jags', 'GoJags', 'JagsFans']",0,0,,,ny giants keep thriving by living edge rallying win analysis,"{'neg': 0.0, 'neu': 0.703, 'pos': 0.297, 'compound': 0.5859}",True,0.5859
303,1584420170428096512,2022-10-24 05:43:00+00:00,JaguarsViews,"AFC Notes: Colts, Jaguars, Patriots #JacksonvilleJaguars #Jaguars #Jags #GoJags https://t.co/KqgqVz4xJq","['JacksonvilleJaguars', 'Jaguars', 'Jags', 'GoJags']",0,0,,,afc notes colts jaguars patriots,"{'neg': 0.0, 'neu': 1.0, 'pos': 0.0, 'compound': 0.0}",False,0.0
304,1584417399390208000,2022-10-24 05:31:59+00:00,GeneFrenette,#Jaguars Up-Down drill features a lot more downs than ups from 23-17 loss to the New York Giants: https://t.co/lRlvLbUu87,['Jaguars'],0,0,,,up down drill features lot more downs than ups 23 17 loss new york giants,"{'neg': 0.141, 'neu': 0.859, 'pos': 0.0, 'compound': -0.3182}",False,-0.3182
305,1584403561068494848,2022-10-24 04:37:00+00:00,JaguarsViews,2 Doug Pederson decisions after a questionable spot cost the Jaguars #JacksonvilleJaguars #Jaguars #Jags #GoJags #JagsFan https://t.co/JzVp4TSpOb,"['JacksonvilleJaguars', 'Jaguars', 'Jags', 'GoJags', 'JagsFan']",0,0,,,2 doug pederson decisions after questionable spot cost jaguars,"{'neg': 0.239, 'neu': 0.761, 'pos': 0.0, 'compound': -0.296}",False,-0.296
306,1584400793717084160,2022-10-24 04:26:00+00:00,JaguarsViews,'There's just a competitive spirit': What the Giants have but the Jaguars can't seem to find #JacksonvilleJaguars #Jaguars #Jags #GoJags #JagsFans https://t.co/BzXb27fjyj,"['JacksonvilleJaguars', 'Jaguars', 'Jags', 'GoJags', 'JagsFans']",0,0,,,theres just competitive spirit what giants have but jaguars cant seem find,"{'neg': 0.0, 'neu': 0.787, 'pos': 0.213, 'compound': 0.1779}",True,0.1779
307,1584399127026491394,2022-10-24 04:19:23+00:00,TheMaxDean,"How many AFC South Teams will make the playoffs?
#Titans #Colts #Jaguars #Texans
#ForTheShoe #DUUUVAL #WeAreTexans","['Titans', 'Colts', 'Jaguars', 'Texans', 'ForTheShoe', 'DUUUVAL', 'WeAreTexans']",3,2,,,how many afc south teams will make playoffs,"{'neg': 0.0, 'neu': 1.0, 'pos': 0.0, 'compound': 0.0}",False,0.0
308,1584398048230543360,2022-10-24 04:15:06+00:00,JaguarsViews,NFC East Week 7 Wrap-up: Perfect #JacksonvilleJaguars #Jaguars #Jags #GoJags #JagsFans https://t.co/yZD5LTb2BR,"['JacksonvilleJaguars', 'Jaguars', 'Jags', 'GoJags', 'JagsFans']",0,0,,,nfc east week 7 wrap up perfect,"{'neg': 0.325, 'neu': 0.351, 'pos': 0.325, 'compound': 0.0}",False,0.0
309,1584395261316452352,2022-10-24 04:04:01+00:00,JaguarsViews,"Giants' Jones snaps at WR, 'disappointed' in self #JacksonvilleJaguars #Jaguars #Jags #GoJags #JagsFans https://t.co/XbpNkkGe1a","['JacksonvilleJaguars', 'Jaguars', 'Jags', 'GoJags', 'JagsFans']",0,0,,,giants jones snaps at wr disappointed self,"{'neg': 0.341, 'neu': 0.659, 'pos': 0.0, 'compound': -0.4767}",False,-0.4767
310,1584392491058360320,2022-10-24 03:53:01+00:00,JaguarsViews,Doug Pederson Explains James Robinson's Non-Involvement vs. Giants #JacksonvilleJaguars #Jaguars #Jags #GoJags #JagsFans https://t.co/5MFKBHQvXL,"['JacksonvilleJaguars', 'Jaguars', 'Jags', 'GoJags', 'JagsFans']",0,0,,,doug pederson explains james robinsons non involvement vs giants,"{'neg': 0.0, 'neu': 1.0, 'pos': 0.0, 'compound': 0.0}",False,0.0
311,1584390556364419079,2022-10-24 03:45:19+00:00,_John_Shipley,"#Jaguars head coach Doug Pederson didn't have an overwhelmingly convincing answer after the game for why James Robinson didn't get a touch. Clear it is ETN's backfield, but it still felt bizarre:

 https://t.co/SxxvPcjaAA",['Jaguars'],16,2,,,head coach doug pederson didnt have overwhelmingly convincing answer after game why james robinson didnt get touch clear it is etns backfield but it still felt bizarre,"{'neg': 0.203, 'neu': 0.758, 'pos': 0.039, 'compound': -0.6106}",False,-0.6106
312,1584390518901198849,2022-10-24 03:45:10+00:00,N_Toshi53,"あと1ヤード足りなかった…。
そして3勝の壁は高い…。
がんばれジャガーズ！

I was one yard short...
 And the wall of 3 wins is high...
 Go for it, Jaguars!
#DUUUVAL #jaguars #jax https://t.co/Hnj90zwsK2","['DUUUVAL', 'jaguars', 'jax']",1,0,,,1 3 i was one yard short wall 3 wins is high go it jaguars,"{'neg': 0.0, 'neu': 0.73, 'pos': 0.27, 'compound': 0.5719}",True,0.5719
313,1584388491303350272,2022-10-24 03:37:07+00:00,gabriel_mtz_,"#NFL Jornada de locales, solo 4 equipos perdieron #Jaguars #Broncos #chargers y #49ers https://t.co/GvceUMNxcI","['NFL', 'Jaguars', 'Broncos', 'chargers', '49ers']",0,0,,,jornada de locales solo 4 equipos perdieron y,"{'neg': 0.0, 'neu': 1.0, 'pos': 0.0, 'compound': 0.0}",False,0.0
314,1584387678728245248,2022-10-24 03:33:53+00:00,no1es,Just confirmed at the end of the Dolphins game your defense is allowed to make a play to keep you in the game when there is less than 5 minutes to go.  #jaguars,['jaguars'],0,0,,,just confirmed at end dolphins game your defense is allowed make play keep you game when there is less than 5 minutes go,"{'neg': 0.0, 'neu': 0.837, 'pos': 0.163, 'compound': 0.4404}",True,0.4404
315,1584387517888925696,2022-10-24 03:33:15+00:00,LeftyVoyeur,"In your house, #Jaguars https://t.co/F3VlLYdmoF",['Jaguars'],0,0,,,your house,"{'neg': 0.0, 'neu': 1.0, 'pos': 0.0, 'compound': 0.0}",False,0.0
316,1584386954442903554,2022-10-24 03:31:01+00:00,JaguarsViews,"NFL standings 2022: Titans pulling ahead of Colts, Jaguars in AFC South #JacksonvilleJaguars #Jaguars #Jags #GoJags #JagsFan https://t.co/32yHABrd5P","['JacksonvilleJaguars', 'Jaguars', 'Jags', 'GoJags', 'JagsFan']",0,0,,,nfl standings 2022 titans pulling ahead colts jaguars afc south,"{'neg': 0.0, 'neu': 1.0, 'pos': 0.0, 'compound': 0.0}",False,0.0
317,1584384193563271168,2022-10-24 03:20:02+00:00,JaguarsViews,"NFL standings 2022: Titans pulling ahead of Colts, Jaguars in AFC South #JacksonvilleJaguars #Jaguars #Jags #GoJags #JagsFans https://t.co/mFtzJ6TT0g","['JacksonvilleJaguars', 'Jaguars', 'Jags', 'GoJags', 'JagsFans']",0,0,,,nfl standings 2022 titans pulling ahead colts jaguars afc south,"{'neg': 0.0, 'neu': 1.0, 'pos': 0.0, 'compound': 0.0}",False,0.0
318,1584382601602555904,2022-10-24 03:13:43+00:00,LeftyVoyeur,"@ProFootballTalk All this celebration on your asses, @jaguars, smoking cigars and talking about ""Coach of the Year"" because of your own damn mistakes #jaguars",['jaguars'],0,0,"[User(username='ProFootballTalk', id=16672159, displayname='ProFootballTalk', description=None, rawDescription=None, descriptionUrls=None, verified=None, created=None, followersCount=None, friendsCount=None, statusesCount=None, favouritesCount=None, listedCount=None, mediaCount=None, location=None, protected=None, linkUrl=None, linkTcourl=None, profileImageUrl=None, profileBannerUrl=None, label=None), User(username='Jaguars', id=59471027, displayname='Jacksonville Jaguars', description=None, rawDescription=None, descriptionUrls=None, verified=None, created=None, followersCount=None, friendsCount=None, statusesCount=None, favouritesCount=None, listedCount=None, mediaCount=None, location=None, protected=None, linkUrl=None, linkTcourl=None, profileImageUrl=None, profileBannerUrl=None, label=None)]",,all this celebration your asses smoking cigars talking about coach year because your own damn mistakes,"{'neg': 0.271, 'neu': 0.729, 'pos': 0.0, 'compound': -0.6369}",False,-0.6369
319,1584381415726018560,2022-10-24 03:09:00+00:00,JaguarsViews,Jaguars Report Card: All-around incompetence means no honor roll grades against Giants #JacksonvilleJaguars #Jaguars #Jags #GoJags #JagsFans https://t.co/wmonQo05KM,"['JacksonvilleJaguars', 'Jaguars', 'Jags', 'GoJags', 'JagsFans']",1,0,,,jaguars report card all around incompetence means no honor roll grades against giants,"{'neg': 0.294, 'neu': 0.535, 'pos': 0.171, 'compound': -0.3182}",False,-0.3182
320,1584380700366901250,2022-10-24 03:06:09+00:00,_ChrisFedi,I just wanna know how many times the video boards showed the “bad spot” 1st downs in the stadium. Cuz the crowd should’ve been through the roof. #jaguars #DUUUVAL,"['jaguars', 'DUUUVAL']",1,0,,,i just wanna know how many times video boards showed bad spot 1st downs stadium cuz crowd should ve been through roof,"{'neg': 0.149, 'neu': 0.851, 'pos': 0.0, 'compound': -0.5423}",False,-0.5423
321,1584378995839500288,2022-10-24 02:59:23+00:00,GeneFrenette,My #Jaguars report card from 23-17 loss to NY Giants is really a dishonor roll: https://t.co/V7lrERKJo0,['Jaguars'],1,0,,,my report card 23 17 loss ny giants is really dishonor roll,"{'neg': 0.173, 'neu': 0.827, 'pos': 0.0, 'compound': -0.3182}",False,-0.3182
