,ID,Date,User,Tweet,HashTags,Likes,Retweets,MentionUsers,LocationCoordinates,clean_Tweet,Sentiment_Analysis,Positive_Sentiment,Compound_Sentiment Score
186,1584602656810606593,2022-10-24 17:48:08+00:00,JaguarsViews,"D’Onta Foreman, Chuba Hubbard Show Why You Don’t Pay Running Backs #JacksonvilleJaguars #Jaguars #Jags #JagsNews https://t.co/G6UagakJ4z","['JacksonvilleJaguars', 'Jaguars', 'Jags', 'JagsNews']",0,0,,,d onta foreman chuba hubbard show why you don t pay running backs,"{'neg': 0.224, 'neu': 0.776, 'pos': 0.0, 'compound': -0.1531}",False,-0.1531
187,1584601488265195520,2022-10-24 17:43:29+00:00,teal_ordeal,Help ain’t on the way. Defense can be gashed with heavy run sets or Matt Ryan can throw 50 times. This defense SAWFT #Jaguars https://t.co/IATaqKC0U5,['Jaguars'],0,0,,,help ain t way defense can be gashed with heavy run sets or matt ryan can throw 50 times this defense sawft,"{'neg': 0.0, 'neu': 0.759, 'pos': 0.241, 'compound': 0.5719}",True,0.5719
188,1584601242294431744,2022-10-24 17:42:31+00:00,LukePattersonLP,"Will #Broncos HC Nathaniel Hackett be fired if team loses to #Jaguars in London?

“Anything is possible.” Lol 🤣😂

Don’t need to be a team insider or list  PER SOURCE for that one…

#BroncosCountry https://t.co/rSRJ3uLXbr","['Broncos', 'Jaguars', 'BroncosCountry']",3,0,,,will hc nathaniel hackett be fired if team loses london anything is possible lol don t need be team insider or list per source that one,"{'neg': 0.192, 'neu': 0.717, 'pos': 0.091, 'compound': -0.4767}",False,-0.4767
189,1584600259560624128,2022-10-24 17:38:36+00:00,GeneFrenette,#Jaguars CB Tyson Campbell is steadfast in belief team is gonna turn season around. “We got to keep pushing. We know what’s on the other side of the fence.” #Jaguars,"['Jaguars', 'Jaguars']",5,0,,,cb tyson campbell is steadfast belief team is gonna turn season around we got keep pushing we know what s other side fence,"{'neg': 0.0, 'neu': 0.913, 'pos': 0.087, 'compound': 0.25}",True,0.25
190,1584599854956875777,2022-10-24 17:37:00+00:00,JaguarsViews,Jaguars open as favorites in London vs. mirror-image Broncos #JacksonvilleJaguars #Jaguars #Jags #GoJags #JagsFan https://t.co/fZLNGg0MvG,"['JacksonvilleJaguars', 'Jaguars', 'Jags', 'GoJags', 'JagsFan']",0,0,,,jaguars open as favorites london vs mirror image broncos,"{'neg': 0.0, 'neu': 0.741, 'pos': 0.259, 'compound': 0.4215}",True,0.4215
191,1584599407839830022,2022-10-24 17:35:13+00:00,RealMBB,"Excuse me, a what kinda part? #Jaguars https://t.co/4kp1bP7xGf",['Jaguars'],2,0,,,excuse me what kinda part,"{'neg': 0.0, 'neu': 0.755, 'pos': 0.245, 'compound': 0.0772}",True,0.0772
192,1584595820313124864,2022-10-24 17:20:58+00:00,1010XLAG,"“We’ve got to take a look at it. We’ve got to clean it up. It’s about us. We have to look in the mirror.”

Same things Gus said. Same things Marrone said. Same things Urban said.

JUST. WIN. MAN.

#Jaguars",['Jaguars'],14,0,,"Coordinates(longitude=-87.634643, latitude=24.396308)",we ve got take look at it we ve got clean it up it s about us we have look mirror same things gus said same things marrone said same things urban said just win man,"{'neg': 0.0, 'neu': 0.835, 'pos': 0.165, 'compound': 0.7579}",True,0.7579
193,1584594560692654083,2022-10-24 17:15:58+00:00,GeneFrenette,Pederson says short week with travel to London could influence what happens with Shaq Griffin and his back issue. Still TBD. #Jaguars,['Jaguars'],1,0,,,pederson says short week with travel london could influence what happens with shaq griffin his back issue still tbd,"{'neg': 0.0, 'neu': 1.0, 'pos': 0.0, 'compound': 0.0}",False,0.0
194,1584594234950451201,2022-10-24 17:14:40+00:00,GeneFrenette,Pederson says James Robinson “has a lower body issue” and implies that impacted him getting only 12 snaps and one carry that was nullified by penalty. #Jaguars,['Jaguars'],0,0,,,pederson says james robinson has lower body issue implies that impacted him getting only 12 snaps one carry that was nullified by penalty,"{'neg': 0.198, 'neu': 0.802, 'pos': 0.0, 'compound': -0.6369}",False,-0.6369
195,1584593927394713605,2022-10-24 17:13:27+00:00,_John_Shipley,"""I feel like as an offense we are better when both those guys are playing."" #Jaguars HC Doug Pederson on Travis Etienne and James Robinson. Says Robinson has been dealing with a knee injury, including during yesterday's game https://t.co/ZY1Ydv6RCn",['Jaguars'],40,8,,,i feel like as offense we are better when both those guys are playing hc doug pederson travis etienne james robinson says robinson has been dealing with knee injury including during yesterdays game,"{'neg': 0.123, 'neu': 0.692, 'pos': 0.185, 'compound': 0.34}",True,0.34
196,1584593766295691264,2022-10-24 17:12:48+00:00,Demetrius82,"#Jaguars head coach Doug Pederson says RB James Robinson has some “lower body” issues, specifically knee soreness. 

But says that it goes back to how well Travis Etienne has been playing as opposed to lost confidence in Robinson.",['Jaguars'],101,11,,,head coach doug pederson says rb james robinson has some lower body issues specifically knee soreness but says that it goes back how well travis etienne has been playing as opposed lost confidence robinson,"{'neg': 0.106, 'neu': 0.677, 'pos': 0.217, 'compound': 0.6956}",True,0.6956
197,1584593763506479104,2022-10-24 17:12:48+00:00,jpshadrick,Pederson says RB James Robinson has been dealing with some knee soreness… was dealing with it during the game. Says they are still counting on him #jaguars,['jaguars'],13,3,,,pederson says rb james robinson has been dealing with some knee soreness was dealing with it during game says they are still counting him,"{'neg': 0.0, 'neu': 1.0, 'pos': 0.0, 'compound': 0.0}",False,0.0
198,1584593763187314688,2022-10-24 17:12:48+00:00,GeneFrenette,Pederson said 4th-and-half-yard situation where Trevor got stuffed in QB sneak is something u should convert “98 percent” of the time. #Jaguars,['Jaguars'],2,0,,,pederson said 4th half yard situation where trevor got stuffed qb sneak is something u should convert 98 percent time,"{'neg': 0.0, 'neu': 1.0, 'pos': 0.0, 'compound': 0.0}",False,0.0
199,1584593553095000064,2022-10-24 17:11:58+00:00,JvilleJaguars,"Man, that second half defensively was atrocious when you look back on it

Couldn't name a WR outside of Sterling Shephard and the #Jaguars let both Barkley &amp; Jones run wild on them

Oh yeah, Giants lost two starting OL &amp; starting TE by that point as well",['Jaguars'],1,0,,,man that second half defensively was atrocious when you look back it couldnt name wr outside sterling shephard let both barkley amp jones run wild them oh yeah giants lost two starting ol amp starting te by that point as well,"{'neg': 0.086, 'neu': 0.819, 'pos': 0.095, 'compound': 0.1027}",True,0.1027
200,1584592318778187777,2022-10-24 17:07:03+00:00,jaxdotcom,"The #Jaguars are still 0-for-October. And, Gene Frenette writes, it's the latest illustration of a pattern where this young team keeps coming up short in the clutch moments. https://t.co/1uZHrcBOxo",['Jaguars'],1,1,,,are still 0 october gene frenette writes its latest illustration pattern where this young team keeps coming up short clutch moments,"{'neg': 0.0, 'neu': 1.0, 'pos': 0.0, 'compound': 0.0}",False,0.0
201,1584591259691536390,2022-10-24 17:02:51+00:00,Danethemundane,Maddening that the #jaguars dont use Tlaw on more read options the way the giants use daniel jones.,['jaguars'],0,0,,,maddening that dont use tlaw more read options way giants use daniel jones,"{'neg': 0.211, 'neu': 0.789, 'pos': 0.0, 'compound': -0.4939}",False,-0.4939
202,1584589922853273600,2022-10-24 16:57:32+00:00,JvilleJaguars,"That Mike Caldwell shine has lost some luster over the past two weeks. 

We've seen about 6 straight quarters of defensive struggles and what seems to be a lack of defensive adjustments  #Jaguars",['Jaguars'],1,0,,,that mike caldwell shine has lost some luster over past two weeks weve seen about 6 straight quarters defensive struggles what seems be lack defensive adjustments,"{'neg': 0.235, 'neu': 0.629, 'pos': 0.136, 'compound': -0.6124}",False,-0.6124
203,1584587475183599617,2022-10-24 16:47:48+00:00,GeneFrenette,#Jaguars C Fortner is resolute in his belief that team will turn season around. “The dam is gonna break.”,['Jaguars'],7,1,,,c fortner is resolute his belief that team will turn season around dam is gonna break,"{'neg': 0.0, 'neu': 0.87, 'pos': 0.13, 'compound': 0.2732}",True,0.2732
204,1584586013862526980,2022-10-24 16:42:00+00:00,JaguarsViews,"Saquon Barkley, Daniel Jones were highest-graded Giants in Week 7 #JacksonvilleJaguars #Jaguars #Jags #GoJags #JagsFans https://t.co/M3wSGLK8gP","['JacksonvilleJaguars', 'Jaguars', 'Jags', 'GoJags', 'JagsFans']",0,0,,,saquon barkley daniel jones were highest graded giants week 7,"{'neg': 0.0, 'neu': 1.0, 'pos': 0.0, 'compound': 0.0}",False,0.0
205,1584583248922943488,2022-10-24 16:31:01+00:00,JaguarsViews,Short-handed Broncos signing RB Marlon Mack #JacksonvilleJaguars #Jaguars #Jags #GoJags #JagsFans https://t.co/rNrqvTywHB,"['JacksonvilleJaguars', 'Jaguars', 'Jags', 'GoJags', 'JagsFans']",0,0,,,short handed broncos signing rb marlon mack,"{'neg': 0.0, 'neu': 1.0, 'pos': 0.0, 'compound': 0.0}",False,0.0
206,1584582358623080448,2022-10-24 16:27:29+00:00,LanceMedow,"Hosting BBKL with @giantswfan 12:30PM ET on @Giants.com &amp; the mobile app..recapping team's 23-17 win over the #Jaguars in Week 7 &amp; more #giantschat #NYGvsJAX

📻Listen: https://t.co/AX7h9z8uU5 https://t.co/P55BszrUIa","['Jaguars', 'giantschat', 'NYGvsJAX']",0,0,"[User(username='giantswfan', id=62511529, displayname='GiantsWFAN', description=None, rawDescription=None, descriptionUrls=None, verified=None, created=None, followersCount=None, friendsCount=None, statusesCount=None, favouritesCount=None, listedCount=None, mediaCount=None, location=None, protected=None, linkUrl=None, linkTcourl=None, profileImageUrl=None, profileBannerUrl=None, label=None), User(username='Giants', id=240734425, displayname='New York Giants', description=None, rawDescription=None, descriptionUrls=None, verified=None, created=None, followersCount=None, friendsCount=None, statusesCount=None, favouritesCount=None, listedCount=None, mediaCount=None, location=None, protected=None, linkUrl=None, linkTcourl=None, profileImageUrl=None, profileBannerUrl=None, label=None)]",,hosting bbkl with 12 30pm et com amp mobile app recapping teams 23 17 win over week 7 amp more listen,"{'neg': 0.0, 'neu': 0.833, 'pos': 0.167, 'compound': 0.5859}",True,0.5859
207,1584581858112983043,2022-10-24 16:25:29+00:00,NFLMocks,"Another Monday, another Mock Draft! @NFLDraftHaas takes the reins this week with some shocking selections. 

-#Lions get a Jared Goff replacement
-#Texans land the two best defenders
-#Jaguars take Quentin Johnston as WR1
-And plenty more here: https://t.co/yTDSaUNKXS","['Lions', 'Texans', 'Jaguars']",2,2,"[User(username='NFLDraftHaas', id=1636714237, displayname='Hunter Haas.', description=None, rawDescription=None, descriptionUrls=None, verified=None, created=None, followersCount=None, friendsCount=None, statusesCount=None, favouritesCount=None, listedCount=None, mediaCount=None, location=None, protected=None, linkUrl=None, linkTcourl=None, profileImageUrl=None, profileBannerUrl=None, label=None)]",,another monday another mock draft takes reins this week with some shocking selections get jared goff replacement land two best defenders take quentin johnston as wr1 plenty more here,"{'neg': 0.153, 'neu': 0.694, 'pos': 0.153, 'compound': 0.0}",False,0.0
208,1584581281614286848,2022-10-24 16:23:12+00:00,runauturuncu,"After a long day of exploration, we establish our base camp near a trickle of water. We are working in novel areas in the Southern Tropical Andes to conserve the jaguar and the southernmost bear on the planet. #ProyectoJuco #Bears #Jaguars #RainForest #ClimateChange https://t.co/LzgxoH9HfE","['ProyectoJuco', 'Bears', 'Jaguars', 'RainForest', 'ClimateChange']",0,0,,,after long day exploration we establish our base camp near trickle water we are working novel areas southern tropical andes conserve jaguar southernmost bear planet,"{'neg': 0.0, 'neu': 0.846, 'pos': 0.154, 'compound': 0.4939}",True,0.4939
209,1584580691584778240,2022-10-24 16:20:51+00:00,dwill3,"Can someone in the fantasy football world explain to me how James Robinson goes from avg 15 touches/game and 4.19 ypr to fewer rushes than Zay Jones and JaMychal Hasty even AFTER Etienne fumbles in the RZ?!

Someone make sense of it.
#NFL #Jaguars #wth","['NFL', 'Jaguars', 'wth']",12,3,,,can someone fantasy football world explain me how james robinson goes avg 15 touches game 4 19 ypr fewer rushes than zay jones jamychal hasty even after etienne fumbles rz someone make sense it,"{'neg': 0.0, 'neu': 1.0, 'pos': 0.0, 'compound': 0.0}",False,0.0
210,1584580487909097476,2022-10-24 16:20:03+00:00,JaguarsViews,Kirby Smart wants to move Georgia-Florida out of Jacksonville; money says otherwise #JacksonvilleJaguars #Jaguars #Jags #GoJags #JagsFans https://t.co/utDhzyRiZI,"['JacksonvilleJaguars', 'Jaguars', 'Jags', 'GoJags', 'JagsFans']",0,0,,,kirby smart wants move georgia florida out jacksonville money says otherwise,"{'neg': 0.0, 'neu': 0.787, 'pos': 0.213, 'compound': 0.4019}",True,0.4019
211,1584578633376870401,2022-10-24 16:12:40+00:00,Duffykev36,"Really ??? We have Gus Bradley how many years to prove himself , Doug Marrone 4 years , Caldwell about 10 years , and people giving Pederson shit 7 games in ?? A few more roster changes and they will be great !! #Jaguars  , #DUUUVAL  , #jagstwitter , #jaguarstwitter","['Jaguars', 'DUUUVAL', 'jagstwitter', 'jaguarstwitter']",0,0,,,really we have gus bradley how many years prove himself doug marrone 4 years caldwell about 10 years people giving pederson shit 7 games few more roster changes they will be great,"{'neg': 0.097, 'neu': 0.728, 'pos': 0.175, 'compound': 0.4404}",True,0.4404
212,1584577710180933636,2022-10-24 16:09:00+00:00,JaguarsViews,Self-Inflicted Mistakes Continue To Doom Jaguars #JacksonvilleJaguars #Jaguars #Jags #GoJags #JagsFans https://t.co/SenzBzlhsh,"['JacksonvilleJaguars', 'Jaguars', 'Jags', 'GoJags', 'JagsFans']",0,0,,,self inflicted mistakes continue doom jaguars,"{'neg': 0.565, 'neu': 0.435, 'pos': 0.0, 'compound': -0.6369}",False,-0.6369
213,1584576567778635777,2022-10-24 16:04:28+00:00,KelbermanNFL,"4.5-point underdogs to the 2-5 #Jaguars.

That sound you hear is the #Broncos hitting rock bottom.","['Jaguars', 'Broncos']",283,20,,,4 5 point underdogs 2 5 that sound you hear is hitting rock bottom,"{'neg': 0.0, 'neu': 1.0, 'pos': 0.0, 'compound': 0.0}",False,0.0
214,1584575448243118080,2022-10-24 16:00:01+00:00,IndyJaguars,"Birthday in October?
Make sure you're here for this on Thursday!
You and 1 guest get in FREE!

.
.
.
#Birthday #OCTOBER #Spookyseason #BirthdayBash #Jaguars #Indy #GentlemansClub https://t.co/0gpwchLdi1","['Birthday', 'OCTOBER', 'Spookyseason', 'BirthdayBash', 'Jaguars', 'Indy', 'GentlemansClub']",2,3,,,birthday october make sure youre here this thursday you 1 guest get free,"{'neg': 0.0, 'neu': 0.641, 'pos': 0.359, 'compound': 0.6808}",True,0.6808
215,1584574954967801856,2022-10-24 15:58:03+00:00,JaguarsViews,Xavier McKinney Recalls Wild End to Giants' 23-17 Win Over Jaguars #JacksonvilleJaguars #Jaguars #Jags #GoJags #JagsFans https://t.co/BO8031fHlT,"['JacksonvilleJaguars', 'Jaguars', 'Jags', 'GoJags', 'JagsFans']",0,0,,,xavier mckinney recalls wild end giants 23 17 win over jaguars,"{'neg': 0.0, 'neu': 0.725, 'pos': 0.275, 'compound': 0.5859}",True,0.5859
216,1584574804665184257,2022-10-24 15:57:28+00:00,OnTheCLOCK__,#Broncos have a primetime game this Sunday against the #Jaguars in Berlin.,"['Broncos', 'Jaguars']",0,0,,,have primetime game this sunday against berlin,"{'neg': 0.0, 'neu': 1.0, 'pos': 0.0, 'compound': 0.0}",False,0.0
217,1584574299104772097,2022-10-24 15:55:27+00:00,RealMBB,Mike Caldwell’s defense is the cure! #Jaguars https://t.co/CPDcfQhK1U,['Jaguars'],0,0,,,mike caldwell s defense is cure,"{'neg': 0.0, 'neu': 0.727, 'pos': 0.273, 'compound': 0.128}",True,0.128
218,1584574129294147584,2022-10-24 15:54:47+00:00,1010XL,"Even tough the #Jaguars couldn't quite get the job done the home town kid still came to play

Darious Williams is our Defensive Player of The Game⬇️ https://t.co/ctmQpSejCC",['Jaguars'],2,1,,,even tough couldnt quite get job done home town kid still came play darious williams is our defensive player game,"{'neg': 0.068, 'neu': 0.773, 'pos': 0.159, 'compound': 0.25}",True,0.25
219,1584569285266919424,2022-10-24 15:35:32+00:00,AmityBekke,"@tvjoe12 @LeonSearcyJr1 @NFL Which is why Philly let him go. His end of game antics, misusing timeouts and challenges were enough for them to end the relationship- now here he adds in 4th down / FG miscalculations and we are seeing a real problem. #Jaguars",['Jaguars'],0,0,"[User(username='tvjoe12', id=2546220798, displayname='Joe', description=None, rawDescription=None, descriptionUrls=None, verified=None, created=None, followersCount=None, friendsCount=None, statusesCount=None, favouritesCount=None, listedCount=None, mediaCount=None, location=None, protected=None, linkUrl=None, linkTcourl=None, profileImageUrl=None, profileBannerUrl=None, label=None), User(username='LeonSearcyJr1', id=1397181778960470017, displayname='Leon Searcy Jr', description=None, rawDescription=None, descriptionUrls=None, verified=None, created=None, followersCount=None, friendsCount=None, statusesCount=None, favouritesCount=None, listedCount=None, mediaCount=None, location=None, protected=None, linkUrl=None, linkTcourl=None, profileImageUrl=None, profileBannerUrl=None, label=None), User(username='NFL', id=19426551, displayname='NFL', description=None, rawDescription=None, descriptionUrls=None, verified=None, created=None, followersCount=None, friendsCount=None, statusesCount=None, favouritesCount=None, listedCount=None, mediaCount=None, location=None, protected=None, linkUrl=None, linkTcourl=None, profileImageUrl=None, profileBannerUrl=None, label=None)]",,which is why philly let him go his end game antics misusing timeouts challenges were enough them end relationship now here he adds 4th down fg miscalculations we are seeing real problem,"{'neg': 0.079, 'neu': 0.882, 'pos': 0.038, 'compound': -0.34}",False,-0.34
220,1584568817589841920,2022-10-24 15:33:40+00:00,Pkm89,Cant wait for szn to get here but when its here you cant wait for it to end. #Jaguars,['Jaguars'],5,1,,,cant wait szn get here but when its here you cant wait it end,"{'neg': 0.0, 'neu': 1.0, 'pos': 0.0, 'compound': 0.0}",False,0.0
221,1584567475739709440,2022-10-24 15:28:20+00:00,Twin_Vision_,"https://t.co/NCwBryZyUk
@ROARoftheJags
@Jaguars

#DUUUVAL #Jags #ilovejax #Jacksonville #Jaguars #NFLTwitter #NFL
#AFC #AFCsouth","['DUUUVAL', 'Jags', 'ilovejax', 'Jacksonville', 'Jaguars', 'NFLTwitter', 'NFL', 'AFC', 'AFCsouth']",0,2,"[User(username='ROARoftheJags', id=450853660, displayname='Jacksonville Jaguars Cheerleaders', description=None, rawDescription=None, descriptionUrls=None, verified=None, created=None, followersCount=None, friendsCount=None, statusesCount=None, favouritesCount=None, listedCount=None, mediaCount=None, location=None, protected=None, linkUrl=None, linkTcourl=None, profileImageUrl=None, profileBannerUrl=None, label=None), User(username='Jaguars', id=59471027, displayname='Jacksonville Jaguars', description=None, rawDescription=None, descriptionUrls=None, verified=None, created=None, followersCount=None, friendsCount=None, statusesCount=None, favouritesCount=None, listedCount=None, mediaCount=None, location=None, protected=None, linkUrl=None, linkTcourl=None, profileImageUrl=None, profileBannerUrl=None, label=None)]",,,"{'neg': 0.0, 'neu': 0.0, 'pos': 0.0, 'compound': 0.0}",False,0.0
222,1584564491496611842,2022-10-24 15:16:29+00:00,clayharbs82,"Jawaan Taylor is one of the most improved O-linemen in the NFL this season. Taylor didn’t allow a pressure on 44 pass-blocking snaps. 

Definitely a bright spot for the Jags. #Jaguars #DUUUVAL #Jags","['Jaguars', 'DUUUVAL', 'Jags']",28,2,,"Coordinates(longitude=-74.026675, latitude=40.683935)",jawaan taylor is one most improved o linemen nfl this season taylor didn t allow pressure 44 pass blocking snaps definitely bright spot jags,"{'neg': 0.151, 'neu': 0.505, 'pos': 0.344, 'compound': 0.7264}",True,0.7264
223,1584564170850435072,2022-10-24 15:15:12+00:00,GTEpresents,"Sponsor Alert!!! Let's welcome another sponsor @mayne_co  for this years tailgates! Don't forget to stop by and check out what they have to offer!​​​​​​​​

 #GTE #ElevateYourTailgate #jaguars #jacksonville #duuuval #904 #football #footballszn #tailgate #tailgatepa https://t.co/O4HOkcllLg","['GTE', 'ElevateYourTailgate', 'jaguars', 'jacksonville', 'duuuval', 'football', 'footballszn', 'tailgate', 'tailgatepa']",3,1,,,sponsor alert lets welcome another sponsor this years tailgates dont forget stop by check out what they have offer,"{'neg': 0.0, 'neu': 0.631, 'pos': 0.369, 'compound': 0.7753}",True,0.7753
224,1584563871779590145,2022-10-24 15:14:01+00:00,JaguarsViews,3 Takeaways from Giants' Week 7 Win vs. Jaguars #JacksonvilleJaguars #Jaguars #Jags #GoJags #JagsFans https://t.co/5gxLaXvy62,"['JacksonvilleJaguars', 'Jaguars', 'Jags', 'GoJags', 'JagsFans']",0,0,,,3 takeaways giants week 7 win vs jaguars,"{'neg': 0.0, 'neu': 0.568, 'pos': 0.432, 'compound': 0.5859}",True,0.5859
225,1584562608325042176,2022-10-24 15:09:00+00:00,The33rdTeamFB,"🔥 Heinicke makes Washington better
🐆 #Jaguars are improving but it isn't enough
🫤 #Buccaneers are in flux 

@JoeBanner13 gives his thoughts on Sunday's slate of games ✍️","['Jaguars', 'Buccaneers']",6,0,"[User(username='JoeBanner13', id=2756182062, displayname='Joe Banner', description=None, rawDescription=None, descriptionUrls=None, verified=None, created=None, followersCount=None, friendsCount=None, statusesCount=None, favouritesCount=None, listedCount=None, mediaCount=None, location=None, protected=None, linkUrl=None, linkTcourl=None, profileImageUrl=None, profileBannerUrl=None, label=None)]",,heinicke makes washington better are improving but it isnt enough are flux gives his thoughts sundays slate games,"{'neg': 0.0, 'neu': 0.806, 'pos': 0.194, 'compound': 0.431}",True,0.431
226,1584561627659227138,2022-10-24 15:05:06+00:00,JaguarsViews,NFL Team Game Highs and Lows #JacksonvilleJaguars #Jaguars #Jags #GoJags #JagsFans https://t.co/szGNLvGnUk,"['JacksonvilleJaguars', 'Jaguars', 'Jags', 'GoJags', 'JagsFans']",0,0,,,nfl team game highs lows,"{'neg': 0.31, 'neu': 0.69, 'pos': 0.0, 'compound': -0.2023}",False,-0.2023
227,1584558684159385600,2022-10-24 14:53:24+00:00,adamlevitan,"It appears to be happening for Travis Etienne. #Jaguars RB snaps yesterday:

* Travis Etienne 57 (20 routes)
* James Robinson 12 (2 routes)
* JaMycal Hasty 4 (2 routes)",['Jaguars'],180,5,,,it appears be happening travis etienne rb snaps yesterday travis etienne 57 20 routes james robinson 12 2 routes jamycal hasty 4 2 routes,"{'neg': 0.0, 'neu': 1.0, 'pos': 0.0, 'compound': 0.0}",False,0.0
228,1584558341304483840,2022-10-24 14:52:02+00:00,JaguarsViews,Trevor Lawrence: To come up short this many times early in the season is frustrating #JacksonvilleJaguars #Jaguars #Jags #GoJags #JagsFans https://t.co/duHlg0XznO,"['JacksonvilleJaguars', 'Jaguars', 'Jags', 'GoJags', 'JagsFans']",0,0,,,trevor lawrence come up short this many times early season is frustrating,"{'neg': 0.209, 'neu': 0.791, 'pos': 0.0, 'compound': -0.4404}",False,-0.4404
229,1584557403122462721,2022-10-24 14:48:19+00:00,Mikeyb_904,"@ashlynrsullivan tell Brian i appreciated the conversation we had on the walk to the parking garage, im 19 and my little brother is 14 it really made our day 👏🏻 #DTWD #Jaguars @Jaguars https://t.co/HZlWCtHOEt","['DTWD', 'Jaguars']",2,1,"[User(username='ashlynrsullivan', id=2800163448, displayname='Ashlyn Sullivan', description=None, rawDescription=None, descriptionUrls=None, verified=None, created=None, followersCount=None, friendsCount=None, statusesCount=None, favouritesCount=None, listedCount=None, mediaCount=None, location=None, protected=None, linkUrl=None, linkTcourl=None, profileImageUrl=None, profileBannerUrl=None, label=None), User(username='Jaguars', id=59471027, displayname='Jacksonville Jaguars', description=None, rawDescription=None, descriptionUrls=None, verified=None, created=None, followersCount=None, friendsCount=None, statusesCount=None, favouritesCount=None, listedCount=None, mediaCount=None, location=None, protected=None, linkUrl=None, linkTcourl=None, profileImageUrl=None, profileBannerUrl=None, label=None)]",,tell brian i appreciated conversation we had walk parking garage im 19 my little brother is 14 it really made our day,"{'neg': 0.0, 'neu': 0.858, 'pos': 0.142, 'compound': 0.5106}",True,0.5106
230,1584555849179025409,2022-10-24 14:42:08+00:00,JaguarKnowledge,"Jaguars Fans, would you agree if Shad Khan sold the Jacksonville Jaguars in the future to get rid of the losing curse?

#Jaguars | #DUUUVAL","['Jaguars', 'DUUUVAL']",0,1,,,jaguars fans would you agree if shad khan sold jacksonville jaguars future get rid losing curse,"{'neg': 0.282, 'neu': 0.602, 'pos': 0.116, 'compound': -0.5574}",False,-0.5574
