,ID,Date,User,Tweet,HashTags,Likes,Retweets,MentionUsers,LocationCoordinates,clean_Tweet,Sentiment_Analysis,Positive_Sentiment,Compound_Sentiment Score
0,1589767407123537920,2022-11-07 23:51:00+00:00,JaguarsViews,3 men arrested after running onto the Jaguars’ football field during game against the Raiders #JacksonvilleJaguars #Jaguars #Jags #GoJags #JagsFans https://t.co/gCfIlc02Qg,"['JacksonvilleJaguars', 'Jaguars', 'Jags', 'GoJags', 'JagsFans']",1,0,,,3 men arrested after running onto jaguars football field during game against raiders,"{'neg': 0.22, 'neu': 0.78, 'pos': 0.0, 'compound': -0.4767}",False,-0.4767
1,1589763430957076485,2022-11-07 23:35:12+00:00,3forceWarrior,#JagFam really showing love! I appreciate it! #DUUUVAL #Jaguars 🐆,"['JagFam', 'DUUUVAL', 'Jaguars']",2,0,,,really showing love i appreciate it,"{'neg': 0.0, 'neu': 0.287, 'pos': 0.713, 'compound': 0.8147}",True,0.8147
2,1589759447240695808,2022-11-07 23:19:23+00:00,ACathberry,"Intramural golden State college koronadal city
#Jaguars 
#goldenstatecolloge https://t.co/FYl3KKUvh6","['Jaguars', 'goldenstatecolloge']",1,0,,,intramural golden state college koronadal city,"{'neg': 0.0, 'neu': 1.0, 'pos': 0.0, 'compound': 0.0}",False,0.0
3,1589757903703244802,2022-11-07 23:13:15+00:00,Bestmrfootball,"🏈 NFL Draft Prospect: Devin Lloyd, LB, Utah with Vincent Turner https://t.co/WP1JpXYerY via @YouTube #jaguars",['jaguars'],0,0,"[User(username='YouTube', id=10228272, displayname='YouTube', description=None, rawDescription=None, descriptionUrls=None, verified=None, created=None, followersCount=None, friendsCount=None, statusesCount=None, favouritesCount=None, listedCount=None, mediaCount=None, location=None, protected=None, linkUrl=None, linkTcourl=None, profileImageUrl=None, profileBannerUrl=None, label=None)]",,nfl draft prospect devin lloyd lb utah with vincent turner via,"{'neg': 0.0, 'neu': 0.82, 'pos': 0.18, 'compound': 0.296}",True,0.296
4,1589756221426307073,2022-11-07 23:06:34+00:00,Sports_Reportss,"IF you could re-draft the 2020 QB class, who would you take?

#NFL #NFLTwitter #Bears #Jaguars #49ers #Jets #Patriots https://t.co/283wfjS8mm","['NFL', 'NFLTwitter', 'Bears', 'Jaguars', '49ers', 'Jets', 'Patriots']",0,0,,,if you could re draft 2020 qb class who would you take,"{'neg': 0.0, 'neu': 1.0, 'pos': 0.0, 'compound': 0.0}",False,0.0
5,1589755710904340481,2022-11-07 23:04:32+00:00,Mcguinness2A,@chesterzoo great day! #jaguar #Jaguars https://t.co/1MFdIyyIup,"['jaguar', 'Jaguars']",4,0,"[User(username='chesterzoo', id=92761302, displayname='Chester Zoo', description=None, rawDescription=None, descriptionUrls=None, verified=None, created=None, followersCount=None, friendsCount=None, statusesCount=None, favouritesCount=None, listedCount=None, mediaCount=None, location=None, protected=None, linkUrl=None, linkTcourl=None, profileImageUrl=None, profileBannerUrl=None, label=None)]",,great day,"{'neg': 0.0, 'neu': 0.196, 'pos': 0.804, 'compound': 0.6249}",True,0.6249
6,1589754578697846790,2022-11-07 23:00:02+00:00,habshype,"Shop #DUUUVAL Frames, Phone Cases, Puzzles, Throw Pillows and more! @ &gt;&gt; https://t.co/YpWrrSjEUT &lt;&lt; #NFL #Football #FootballSunday #sundayfootball #Jacksonville #JacksonvilleJags #JacksonvilleJaguars #Jaguars","['DUUUVAL', 'NFL', 'Football', 'FootballSunday', 'sundayfootball', 'Jacksonville', 'JacksonvilleJags', 'JacksonvilleJaguars', 'Jaguars']",1,1,,,shop frames phone cases puzzles throw pillows more gt gt lt lt,"{'neg': 0.0, 'neu': 0.676, 'pos': 0.324, 'compound': 0.584}",True,0.584
7,1589753569816809472,2022-11-07 22:56:01+00:00,JaguarsViews,Jaguars WR Marvin Jones Jr: 'We have to get on a run' #JacksonvilleJaguars #Jaguars #Jags #GoJags #JagsFan https://t.co/PFrltqurd3,"['JacksonvilleJaguars', 'Jaguars', 'Jags', 'GoJags', 'JagsFan']",1,0,,,jaguars wr marvin jones jr we have get run,"{'neg': 0.0, 'neu': 1.0, 'pos': 0.0, 'compound': 0.0}",False,0.0
8,1589751166426284033,2022-11-07 22:46:28+00:00,MissFoucault,SCOTT WE GOT A DUB YESTERDAY!! 🤩 🏈 🎉  @SHOTOFYAGER would love to hear your thoughts on the #Jaguars,['Jaguars'],1,0,"[User(username='SHOTOFYAGER', id=104665793, displayname='Scott Yager🪁', description=None, rawDescription=None, descriptionUrls=None, verified=None, created=None, followersCount=None, friendsCount=None, statusesCount=None, favouritesCount=None, listedCount=None, mediaCount=None, location=None, protected=None, linkUrl=None, linkTcourl=None, profileImageUrl=None, profileBannerUrl=None, label=None)]",,scott we got dub yesterday would love hear your thoughts,"{'neg': 0.0, 'neu': 0.682, 'pos': 0.318, 'compound': 0.6369}",True,0.6369
9,1589750808870285313,2022-11-07 22:45:03+00:00,JaguarsViews,Man runs through Jaguars football field during game against the Raiders #JacksonvilleJaguars #Jaguars #Jags #GoJags #JagsFans https://t.co/Eft7HZIPZt,"['JacksonvilleJaguars', 'Jaguars', 'Jags', 'GoJags', 'JagsFans']",0,1,,,man runs through jaguars football field during game against raiders,"{'neg': 0.0, 'neu': 1.0, 'pos': 0.0, 'compound': 0.0}",False,0.0
10,1589748427935862784,2022-11-07 22:35:35+00:00,Bestmrfootball,🏈 2022 Jacksonville Jaguars Team Preview with Vincent Turner https://t.co/kn27aEumMV via @YouTube #jaguars,['jaguars'],0,0,"[User(username='YouTube', id=10228272, displayname='YouTube', description=None, rawDescription=None, descriptionUrls=None, verified=None, created=None, followersCount=None, friendsCount=None, statusesCount=None, favouritesCount=None, listedCount=None, mediaCount=None, location=None, protected=None, linkUrl=None, linkTcourl=None, profileImageUrl=None, profileBannerUrl=None, label=None)]",,2022 jacksonville jaguars team preview with vincent turner via,"{'neg': 0.0, 'neu': 1.0, 'pos': 0.0, 'compound': 0.0}",False,0.0
11,1589748302580715520,2022-11-07 22:35:06+00:00,_John_Shipley,"My takes on the #Jaguars victory over the Raiders. 

- Tough performance from Travis Etienne, who is only getting better
- Dawuane Smoot is in impressive company
- Trevor Lawrence's development needed a game like that

 https://t.co/90UAZGEv1a",['Jaguars'],26,4,,,my takes victory over raiders tough performance travis etienne who is only getting better dawuane smoot is impressive company trevor lawrences development needed game like that,"{'neg': 0.047, 'neu': 0.683, 'pos': 0.27, 'compound': 0.802}",True,0.802
12,1589743376466817024,2022-11-07 22:15:31+00:00,_John_Shipley,"#Jaguars 27, Raiders 20: Doug Pederson Saw Trevor Lawrence Take ‘A Step in the Right Direction’ https://t.co/5ViZblxvNv",['Jaguars'],11,2,,,27 raiders 20 doug pederson saw trevor lawrence take step right direction,"{'neg': 0.0, 'neu': 1.0, 'pos': 0.0, 'compound': 0.0}",False,0.0
13,1589743220489351168,2022-11-07 22:14:54+00:00,_John_Shipley,"#Jaguars 27, Raiders 20: Game Balls https://t.co/PUyriDIc9b",['Jaguars'],4,0,,,27 raiders 20 game balls,"{'neg': 0.0, 'neu': 1.0, 'pos': 0.0, 'compound': 0.0}",False,0.0
14,1589742836664061953,2022-11-07 22:13:22+00:00,Bestmrfootball,"🏈 NFL Draft Prospect: Tyson Campbell, Cornerback, Georgia with Vincent T... https://t.co/Wy3fjNrH3i via @YouTube #jaguars",['jaguars'],0,0,"[User(username='YouTube', id=10228272, displayname='YouTube', description=None, rawDescription=None, descriptionUrls=None, verified=None, created=None, followersCount=None, friendsCount=None, statusesCount=None, favouritesCount=None, listedCount=None, mediaCount=None, location=None, protected=None, linkUrl=None, linkTcourl=None, profileImageUrl=None, profileBannerUrl=None, label=None)]",,nfl draft prospect tyson campbell cornerback georgia with vincent t via,"{'neg': 0.0, 'neu': 0.804, 'pos': 0.196, 'compound': 0.296}",True,0.296
15,1589742491338772482,2022-11-07 22:12:00+00:00,JaguarsViews,'It's a new season': Jaguars look to sustain momentum following 27-20 victory over Raiders #JacksonvilleJaguars #Jaguars #Jags #GoJags #JagsFans https://t.co/iVFsFdEQ8X,"['JacksonvilleJaguars', 'Jaguars', 'Jags', 'GoJags', 'JagsFans']",1,1,,,its new season jaguars look sustain momentum following 27 20 victory over raiders,"{'neg': 0.0, 'neu': 1.0, 'pos': 0.0, 'compound': 0.0}",False,0.0
16,1589739767163494401,2022-11-07 22:01:11+00:00,JaguarsViews,5 takeaways from Chiefs HC Andy Reid’s Monday media availability #JacksonvilleJaguars #Jaguars #Jags #GoJags #JagsFans https://t.co/EC9qk8tQRP,"['JacksonvilleJaguars', 'Jaguars', 'Jags', 'GoJags', 'JagsFans']",0,0,,,5 takeaways chiefs hc andy reid s monday media availability,"{'neg': 0.0, 'neu': 1.0, 'pos': 0.0, 'compound': 0.0}",False,0.0
17,1589736995764461569,2022-11-07 21:50:10+00:00,JaguarsViews,UF-Georgia game marred by antisemitic message projected onto stadium #JacksonvilleJaguars #Jaguars #Jags #GoJags #JagsFans https://t.co/dHdAR1tWsK,"['JacksonvilleJaguars', 'Jaguars', 'Jags', 'GoJags', 'JagsFans']",0,0,,,uf georgia game marred by antisemitic message projected onto stadium,"{'neg': 0.0, 'neu': 1.0, 'pos': 0.0, 'compound': 0.0}",False,0.0
18,1589736708320690176,2022-11-07 21:49:01+00:00,1010XL,"Major news today in the AFC South.

The #Colts have fired head coach Frank Reich.

What do you think about this move #Jaguars fans? https://t.co/RpcyIBaj9W","['Colts', 'Jaguars']",1,0,,,major news today afc south have fired head coach frank reich what do you think about this move fans,"{'neg': 0.167, 'neu': 0.833, 'pos': 0.0, 'compound': -0.5574}",False,-0.5574
19,1589735847116804097,2022-11-07 21:45:36+00:00,JeffKerrCBS,"Doug Pederson passed Urban Meyer Sunday for 5th place on the #Jaguars all-time wins list.

Pederson has 3 wins. Meyer has 2. 

Next up Gus Bradley (14 wins). 

#Jaguars #DUUUVAL https://t.co/Nk2fnyUgMN","['Jaguars', 'Jaguars', 'DUUUVAL']",94,6,,,doug pederson passed urban meyer sunday 5th place all time wins list pederson has 3 wins meyer has 2 next up gus bradley 14 wins,"{'neg': 0.0, 'neu': 0.643, 'pos': 0.357, 'compound': 0.9022}",True,0.9022
20,1589735237655097345,2022-11-07 21:43:11+00:00,Father_Crack,So Tony Boselli just gonna give Josh Allen the made up out his ass excuse of “he must be injured” bullshit for playing like ass. FOH. He just sucks and is no way worth signing back. Jacksonville Jaguars had a chance to get compensated and shit the bed. #Jaguars,['Jaguars'],0,0,,,so tony boselli just gonna give josh allen made up out his ass excuse he must be injured bullshit playing like ass foh he just sucks is no way worth signing back jacksonville jaguars had chance get compensated shit bed,"{'neg': 0.368, 'neu': 0.472, 'pos': 0.16, 'compound': -0.936}",False,-0.936
21,1589734961921560576,2022-11-07 21:42:05+00:00,DTWD904,"Jim Nantz &amp; Tony Romo in the booth for #Jaguars &amp; #Chiefs

CBS top notch crew, will be a lot of eyes on this game.

Huge opportunity for #DUUUVAL","['Jaguars', 'Chiefs', 'DUUUVAL']",2,0,,,jim nantz amp tony romo booth amp cbs top notch crew will be lot eyes this game huge opportunity,"{'neg': 0.0, 'neu': 0.699, 'pos': 0.301, 'compound': 0.7096}",True,0.7096
22,1589734572526166016,2022-11-07 21:40:32+00:00,ruthmulugeta82,"#Jaguars As temperatures rise, hurricanes whirl and glaciers melt, the conversation about climate change and our ro… https://t.co/mG2hlGfUpw",['Jaguars'],0,0,,,as temperatures rise hurricanes whirl glaciers melt conversation about climate change our ro,"{'neg': 0.0, 'neu': 1.0, 'pos': 0.0, 'compound': 0.0}",False,0.0
23,1589730667260100609,2022-11-07 21:25:01+00:00,tjpayne231,"START WINGARD
#DUUUVAL #Jaguars #JacksonvilleJaguars","['DUUUVAL', 'Jaguars', 'JacksonvilleJaguars']",0,0,,,start wingard,"{'neg': 0.0, 'neu': 1.0, 'pos': 0.0, 'compound': 0.0}",False,0.0
24,1589729457505435650,2022-11-07 21:20:13+00:00,USGS_WGSC,#NewPublication in @FrontConservSci: Scientists from WGSC &amp; @wildlandsnetwrk show how border infrastructure and remediation scenarios impact the energy required of #jaguars to reach key water sources in the #Madrean #SkyIslands of #SEAZ 🔎🐾💧 https://t.co/wK3qP5BYIx https://t.co/GQfLiddZ4u,"['NewPublication', 'jaguars', 'Madrean', 'SkyIslands', 'SEAZ']",7,2,"[User(username='FrontConservSci', id=1296107746161577984, displayname='Frontiers in Conservation Science', description=None, rawDescription=None, descriptionUrls=None, verified=None, created=None, followersCount=None, friendsCount=None, statusesCount=None, favouritesCount=None, listedCount=None, mediaCount=None, location=None, protected=None, linkUrl=None, linkTcourl=None, profileImageUrl=None, profileBannerUrl=None, label=None), User(username='wildlandsnetwrk', id=198651541, displayname='Wildlands Network', description=None, rawDescription=None, descriptionUrls=None, verified=None, created=None, followersCount=None, friendsCount=None, statusesCount=None, favouritesCount=None, listedCount=None, mediaCount=None, location=None, protected=None, linkUrl=None, linkTcourl=None, profileImageUrl=None, profileBannerUrl=None, label=None)]",,scientists wgsc amp show how border infrastructure remediation scenarios impact energy required reach key water sources,"{'neg': 0.0, 'neu': 0.814, 'pos': 0.186, 'compound': 0.296}",True,0.296
25,1589729295680692224,2022-11-07 21:19:34+00:00,1010XL,T-Law put together an all around solid performance in the #Jaguars comeback victory as he's our Offensive Player of The Game https://t.co/swEKrStOK9,['Jaguars'],1,0,,,t law put together all around solid performance comeback victory as hes our offensive player game,"{'neg': 0.17, 'neu': 0.739, 'pos': 0.091, 'compound': -0.34}",False,-0.34
26,1589728140318105600,2022-11-07 21:14:59+00:00,SportsGrind_Don,"When it comes to the #Jaguars’ offensive PFF grades for this week, Lawrence led the way. He had several skill players with him in the top-5 and the list is as follows:

QB Trevor Lawrence 87.6
WR Christian Kirk 80.8
RB Travis Etienne 77.6
OT Cam Robinson 73.1
TE Luke Farrell 73.0",['Jaguars'],7,2,,,when it comes offensive pff grades this week lawrence led way he had several skill players with him top 5 list is as follows qb trevor lawrence 87 6 wr christian kirk 80 8 rb travis etienne 77 6 ot cam robinson 73 1 te luke farrell 73 0,"{'neg': 0.066, 'neu': 0.895, 'pos': 0.039, 'compound': -0.296}",False,-0.296
27,1589725346710294528,2022-11-07 21:03:52+00:00,Demetrius82,"'It's a new season': #Jaguars look to sustain momentum following 27-20 victory over Raiders 

""It's just a matter of, can you repeat it and can you sustain it? And that's what we need to do."" 

https://t.co/3wFZkjN5ag via @jaxdotcom",['Jaguars'],9,0,"[User(username='jaxdotcom', id=15572679, displayname='Florida Times-Union', description=None, rawDescription=None, descriptionUrls=None, verified=None, created=None, followersCount=None, friendsCount=None, statusesCount=None, favouritesCount=None, listedCount=None, mediaCount=None, location=None, protected=None, linkUrl=None, linkTcourl=None, profileImageUrl=None, profileBannerUrl=None, label=None)]",,its new season look sustain momentum following 27 20 victory over raiders its just matter can you repeat it can you sustain it thats what we need do via,"{'neg': 0.0, 'neu': 0.962, 'pos': 0.038, 'compound': 0.0258}",True,0.0258
28,1589725180917878786,2022-11-07 21:03:13+00:00,jagsburner,He’s bound to lose 1. Why not this week #jaguars https://t.co/rPKZ7twejN,['jaguars'],1,0,,,he s bound lose 1 why not this week,"{'neg': 0.31, 'neu': 0.69, 'pos': 0.0, 'compound': -0.4019}",False,-0.4019
29,1589724701563113473,2022-11-07 21:01:19+00:00,TopicalMaps,"Top Google Trends in the United States by relative interest in each state over the last hour. 

#VeteransDay #FrankReich #PaulMescal #Jaguars #SonicFrontiers 

Live map at https://t.co/3Fz1e2iXth https://t.co/zI07lPWYni","['VeteransDay', 'FrankReich', 'PaulMescal', 'Jaguars', 'SonicFrontiers']",2,1,,,top google trends united states by relative interest each state over last hour live map at,"{'neg': 0.0, 'neu': 0.631, 'pos': 0.369, 'compound': 0.765}",True,0.765
30,1589724455131320320,2022-11-07 21:00:20+00:00,SSN_GOD_,@Jaguars Terrible meme to use. QBs always have a terrible game after this meme is used or they’ll get injured. Prepare for a terrible game by Trevor Lawrence Sunday or prepare to see CJ Beathard. #Jaguars #DUUUVAL #NFL,"['Jaguars', 'DUUUVAL', 'NFL']",0,0,"[User(username='Jaguars', id=59471027, displayname='Jacksonville Jaguars', description=None, rawDescription=None, descriptionUrls=None, verified=None, created=None, followersCount=None, friendsCount=None, statusesCount=None, favouritesCount=None, listedCount=None, mediaCount=None, location=None, protected=None, linkUrl=None, linkTcourl=None, profileImageUrl=None, profileBannerUrl=None, label=None)]",,terrible meme use qbs always have terrible game after this meme is used or they ll get injured prepare terrible game by trevor lawrence sunday or prepare see cj beathard,"{'neg': 0.316, 'neu': 0.684, 'pos': 0.0, 'compound': -0.9001}",False,-0.9001
31,1589723365040066560,2022-11-07 20:56:00+00:00,Bestmrfootball,"🏈 NFL Draft Prospect: Travon Walker, DE, Georgia with Vincent Turner https://t.co/guEwCT49XY via @YouTube #jaguars",['jaguars'],0,0,"[User(username='YouTube', id=10228272, displayname='YouTube', description=None, rawDescription=None, descriptionUrls=None, verified=None, created=None, followersCount=None, friendsCount=None, statusesCount=None, favouritesCount=None, listedCount=None, mediaCount=None, location=None, protected=None, linkUrl=None, linkTcourl=None, profileImageUrl=None, profileBannerUrl=None, label=None)]",,nfl draft prospect travon walker de georgia with vincent turner via,"{'neg': 0.0, 'neu': 0.82, 'pos': 0.18, 'compound': 0.296}",True,0.296
32,1589722908578152448,2022-11-07 20:54:11+00:00,JvilleJaguars,Something I didn't see coming: Dewey becoming the energy on the sideline in yesterday's game.  Dude even played nicely w/ Jenkins injury.  #Jaguars,['Jaguars'],3,0,,,something i didnt see coming dewey becoming energy sideline yesterdays game dude even played nicely w jenkins injury,"{'neg': 0.126, 'neu': 0.541, 'pos': 0.333, 'compound': 0.5574}",True,0.5574
33,1589722634027425792,2022-11-07 20:53:06+00:00,Johnheine20,#Jaguars https://t.co/UcCTeZl6vS,['Jaguars'],0,0,,,,"{'neg': 0.0, 'neu': 0.0, 'pos': 0.0, 'compound': 0.0}",False,0.0
34,1589720338396774400,2022-11-07 20:43:58+00:00,iktriad,"I hope the #Jaguars point differential stays positive after this week (Jags @ Chiefs...), but yeah, it's very interesting/funny. #nflhu https://t.co/p8d8ZNCM52","['Jaguars', 'nflhu']",0,0,,,i hope point differential stays positive after this week jags chiefs but yeah its very interesting funny,"{'neg': 0.0, 'neu': 0.418, 'pos': 0.582, 'compound': 0.9361}",True,0.9361
35,1589719642901450752,2022-11-07 20:41:13+00:00,iktriad,"He still has growing pains, but he is getting better this season. #Jaguars #nflhu https://t.co/39lzl27yjf","['Jaguars', 'nflhu']",1,0,,,he still has growing pains but he is getting better this season,"{'neg': 0.118, 'neu': 0.559, 'pos': 0.323, 'compound': 0.5106}",True,0.5106
36,1589719508691800065,2022-11-07 20:40:41+00:00,GJonesNYC,#Jaguars in the top 10 in 3 of 4 categories 🙃 https://t.co/RUSf3BDzeO,['Jaguars'],1,0,,,top 10 3 4 categories,"{'neg': 0.0, 'neu': 0.526, 'pos': 0.474, 'compound': 0.2023}",True,0.2023
37,1589717050519232576,2022-11-07 20:30:55+00:00,N85Bos,Has a 3-6 team ever made the playoffs ? #Jaguars #Duuval,"['Jaguars', 'Duuval']",0,0,,,has 3 6 team ever made playoffs,"{'neg': 0.0, 'neu': 1.0, 'pos': 0.0, 'compound': 0.0}",False,0.0
38,1589716874799230976,2022-11-07 20:30:13+00:00,InsideTheLeague,"Frank Reich’s exit from the #Colts drops Bob Lamonte’s Professional Sports Representation to 6 NFL clients (Zac Taylor, #Bengals; Sean McDermott, #Bills; Andy Reid, #Chiefs; Brian Daboll, #Giants; Doug Pederson, #Jaguars; &amp; Sean McVay, #Rams). Still, however, most in the #NFL.","['Colts', 'Bengals', 'Bills', 'Chiefs', 'Giants', 'Jaguars', 'Rams', 'NFL']",7,2,,,frank reich s exit drops bob lamonte s professional sports representation 6 nfl clients zac taylor sean mcdermott andy reid brian daboll doug pederson amp sean mcvay still however most,"{'neg': 0.0, 'neu': 1.0, 'pos': 0.0, 'compound': 0.0}",False,0.0
39,1589715874419822592,2022-11-07 20:26:14+00:00,daily_catchup,Save your Time! Read our Summary of Articles about Jaguars #Jaguars #dailycatchup #summary https://t.co/hRz622zdqZ,"['Jaguars', 'dailycatchup', 'summary']",0,0,,,save your time read our summary articles about jaguars,"{'neg': 0.0, 'neu': 0.714, 'pos': 0.286, 'compound': 0.4939}",True,0.4939
40,1589714824564338688,2022-11-07 20:22:04+00:00,JaguarsViews,Jaguars S Rayshawn Jenkins in concussion protocol after Week 9 #JacksonvilleJaguars #Jaguars #Jags #GoJags #JagsFan https://t.co/l5zRr98Pmn,"['JacksonvilleJaguars', 'Jaguars', 'Jags', 'GoJags', 'JagsFan']",0,0,,,jaguars s rayshawn jenkins concussion protocol after week 9,"{'neg': 0.0, 'neu': 1.0, 'pos': 0.0, 'compound': 0.0}",False,0.0
41,1589713934571171840,2022-11-07 20:18:32+00:00,Jaginoff,Gonna be live as soon as I step out the shower come through and talk some #Jaguars with ya boy.,['Jaguars'],2,0,,,gonna be live as soon as i step out shower come through talk some with ya boy,"{'neg': 0.0, 'neu': 1.0, 'pos': 0.0, 'compound': 0.0}",False,0.0
42,1589712060438515714,2022-11-07 20:11:05+00:00,JaguarsViews,Jaguars S Rayshawn Jenkins in concussion protocol after Week 9 #JacksonvilleJaguars #Jaguars #Jags #GoJags #JagsFans https://t.co/AeZkT7MPXr,"['JacksonvilleJaguars', 'Jaguars', 'Jags', 'GoJags', 'JagsFans']",0,0,,,jaguars s rayshawn jenkins concussion protocol after week 9,"{'neg': 0.0, 'neu': 1.0, 'pos': 0.0, 'compound': 0.0}",False,0.0
43,1589711678383742978,2022-11-07 20:09:34+00:00,iktriad,"Ok, Gus Bradleynek borzalmas HC mérlege van, de interim HC-nek nem jó? És az egykori (interim) #Jaguars OC Scott Milanovich lesz a Colts (interim) OC? A Jags 9,6 pontot átlagolt támadásban, mikor ő hívta a playeket, és sose szereztünk 17-nél több pontot vele. Tank ON? #nflhu https://t.co/4LBOSh6eeh","['Jaguars', 'nflhu']",0,0,,,ok gus bradleynek borzalmas hc m rlege van de interim hc nek nem j s az egykori interim oc scott milanovich lesz colts interim oc jags 9 6 pontot tlagolt t mad sban mikor h vta playeket s sose szerezt nk 17 n l t bb pontot vele tank,"{'neg': 0.077, 'neu': 0.87, 'pos': 0.053, 'compound': -0.25}",False,-0.25
44,1589711345335029761,2022-11-07 20:08:14+00:00,Demetrius82,"#Jaguars did a good job of staying ahead of the sticks against the Raiders. 

They were put in +3rd-and-5 situations just twice on Sunday, including a 3rd-and-7 with 1:15 remaining in the contest. 

They had 13 third downs of 3rd-and-5 or less. 12 of fewer than 3rd-and-5.",['Jaguars'],58,4,,,did good job staying ahead sticks against raiders they were put 3rd 5 situations just twice sunday including 3rd 7 with 1 15 remaining contest they had 13 third downs 3rd 5 or less 12 fewer than 3rd 5,"{'neg': 0.0, 'neu': 0.919, 'pos': 0.081, 'compound': 0.4404}",True,0.4404
45,1589709874211987456,2022-11-07 20:02:24+00:00,JaguarsViews,"Breakthrough? Young Jaguars learning how to win, or not lose #JacksonvilleJaguars #Jaguars #Jags #GoJags #JagsFans https://t.co/wnwOZC5OiQ","['JacksonvilleJaguars', 'Jaguars', 'Jags', 'GoJags', 'JagsFans']",0,0,,,breakthrough young jaguars learning how win or not lose,"{'neg': 0.0, 'neu': 0.536, 'pos': 0.464, 'compound': 0.7234}",True,0.7234
46,1589709280516739079,2022-11-07 20:00:02+00:00,1010XL,"Enjoy Monday Madness at @TSmoothieCafe
 with the official smoothie of the #Jaguars - the Duval Delight - made with banana, coconut, pineapple, and lemonade! Just $2.99 at Tropical Smoothie Cafe! https://t.co/fwj6vQ2dBt",['Jaguars'],0,0,"[User(username='TSmoothieCafe', id=50392512, displayname='Tropical Smoothie Cafe', description=None, rawDescription=None, descriptionUrls=None, verified=None, created=None, followersCount=None, friendsCount=None, statusesCount=None, favouritesCount=None, listedCount=None, mediaCount=None, location=None, protected=None, linkUrl=None, linkTcourl=None, profileImageUrl=None, profileBannerUrl=None, label=None)]",,enjoy monday madness at with official smoothie duval delight made with banana coconut pineapple lemonade just 2 99 at tropical smoothie cafe,"{'neg': 0.104, 'neu': 0.643, 'pos': 0.254, 'compound': 0.6369}",True,0.6369
47,1589709213361922048,2022-11-07 19:59:46+00:00,N85Bos,@MiaOBrienTV @MyBookie D-Line needs a game like they had vs the Bills last year for us to even think about a W. Even then it'll be hard.#Jaguars,['Jaguars'],0,0,"[User(username='MiaOBrienTV', id=3306324576, displayname=""Mia O'Brien"", description=None, rawDescription=None, descriptionUrls=None, verified=None, created=None, followersCount=None, friendsCount=None, statusesCount=None, favouritesCount=None, listedCount=None, mediaCount=None, location=None, protected=None, linkUrl=None, linkTcourl=None, profileImageUrl=None, profileBannerUrl=None, label=None), User(username='MyBookie', id=538611136, displayname='MyBookie - Bet With The Best', description=None, rawDescription=None, descriptionUrls=None, verified=None, created=None, followersCount=None, friendsCount=None, statusesCount=None, favouritesCount=None, listedCount=None, mediaCount=None, location=None, protected=None, linkUrl=None, linkTcourl=None, profileImageUrl=None, profileBannerUrl=None, label=None)]",,d line needs game like they had vs bills last year us even think about w even then itll be hard,"{'neg': 0.067, 'neu': 0.813, 'pos': 0.12, 'compound': 0.2732}",True,0.2732
48,1589708310001094656,2022-11-07 19:56:11+00:00,JvilleJaguars,"This throw is absolutely incredible.  People rag on the generational talent stuff, but if he keeps progressing, this is why it is deserved #Jaguars https://t.co/sfz9sWzpf9",['Jaguars'],1,0,,,this throw is absolutely incredible people rag generational talent stuff but if he keeps progressing this is why it is deserved,"{'neg': 0.0, 'neu': 0.913, 'pos': 0.087, 'compound': 0.2263}",True,0.2263
