,ID,Date,User,Tweet,HashTags,Likes,Retweets,MentionUsers,LocationCoordinates,clean_Tweet,NLTK_Sentiment_Analysis,TextBlob_Sentiment_Analysis,Compound_Sentiment_Score,Positive_Sentiment
972,1558568984621899777,2022-08-13 21:39:37+00:00,nfergason,Preseason is upon us. @MiamiDolphins vs @Buccaneers a quick #gameday pic to start the season off right! #miami #miamidolphins #finsup #finn #tddolphin #nathanfergasonart https://t.co/RrgMeEVkWG,"['gameday', 'miami', 'miamidolphins', 'finsup', 'finn', 'tddolphin', 'nathanfergasonart']",1,0,"[User(username='MiamiDolphins', id=19853312, displayname='Miami Dolphins', description=None, rawDescription=None, descriptionUrls=None, verified=None, created=None, followersCount=None, friendsCount=None, statusesCount=None, favouritesCount=None, listedCount=None, mediaCount=None, location=None, protected=None, linkUrl=None, linkTcourl=None, profileImageUrl=None, profileBannerUrl=None, label=None), User(username='Buccaneers', id=36155311, displayname='Tampa Bay Buccaneers', description=None, rawDescription=None, descriptionUrls=None, verified=None, created=None, followersCount=None, friendsCount=None, statusesCount=None, favouritesCount=None, listedCount=None, mediaCount=None, location=None, protected=None, linkUrl=None, linkTcourl=None, profileImageUrl=None, profileBannerUrl=None, label=None)]",,preseason upon us vs quick pic start season right,0.0,0.30952380952380953,0.30952380952380953,True
974,1558568654249287684,2022-08-13 21:38:18+00:00,TheMozKnowz,"No cleats for Xavien Howard during warmups, would indicate that he would not play. No reason for him to play. Mike McDaniel saying earlier this week how much he admires the leadership role X has taken this year. #Dolphins #Bucs #NFL @wsvn #NFLTwitter  #NFLPreseason https://t.co/4P5p8eoTU7","['Dolphins', 'Bucs', 'NFL', 'NFLTwitter', 'NFLPreseason']",84,10,"[User(username='wsvn', id=16331756, displayname='WSVN 7 News', description=None, rawDescription=None, descriptionUrls=None, verified=None, created=None, followersCount=None, friendsCount=None, statusesCount=None, favouritesCount=None, listedCount=None, mediaCount=None, location=None, protected=None, linkUrl=None, linkTcourl=None, profileImageUrl=None, profileBannerUrl=None, label=None)]",,cleats xavien howard warmups would indicate would play reason play mike mcdaniel saying earlier week much admires leadership role x taken year,0.7964,0.1,0.8964,True
975,1558568485072113664,2022-08-13 21:37:38+00:00,CoverageOdds,"Miami #Dolphins +1 - 0-0 (0-0 ATS) VS Tampa Bay #Buccaneers -1 - 0-0 (0-0 ATS)

August 13, 2022, 7:30 PM ET
Raymond James Stadium

Tampa Bay will Win, Cover the Spread, and the Total will go Over.

#NFL #NFLSaturday 
Full Props - https://t.co/kzjvgRARYt https://t.co/d4HXYpq8kc","['Dolphins', 'Buccaneers', 'NFL', 'NFLSaturday']",0,0,,,miami 1 0 0 0 0 ats vs tampa bay 1 0 0 0 0 ats august 13 2022 7 30 pm et raymond james stadium tampa bay win cover spread total go full props,0.5859,0.3833333333333333,0.9692333333333333,True
976,1558568104988491778,2022-08-13 21:36:07+00:00,JuanCar02431280,"Matt Araiza P Buffalo Bills, First punt 82 Yards. It looked ridiculous! Called this one too for the Dolphins to Draft. This kid is a weapon! #MattAraiza #BuffaloBills #FinsUp 

https://t.co/U0eeToxaIy","['MattAraiza', 'BuffaloBills', 'FinsUp']",2,0,,,matt araiza p buffalo bills first punt 82 yards looked ridiculous called one dolphins draft kid weapon,-0.5719,-0.04166666666666666,-0.6135666666666666,False
977,1558568018338250753,2022-08-13 21:35:47+00:00,rhtardin,A good day of fieldwork studying social and acoustic behavior of river #dolphins in the Amazon #boto #inia @ecomar_ufrj @gabrielsotalia @dcastj https://t.co/Y8eg2YMDmx,"['dolphins', 'boto', 'inia']",26,2,"[User(username='ecomar_ufrj', id=1286661418658521090, displayname='Laboratório de Ecologia e Conservação Marinha 🌊', description=None, rawDescription=None, descriptionUrls=None, verified=None, created=None, followersCount=None, friendsCount=None, statusesCount=None, favouritesCount=None, listedCount=None, mediaCount=None, location=None, protected=None, linkUrl=None, linkTcourl=None, profileImageUrl=None, profileBannerUrl=None, label=None), User(username='gabrielsotalia', id=117908387, displayname='Gabriel Melo Santos', description=None, rawDescription=None, descriptionUrls=None, verified=None, created=None, followersCount=None, friendsCount=None, statusesCount=None, favouritesCount=None, listedCount=None, mediaCount=None, location=None, protected=None, linkUrl=None, linkTcourl=None, profileImageUrl=None, profileBannerUrl=None, label=None), User(username='dcastj', id=915535838603292672, displayname='Bora pro Rugby?', description=None, rawDescription=None, descriptionUrls=None, verified=None, created=None, followersCount=None, friendsCount=None, statusesCount=None, favouritesCount=None, listedCount=None, mediaCount=None, location=None, protected=None, linkUrl=None, linkTcourl=None, profileImageUrl=None, profileBannerUrl=None, label=None)]",,good day fieldwork studying social acoustic behavior river amazon,0.5574,0.36666666666666664,0.9240666666666666,True
978,1558568016174059521,2022-08-13 21:35:46+00:00,stokespatrick15,"I am not watching the Dolphins game tonight. 

I’ll watch it tomorrow morning when it’s on here.  #FinsUp",['FinsUp'],0,0,,"Coordinates(longitude=-74.6936749, latitude=40.455306)",watching dolphins game tonight watch tomorrow morning,0.0,-0.4,-0.4,False
979,1558567640804704256,2022-08-13 21:34:17+00:00,NWebcast,"Team: Miami #Dolphins vs Tampa Bay #Buccaneers
Start time: August 13, 2022, 19:30 ET
Live Stream: https://t.co/UDrX8vZGgv
Venue Name: Raymond James Stadium
Venue Address: Tampa, FL 33607, USA
Competition: Preaseason
Sport: #NFL https://t.co/A04DKYUKGt","['Dolphins', 'Buccaneers', 'NFL']",1,0,,,team miami vs tampa bay start time august 13 2022 19 30 et live stream venue name raymond james stadium venue address tampa fl 33607 usa competition preaseason sport,0.0,0.13636363636363635,0.13636363636363635,True
982,1558565412375339010,2022-08-13 21:25:25+00:00,Coachw513,"Pumped for #dolphins 

What am I watching?
1. Easy E/Sanders/others—-who can be a solid 4th/5th WR
2. Austin Jackson—enough said
3. Noah I and Trill W—are either capable 3rd corners
4. Any RB make a mark tonight

September 11 1 PM!!!!!!",['dolphins'],0,0,,,pumped watching 1 easy e sanders others solid 4th 5th wr 2 austin jackson enough said 3 noah trill w either capable 3rd corners 4 rb make mark tonight september 11 1 pm,0.7269,0.12666666666666665,0.8535666666666666,True
983,1558565278560165891,2022-08-13 21:24:53+00:00,DotSkipper,"Alright,get ready for another football season of vintage NFL Miami Dolphin cheerleader pics.  A tough one for this Tampa gal when the Dolphins play the Bucs. 
#FinsUp🐬💙🧡
#OnceaDolphinCheerleaderAlwaysaDolphinCheerleader1978
@dolphinscheer
@FinsOffTheField
@MiamiDolphins https://t.co/tRpl0PhVcZ","['FinsUp', 'OnceaDolphinCheerleaderAlwaysaDolphinCheerleader1978']",0,0,"[User(username='dolphinscheer', id=28590191, displayname='Miami Dolphins Cheer', description=None, rawDescription=None, descriptionUrls=None, verified=None, created=None, followersCount=None, friendsCount=None, statusesCount=None, favouritesCount=None, listedCount=None, mediaCount=None, location=None, protected=None, linkUrl=None, linkTcourl=None, profileImageUrl=None, profileBannerUrl=None, label=None), User(username='FinsOffTheField', id=24229692, displayname='Miami Dolphins Foundation & Community Relations', description=None, rawDescription=None, descriptionUrls=None, verified=None, created=None, followersCount=None, friendsCount=None, statusesCount=None, favouritesCount=None, listedCount=None, mediaCount=None, location=None, protected=None, linkUrl=None, linkTcourl=None, profileImageUrl=None, profileBannerUrl=None, label=None), User(username='MiamiDolphins', id=19853312, displayname='Miami Dolphins', description=None, rawDescription=None, descriptionUrls=None, verified=None, created=None, followersCount=None, friendsCount=None, statusesCount=None, favouritesCount=None, listedCount=None, mediaCount=None, location=None, protected=None, linkUrl=None, linkTcourl=None, profileImageUrl=None, profileBannerUrl=None, label=None)]","Coordinates(longitude=-82.5439892, latitude=28.033407)",alright get ready another football season vintage nfl miami dolphin cheerleader pics tough one tampa gal dolphins play bucs,0.743,-0.09444444444444444,0.6485555555555556,True
985,1558564094206246918,2022-08-13 21:20:11+00:00,CBS4Sports,Almost game time in Tampa. #FinsUp @MiamiDolphins vs the Tampa Bay Buccaneers on @CBSMiami starting at 7pm https://t.co/hJevwKtHpA,['FinsUp'],0,0,"[User(username='MiamiDolphins', id=19853312, displayname='Miami Dolphins', description=None, rawDescription=None, descriptionUrls=None, verified=None, created=None, followersCount=None, friendsCount=None, statusesCount=None, favouritesCount=None, listedCount=None, mediaCount=None, location=None, protected=None, linkUrl=None, linkTcourl=None, profileImageUrl=None, profileBannerUrl=None, label=None), User(username='CBSMiami', id=16334281, displayname='CBS4 Miami', description=None, rawDescription=None, descriptionUrls=None, verified=None, created=None, followersCount=None, friendsCount=None, statusesCount=None, favouritesCount=None, listedCount=None, mediaCount=None, location=None, protected=None, linkUrl=None, linkTcourl=None, profileImageUrl=None, profileBannerUrl=None, label=None)]",,almost game time tampa vs tampa bay buccaneers starting 7pm,0.0,-0.2,-0.2,False
986,1558563901104693249,2022-08-13 21:19:25+00:00,csciria,"@thomasmorstead You'll love the #Dolphins #throwbacks more than what you're wearing tonight. Right, @THROWBACKS4EVER ?","['Dolphins', 'throwbacks']",1,0,"[User(username='thomasmorstead', id=178574634, displayname='Thomas Morstead', description=None, rawDescription=None, descriptionUrls=None, verified=None, created=None, followersCount=None, friendsCount=None, statusesCount=None, favouritesCount=None, listedCount=None, mediaCount=None, location=None, protected=None, linkUrl=None, linkTcourl=None, profileImageUrl=None, profileBannerUrl=None, label=None), User(username='THROWBACKS4EVER', id=1224951180939448320, displayname='MAKE THROWBACKS PERMANENT🐬', description=None, rawDescription=None, descriptionUrls=None, verified=None, created=None, followersCount=None, friendsCount=None, statusesCount=None, favouritesCount=None, listedCount=None, mediaCount=None, location=None, protected=None, linkUrl=None, linkTcourl=None, profileImageUrl=None, profileBannerUrl=None, label=None)]",,youll love youre wearing tonight right,0.6369,0.39285714285714285,1.0297571428571428,True
988,1558561214480908292,2022-08-13 21:08:44+00:00,KeastScott,"@JoyElizabeth05 Winnipeg, Manitoba, Canada 🇨🇦. Born in 77, started young and don’t remember not being a Dolphins fan. Always and forever.

#FinsUp https://t.co/k0BIbu9KE8",['FinsUp'],4,0,"[User(username='JoyElizabeth05', id=1267556474378739712, displayname='finfanfromorchardpark🐬❤️', description=None, rawDescription=None, descriptionUrls=None, verified=None, created=None, followersCount=None, friendsCount=None, statusesCount=None, favouritesCount=None, listedCount=None, mediaCount=None, location=None, protected=None, linkUrl=None, linkTcourl=None, profileImageUrl=None, profileBannerUrl=None, label=None)]",,winnipeg manitoba canada born 77 started young remember dolphins fan always forever,0.3182,0.1,0.4182,True
989,1558560297585090566,2022-08-13 21:05:06+00:00,BobbyFinsTalk,Hey #MiamiDolphins fans! Catch a new episode of OverTime on the @FinsTalkNetwork (Monday-8pm) with @BretLaGasse67 &amp; myself as we discuss the results of game 1 of the #Dolphins preseason &amp; welcome @JPFscout as our guest this week! https://t.co/oqXezGXvNm #FinsUp #DolphinsPodcast https://t.co/VYIoCnwKRx,"['MiamiDolphins', 'Dolphins', 'FinsUp', 'DolphinsPodcast']",5,5,"[User(username='FinsTalkNetwork', id=1384282002858266629, displayname='Fins Talk Sports Network', description=None, rawDescription=None, descriptionUrls=None, verified=None, created=None, followersCount=None, friendsCount=None, statusesCount=None, favouritesCount=None, listedCount=None, mediaCount=None, location=None, protected=None, linkUrl=None, linkTcourl=None, profileImageUrl=None, profileBannerUrl=None, label=None), User(username='BretLaGasse67', id=190108173, displayname='Bret LaGasse', description=None, rawDescription=None, descriptionUrls=None, verified=None, created=None, followersCount=None, friendsCount=None, statusesCount=None, favouritesCount=None, listedCount=None, mediaCount=None, location=None, protected=None, linkUrl=None, linkTcourl=None, profileImageUrl=None, profileBannerUrl=None, label=None), User(username='JPFscout', id=2810115510, displayname='DIGGING “N”THE TRENCHES', description=None, rawDescription=None, descriptionUrls=None, verified=None, created=None, followersCount=None, friendsCount=None, statusesCount=None, favouritesCount=None, listedCount=None, mediaCount=None, location=None, protected=None, linkUrl=None, linkTcourl=None, profileImageUrl=None, profileBannerUrl=None, label=None)]",,hey fans catch new episode overtime monday 8pm amp discuss results game 1 preseason amp welcome guest week,0.4588,0.1787878787878788,0.6375878787878788,True
990,1558560236537106434,2022-08-13 21:04:51+00:00,DadOfTwo1988,"Watching Inter live and then Dolphins on the game pass tomorrow
 No spoilers please FinNation haha #InterMiamiCF #FinsUp","['InterMiamiCF', 'FinsUp']",1,0,,,watching inter live dolphins game pass tomorrow spoilers please finnation haha,0.6486,-0.02121212121212122,0.6273878787878787,True
991,1558560172074831872,2022-08-13 21:04:36+00:00,TheMozKnowz,"Tyreek Hill, everybody! Ready to see tua #10 on in aqua &amp; orange! @cheetah  #Dolphins #findup #NFLPreseason #nfl @wsvn @DrewJRosenhaus https://t.co/yIYiq2nj4Q","['Dolphins', 'findup', 'NFLPreseason', 'nfl']",341,43,"[User(username='cheetah', id=83738272, displayname='Ty Hill', description=None, rawDescription=None, descriptionUrls=None, verified=None, created=None, followersCount=None, friendsCount=None, statusesCount=None, favouritesCount=None, listedCount=None, mediaCount=None, location=None, protected=None, linkUrl=None, linkTcourl=None, profileImageUrl=None, profileBannerUrl=None, label=None), User(username='wsvn', id=16331756, displayname='WSVN 7 News', description=None, rawDescription=None, descriptionUrls=None, verified=None, created=None, followersCount=None, friendsCount=None, statusesCount=None, favouritesCount=None, listedCount=None, mediaCount=None, location=None, protected=None, linkUrl=None, linkTcourl=None, profileImageUrl=None, profileBannerUrl=None, label=None), User(username='DrewJRosenhaus', id=36137344, displayname='Drew Rosenhaus', description=None, rawDescription=None, descriptionUrls=None, verified=None, created=None, followersCount=None, friendsCount=None, statusesCount=None, favouritesCount=None, listedCount=None, mediaCount=None, location=None, protected=None, linkUrl=None, linkTcourl=None, profileImageUrl=None, profileBannerUrl=None, label=None)]","Coordinates(longitude=-82.50335454940796, latitude=27.975831767381656)",tyreek hill everybody ready see tua aqua amp orange,0.3612,0.2,0.5612,True
992,1558560067321995269,2022-08-13 21:04:11+00:00,UKfinfan,@MiamiDolphins @RJStadium @getgrover Let’s gooooo #finsup  Skylar Thompson ready to be QB2,['finsup'],3,0,"[User(username='MiamiDolphins', id=19853312, displayname='Miami Dolphins', description=None, rawDescription=None, descriptionUrls=None, verified=None, created=None, followersCount=None, friendsCount=None, statusesCount=None, favouritesCount=None, listedCount=None, mediaCount=None, location=None, protected=None, linkUrl=None, linkTcourl=None, profileImageUrl=None, profileBannerUrl=None, label=None), User(username='RJStadium', id=69000383, displayname='RaymondJames Stadium', description=None, rawDescription=None, descriptionUrls=None, verified=None, created=None, followersCount=None, friendsCount=None, statusesCount=None, favouritesCount=None, listedCount=None, mediaCount=None, location=None, protected=None, linkUrl=None, linkTcourl=None, profileImageUrl=None, profileBannerUrl=None, label=None), User(username='getgrover', id=3091080442, displayname='Grover', description=None, rawDescription=None, descriptionUrls=None, verified=None, created=None, followersCount=None, friendsCount=None, statusesCount=None, favouritesCount=None, listedCount=None, mediaCount=None, location=None, protected=None, linkUrl=None, linkTcourl=None, profileImageUrl=None, profileBannerUrl=None, label=None)]",,let gooooo skylar thompson ready qb2,0.3612,0.2,0.5612,True
993,1558560066516688897,2022-08-13 21:04:11+00:00,DOLFANMIKE2,"New Miami Dolphins Fight Song!
#Finsup #MiamiDolphins 
https://t.co/R56sOxRvUD","['Finsup', 'MiamiDolphins']",0,0,,,new miami dolphins fight song,-0.3818,0.13636363636363635,-0.24543636363636362,False
994,1558560048124674050,2022-08-13 21:04:06+00:00,thomasmorstead,"Our next opportunity as a team has arrived. I’m excited for all my team mates who are getting their first chance to play in an NFL game. Watching young people pursue a dream with everything fiber of their being is inspiring. God bless everyone with good health!
#Dolphins #FinsUp https://t.co/tRUgc9GY6u","['Dolphins', 'FinsUp']",706,44,,,next opportunity team arrived excited team mates getting first chance play nfl game watching young people pursue dream everything fiber inspiring god bless everyone good health,0.9595,0.21785714285714283,1.1773571428571428,True
995,1558559145615400960,2022-08-13 21:00:31+00:00,Zakstaylor,Getting my nap in before I make my appearance tonight at @ian693  @MiamiDolphins watch party!  I love pets  and beer….. make sure you say hi!     See you soon #BUTCHER.       #FinsUp https://t.co/1i6TGXVUOq,"['BUTCHER', 'FinsUp']",12,0,"[User(username='ian693', id=239085537, displayname='Big E', description=None, rawDescription=None, descriptionUrls=None, verified=None, created=None, followersCount=None, friendsCount=None, statusesCount=None, favouritesCount=None, listedCount=None, mediaCount=None, location=None, protected=None, linkUrl=None, linkTcourl=None, profileImageUrl=None, profileBannerUrl=None, label=None), User(username='MiamiDolphins', id=19853312, displayname='Miami Dolphins', description=None, rawDescription=None, descriptionUrls=None, verified=None, created=None, followersCount=None, friendsCount=None, statusesCount=None, favouritesCount=None, listedCount=None, mediaCount=None, location=None, protected=None, linkUrl=None, linkTcourl=None, profileImageUrl=None, profileBannerUrl=None, label=None)]",,getting nap make appearance tonight watch party love pets beer make sure say hi see soon,0.8481,0.5,1.3481,True
996,1558559080830189568,2022-08-13 21:00:16+00:00,KingTeej1,Dolphins kinda play football tonight #FinsUp,['FinsUp'],0,0,,,dolphins kinda play football tonight,0.2748,0.0,0.2748,True
997,1558558473905995781,2022-08-13 20:57:51+00:00,DannyDripMarino,"No NFL fans reached out to me when Tua broke his ribs last year. All 31 other fans are the scum of the earth. No shock. Go #Dolphins

(Did I do this right?) https://t.co/r93kIUJZu5",['Dolphins'],4,1,,,nfl fans reached tua broke ribs last year 31 fans scum earth shock go right,-0.6124,-0.004761904761904763,-0.6171619047619048,False
998,1558558354691194880,2022-08-13 20:57:23+00:00,The_RogueDarth,Any one know where I can stream the Dolphins pre season game tonight?? #FinsUp,['FinsUp'],0,0,,,one know stream dolphins pre season game tonight,0.0,-0.4,-0.4,False
999,1558558169495904262,2022-08-13 20:56:38+00:00,TheMozKnowz,Cedrick Wilson Jr. is set to make his #Dolphins #NFLPreseason debut coming over from the #Cowboys. He’s just taking it all in roughly 2.5 hours before kickoff. #FinsUp @wsvn #NFLTwitter #nfl #Tampa @cedwilson95 @DolphinsTalk https://t.co/lJGoMRyWuv,"['Dolphins', 'NFLPreseason', 'Cowboys', 'FinsUp', 'NFLTwitter', 'nfl', 'Tampa']",134,21,"[User(username='wsvn', id=16331756, displayname='WSVN 7 News', description=None, rawDescription=None, descriptionUrls=None, verified=None, created=None, followersCount=None, friendsCount=None, statusesCount=None, favouritesCount=None, listedCount=None, mediaCount=None, location=None, protected=None, linkUrl=None, linkTcourl=None, profileImageUrl=None, profileBannerUrl=None, label=None), User(username='cedwilson95', id=423975421, displayname='Cedrick Wilson Jr', description=None, rawDescription=None, descriptionUrls=None, verified=None, created=None, followersCount=None, friendsCount=None, statusesCount=None, favouritesCount=None, listedCount=None, mediaCount=None, location=None, protected=None, linkUrl=None, linkTcourl=None, profileImageUrl=None, profileBannerUrl=None, label=None), User(username='DolphinsTalk', id=358860802, displayname='DolphinsTalk.com', description=None, rawDescription=None, descriptionUrls=None, verified=None, created=None, followersCount=None, friendsCount=None, statusesCount=None, favouritesCount=None, listedCount=None, mediaCount=None, location=None, protected=None, linkUrl=None, linkTcourl=None, profileImageUrl=None, profileBannerUrl=None, label=None)]","Coordinates(longitude=-82.50335454940796, latitude=27.975831767381656)",cedrick wilson jr set make debut coming taking roughly 2 5 hours kickoff,0.0,-0.1,-0.1,False
1000,1558557500433211403,2022-08-13 20:53:59+00:00,Birchall_87,Looking forward the first pre season game for the dolphins in a bit!!! No injuries please!! #FinsUp https://t.co/KuDoO4tVvo,['FinsUp'],1,0,,,looking forward first pre season game dolphins bit injuries please,0.3182,-0.07500000000000001,0.24319999999999997,True
1002,1558556691922296833,2022-08-13 20:50:46+00:00,FinsTalkNetwork,It’s GAMEDAY #MiamiDolphins fans! Check your pulse and watch our Pre-Game show on Fins Talk Today as @BobbyFinsTalk &amp; @Phins2winn preview the #Dolphins vs. #TampaBayBuccaneers!  Watch - https://t.co/sfxE5w71Kx #DolphinsFans #DolphinsPodcast #FinsUp #NFLPreseason #NFLTwitter https://t.co/OcOVOFb0JJ,"['MiamiDolphins', 'Dolphins', 'TampaBayBuccaneers', 'DolphinsFans', 'DolphinsPodcast', 'FinsUp', 'NFLPreseason', 'NFLTwitter']",2,1,"[User(username='BobbyFinsTalk', id=51859200, displayname='Bobby Melendez', description=None, rawDescription=None, descriptionUrls=None, verified=None, created=None, followersCount=None, friendsCount=None, statusesCount=None, favouritesCount=None, listedCount=None, mediaCount=None, location=None, protected=None, linkUrl=None, linkTcourl=None, profileImageUrl=None, profileBannerUrl=None, label=None), User(username='Phins2winn', id=1367642729295974400, displayname='“Fish Tank” Hank', description=None, rawDescription=None, descriptionUrls=None, verified=None, created=None, followersCount=None, friendsCount=None, statusesCount=None, favouritesCount=None, listedCount=None, mediaCount=None, location=None, protected=None, linkUrl=None, linkTcourl=None, profileImageUrl=None, profileBannerUrl=None, label=None)]",,gameday fans check pulse watch pre game show fins talk today amp preview vs watch,0.0,-0.4,-0.4,False
1005,1558554784554258434,2022-08-13 20:43:11+00:00,kingdbtrev,"Announcement: 
I will be hosting evening spaces. Three times a week will be Miami dolphins Chill Spaces. The other spaces will be Sex related because I LOVE sexual discourse. Anyways, there won't be Hella mutes and the point of my spaces? Is too let ppl be themselves. #FinsUp",['FinsUp'],6,1,,,announcement hosting evening spaces three times week miami dolphins chill spaces spaces sex related love sexual discourse anyways wont hella mutes point spaces let ppl,0.6369,0.3333333333333333,0.9702333333333333,True
1006,1558554677502824448,2022-08-13 20:42:46+00:00,ajp_sa,"A submission to SA Parliament on the protection of #dolphins in the Port River is now open

Importantly, they need to stop dredging, which removes favourite fishing spots &amp; stirs up old pollution!

Pictured is Hope, who recently died  due to aforementioned
https://t.co/j1EYCGbrAE https://t.co/v0ljWpIWxb",['dolphins'],1,1,,,submission sa parliament protection port river open importantly need stop dredging removes favourite fishing spots amp stirs old pollution pictured hope recently died due aforementioned,-0.1531,0.0625,-0.09060000000000001,False
1008,1558553518239322113,2022-08-13 20:38:09+00:00,WPBF_Yianni,"Dolphins and Bucs kickoff tonight here at Raymond James in Tampa

LIVE coverage begins 5p @WPBF25News #finsup https://t.co/B2zOVCcCuE",['finsup'],9,3,"[User(username='WPBF25News', id=22214972, displayname='WPBF 25 News', description=None, rawDescription=None, descriptionUrls=None, verified=None, created=None, followersCount=None, friendsCount=None, statusesCount=None, favouritesCount=None, listedCount=None, mediaCount=None, location=None, protected=None, linkUrl=None, linkTcourl=None, profileImageUrl=None, profileBannerUrl=None, label=None)]",,dolphins bucs kickoff tonight raymond james tampa live coverage begins 5p,0.0,0.13636363636363635,0.13636363636363635,True
1009,1558553231441141760,2022-08-13 20:37:01+00:00,SimkoKim,"Almost game time.  Let's gooooooo
@MiamiDolphins 
#FinsUp https://t.co/mQqnYyQXMd",['FinsUp'],4,0,"[User(username='MiamiDolphins', id=19853312, displayname='Miami Dolphins', description=None, rawDescription=None, descriptionUrls=None, verified=None, created=None, followersCount=None, friendsCount=None, statusesCount=None, favouritesCount=None, listedCount=None, mediaCount=None, location=None, protected=None, linkUrl=None, linkTcourl=None, profileImageUrl=None, profileBannerUrl=None, label=None)]","Coordinates(longitude=-82.620093, latitude=27.821353)",almost game time lets gooooooo,0.0,-0.4,-0.4,False
