,ID,Date,User,Tweet,HashTags,Likes,Retweets,MentionUsers,LocationCoordinates,clean_Tweet,NLTK_Sentiment_Analysis,TextBlob_Sentiment_Analysis,Compound_Sentiment_Score,Positive_Sentiment
0,1558966080080646145,2022-08-14 23:57:32+00:00,SSMiamiDolphins,#Dolphins exploring secondary options after Trill Williams’ season-ending knee injury #NFL https://t.co/Ttf4uZiKTZ https://t.co/LhtbW26Y1n,"['Dolphins', 'NFL']",2,1,,,exploring secondary options trill williams season ending knee injury,-0.4215,-0.3,-0.7215,False
2,1558962772989427712,2022-08-14 23:44:23+00:00,PersonaSpeaks,@upchuckgaming @stlcty03 @DC_gaming5 @FoxinAround — You gon let em talk trash about yo Dolphins 🐬 &amp; Tua like that?  👀👀 let em know! —&gt;#FinsUp,['FinsUp'],5,0,"[User(username='upchuckgaming', id=3195565122, displayname='POB Boyz', description=None, rawDescription=None, descriptionUrls=None, verified=None, created=None, followersCount=None, friendsCount=None, statusesCount=None, favouritesCount=None, listedCount=None, mediaCount=None, location=None, protected=None, linkUrl=None, linkTcourl=None, profileImageUrl=None, profileBannerUrl=None, label=None), User(username='stlcty03', id=41376727, displayname='Strictly Gaming', description=None, rawDescription=None, descriptionUrls=None, verified=None, created=None, followersCount=None, friendsCount=None, statusesCount=None, favouritesCount=None, listedCount=None, mediaCount=None, location=None, protected=None, linkUrl=None, linkTcourl=None, profileImageUrl=None, profileBannerUrl=None, label=None), User(username='DC_gaming5', id=574980988, displayname='DC Gaming - 🔥SSG🔥', description=None, rawDescription=None, descriptionUrls=None, verified=None, created=None, followersCount=None, friendsCount=None, statusesCount=None, favouritesCount=None, listedCount=None, mediaCount=None, location=None, protected=None, linkUrl=None, linkTcourl=None, profileImageUrl=None, profileBannerUrl=None, label=None), User(username='FoxinAround', id=22322071, displayname='Austin B. Fox', description=None, rawDescription=None, descriptionUrls=None, verified=None, created=None, followersCount=None, friendsCount=None, statusesCount=None, favouritesCount=None, listedCount=None, mediaCount=None, location=None, protected=None, linkUrl=None, linkTcourl=None, profileImageUrl=None, profileBannerUrl=None, label=None)]",,gon let em talk trash yo dolphins amp tua like let em know gt,0.5574,0.0,0.5574,True
3,1558962449956704260,2022-08-14 23:43:06+00:00,GoatHouseNFL,"#Dolphins 7th Round Rookie Skylar Thompson took the full load in last night’s preseason game and went 20/28 218 yards and got the win. Pretty solid. Extremely rare a QB is asked to play an entire preseason game, let alone a rookie QB.",['Dolphins'],91,8,,,7th round rookie skylar thompson took full load last night preseason game went 20 28 218 yards got win pretty solid extremely rare qb asked play entire preseason game let alone rookie qb,0.8402,0.07,0.9101999999999999,True
4,1558960960710365184,2022-08-14 23:37:11+00:00,footballtoday00,"Dolphins CB Williams tore ACL in preseason game
#Dolphins #FinsUp #NFLPresesaon #NFLTrainingCamp

https://t.co/ONYhGiYu8l","['Dolphins', 'FinsUp', 'NFLPresesaon', 'NFLTrainingCamp']",0,0,,,dolphins cb williams tore acl preseason game,0.0,-0.4,-0.4,False
5,1558960161003376642,2022-08-14 23:34:01+00:00,DolphinsViews,Miami Dolphins release names of players “not likely to play” in TB #DolphinsFootball #FinsUP #FinsNation #GoPhins #PhinsUp #GoFins https://t.co/NCCKHKLUe7,"['DolphinsFootball', 'FinsUP', 'FinsNation', 'GoPhins', 'PhinsUp', 'GoFins']",0,0,,,miami dolphins release names players likely play tb,0.34,0.0,0.34,True
6,1558959696156950529,2022-08-14 23:32:10+00:00,ByDLFernandez,"5 Takeaways from Dolphins Preseason Win vs Bucs 
#FinsUp  @3YardsPerCarry @5ReasonsSports 
Brought to you by: @PrizePicks 

https://t.co/yqSOtVKnGp",['FinsUp'],16,9,"[User(username='3YardsPerCarry', id=989208342445936641, displayname='Three Yards Per Carry', description=None, rawDescription=None, descriptionUrls=None, verified=None, created=None, followersCount=None, friendsCount=None, statusesCount=None, favouritesCount=None, listedCount=None, mediaCount=None, location=None, protected=None, linkUrl=None, linkTcourl=None, profileImageUrl=None, profileBannerUrl=None, label=None), User(username='5ReasonsSports', id=975153526367277056, displayname='Five Reasons Sports', description=None, rawDescription=None, descriptionUrls=None, verified=None, created=None, followersCount=None, friendsCount=None, statusesCount=None, favouritesCount=None, listedCount=None, mediaCount=None, location=None, protected=None, linkUrl=None, linkTcourl=None, profileImageUrl=None, profileBannerUrl=None, label=None), User(username='PrizePicks', id=539317130, displayname='PrizePicks', description=None, rawDescription=None, descriptionUrls=None, verified=None, created=None, followersCount=None, friendsCount=None, statusesCount=None, favouritesCount=None, listedCount=None, mediaCount=None, location=None, protected=None, linkUrl=None, linkTcourl=None, profileImageUrl=None, profileBannerUrl=None, label=None)]",,5 takeaways dolphins preseason win vs bucs brought,0.5859,0.8,1.3859,True
7,1558959597628661760,2022-08-14 23:31:46+00:00,emeral2001,Just a quick photo dump from the dolphin game from last night! Thanks @richeast10 for the tickets and thank you @cdub3511 for going with! #finsup @ Raymond James Stadium https://t.co/PCZJfD5Ore,['finsup'],0,0,"[User(username='RichEast10', id=944931895, displayname='Rich Easterlin', description=None, rawDescription=None, descriptionUrls=None, verified=None, created=None, followersCount=None, friendsCount=None, statusesCount=None, favouritesCount=None, listedCount=None, mediaCount=None, location=None, protected=None, linkUrl=None, linkTcourl=None, profileImageUrl=None, profileBannerUrl=None, label=None), User(username='cdub3511', id=143267486, displayname='Chris Ward', description=None, rawDescription=None, descriptionUrls=None, verified=None, created=None, followersCount=None, friendsCount=None, statusesCount=None, favouritesCount=None, listedCount=None, mediaCount=None, location=None, protected=None, linkUrl=None, linkTcourl=None, profileImageUrl=None, profileBannerUrl=None, label=None)]","Coordinates(longitude=-82.50439051, latitude=27.97618063)",quick photo dump dolphin game last night thanks tickets thank going raymond james stadium,0.4215,0.033333333333333326,0.4548333333333333,True
11,1558956149134835712,2022-08-14 23:18:04+00:00,SeriusBall,"@JesseKage @MiamiDolphins ...I may steal that hat, giving warning. #FinsUp",['FinsUp'],0,0,"[User(username='JesseKage', id=23443433, displayname='Greg “Jesse Kage” Jamason', description=None, rawDescription=None, descriptionUrls=None, verified=None, created=None, followersCount=None, friendsCount=None, statusesCount=None, favouritesCount=None, listedCount=None, mediaCount=None, location=None, protected=None, linkUrl=None, linkTcourl=None, profileImageUrl=None, profileBannerUrl=None, label=None), User(username='MiamiDolphins', id=19853312, displayname='Miami Dolphins', description=None, rawDescription=None, descriptionUrls=None, verified=None, created=None, followersCount=None, friendsCount=None, statusesCount=None, favouritesCount=None, listedCount=None, mediaCount=None, location=None, protected=None, linkUrl=None, linkTcourl=None, profileImageUrl=None, profileBannerUrl=None, label=None)]",,may steal hat giving warning,-0.4939,0.0,-0.4939,False
13,1558952381018152960,2022-08-14 23:03:06+00:00,magicrat13,@Trewilliams Wishing a speedy recovery for your son.  Once a Dolphin always a Dolphin #FinsUp,['FinsUp'],0,0,"[User(username='Trewilliams', id=33990589, displayname='Tre Williams', description=None, rawDescription=None, descriptionUrls=None, verified=None, created=None, followersCount=None, friendsCount=None, statusesCount=None, favouritesCount=None, listedCount=None, mediaCount=None, location=None, protected=None, linkUrl=None, linkTcourl=None, profileImageUrl=None, profileBannerUrl=None, label=None)]",,wishing speedy recovery son dolphin always dolphin,0.2263,0.0,0.2263,True
14,1558951971222011904,2022-08-14 23:01:28+00:00,DrGridiron_MD,"Every year #Dolphins fans get too excited or too down over preseason games. You guys are incapable of holding your water, you want to jump to conclusions over one preseason game like that’s telling you anything. Players that won’t be on NFL rosters are playing, settle down. https://t.co/vYyM7OUCAr",['Dolphins'],1,0,,,every year fans get excited preseason games guys incapable holding water want jump conclusions one preseason game like telling anything players nfl rosters playing settle,0.5267,-0.012500000000000011,0.5142,True
15,1558951895091249159,2022-08-14 23:01:10+00:00,DolphinsViews,Bucs vs. Dolphins: Who won’t be playing in preseason opener? #MiamiDolphins #Dolphins #Miami #FinsUP #yahoo https://t.co/EmgyEI0xfS,"['MiamiDolphins', 'Dolphins', 'Miami', 'FinsUP', 'yahoo']",0,0,,,bucs vs dolphins playing preseason opener,0.2023,0.0,0.2023,True
16,1558950133739298816,2022-08-14 22:54:10+00:00,DOLFANMIKE2,"DOLPHIN NATION! Great start to 2022.
#Finsup #MiamiDolphins https://t.co/QYhA4GYdpi","['Finsup', 'MiamiDolphins']",0,0,,,dolphin nation great start 2022,0.6249,0.8,1.4249,True
17,1558949503167631362,2022-08-14 22:51:40+00:00,Cash1Swanson,"#Dolphins CB Trill Williams will miss the entire 2022 season, after suffering a torn ACL.",['Dolphins'],1,0,,,cb trill williams miss entire 2022 season suffering torn acl,-0.6908,0.0,-0.6908,False
21,1558947601994715137,2022-08-14 22:44:06+00:00,AmateurHRPod,"Ep. 73 is here!

The AH Boiz switch to a new topic for this week's episode: #Golf ⛳!

We also continue to rant about the reeling #RedSox post-trade-deadline, talk #TopGun &amp; speculate about some interesting NFL tampering penalties for the #Dolphins 🐬🧐.

https://t.co/yVH1makxPn","['Golf', 'RedSox', 'TopGun', 'Dolphins']",0,0,,,ep 73 ah boiz switch new topic weeks episode also continue rant reeling post trade deadline talk amp speculate interesting nfl tampering penalties,0.0772,0.3181818181818182,0.39538181818181817,True
22,1558946536440188928,2022-08-14 22:39:52+00:00,NicholasMullick,"The Miami Dolphins have a ton of depth at wide receiver and there have been some mentioned in trade talks. Preston Williams is one of them. Check out my article @Blitzalytics where I go through destinations Williams could get traded to.
#FinsUp #NFLTwitter https://t.co/IAxAxUaWCB","['FinsUp', 'NFLTwitter']",0,0,"[User(username='Blitzalytics', id=922978452411596801, displayname='BLITZALYTICS', description=None, rawDescription=None, descriptionUrls=None, verified=None, created=None, followersCount=None, friendsCount=None, statusesCount=None, favouritesCount=None, listedCount=None, mediaCount=None, location=None, protected=None, linkUrl=None, linkTcourl=None, profileImageUrl=None, profileBannerUrl=None, label=None)]",,miami dolphins ton depth wide receiver mentioned trade talks preston williams one check article go destinations williams could get traded,0.0,-0.1,-0.1,False
24,1558943984499703810,2022-08-14 22:29:44+00:00,Finsup0422,Imagine being a “true” Miami Dolphins fan and nothing the team or a player does is good enough? SMH couldn’t ever be me. #FinsUp #PositiveVibes,"['FinsUp', 'PositiveVibes']",31,5,,,imagine true miami dolphins fan nothing team player good enough smh ever,0.1012,0.3499999999999999,0.45119999999999993,True
27,1558941573496201216,2022-08-14 22:20:09+00:00,gbr_mx,"@BaldyNFL @MiamiDolphins Beautiful designed plays, if Mike McDaniel made Skylar  Thompson look like this, how will #Tua look? 😏 #FinsUp https://t.co/SWMKkVs3nh","['Tua', 'FinsUp']",11,0,"[User(username='BaldyNFL', id=2957214987, displayname='Brian Baldinger', description=None, rawDescription=None, descriptionUrls=None, verified=None, created=None, followersCount=None, friendsCount=None, statusesCount=None, favouritesCount=None, listedCount=None, mediaCount=None, location=None, protected=None, linkUrl=None, linkTcourl=None, profileImageUrl=None, profileBannerUrl=None, label=None), User(username='MiamiDolphins', id=19853312, displayname='Miami Dolphins', description=None, rawDescription=None, descriptionUrls=None, verified=None, created=None, followersCount=None, friendsCount=None, statusesCount=None, favouritesCount=None, listedCount=None, mediaCount=None, location=None, protected=None, linkUrl=None, linkTcourl=None, profileImageUrl=None, profileBannerUrl=None, label=None)]",,beautiful designed plays mike mcdaniel made skylar thompson look like look,0.8126,0.85,1.6625999999999999,True
28,1558940784606564353,2022-08-14 22:17:01+00:00,DolphinsViews,[Miami Dolphins] The following players are not expected to play in this evening’s game against Tampa Bay. #DolphinsReddit #FinsForum #FinsUP #FinsNation #GoPhins #PhinsUp #GoFins https://t.co/TTgMSB9bqq,"['DolphinsReddit', 'FinsForum', 'FinsUP', 'FinsNation', 'GoPhins', 'PhinsUp', 'GoFins']",0,0,,,following players expected play evening game tampa bay,0.34,-0.16666666666666666,0.17333333333333337,True
29,1558940306900488196,2022-08-14 22:15:07+00:00,radiohead68,@finscentral Good thing Grier drafted Noah... I'm an idiot I wanted Jonathan Taylor #Dolphins #MiamiDolphins,"['Dolphins', 'MiamiDolphins']",0,0,"[User(username='finscentral', id=2727439079, displayname='Finscentral', description=None, rawDescription=None, descriptionUrls=None, verified=None, created=None, followersCount=None, friendsCount=None, statusesCount=None, favouritesCount=None, listedCount=None, mediaCount=None, location=None, protected=None, linkUrl=None, linkTcourl=None, profileImageUrl=None, profileBannerUrl=None, label=None)]",,good thing grier drafted noah im idiot wanted jonathan taylor,-0.1027,-0.050000000000000044,-0.15270000000000006,False
30,1558940025601114113,2022-08-14 22:14:00+00:00,BigOShow,"Big O; QB Skylar Thompson’s performance vs #Bucs in #NFLPreseason creates good and tough problems for #Miami. https://t.co/uun5b58Edc via @YouTube

🐬 #FinsUp 🐬 #FinsLoyalty 🐬 #MiamiDolphins 🐬 #NFLTrainingCamp 🐬 #NFL 🐬 #NFLTwitter 🐬 #NFLNews 🐬 #Dolphins 🐬 #TUA 🐬 https://t.co/f7rca5RQY1","['Bucs', 'NFLPreseason', 'Miami', 'FinsUp', 'FinsLoyalty', 'MiamiDolphins', 'NFLTrainingCamp', 'NFL', 'NFLTwitter', 'NFLNews', 'Dolphins', 'TUA']",4,0,"[User(username='YouTube', id=10228272, displayname='YouTube', description=None, rawDescription=None, descriptionUrls=None, verified=None, created=None, followersCount=None, friendsCount=None, statusesCount=None, favouritesCount=None, listedCount=None, mediaCount=None, location=None, protected=None, linkUrl=None, linkTcourl=None, profileImageUrl=None, profileBannerUrl=None, label=None)]",,big qb skylar thompson performance vs creates good tough problems via,0.2023,0.10370370370370369,0.30600370370370367,True
32,1558938041141657600,2022-08-14 22:06:07+00:00,Rosie_Folks,#MiamiDolphins #Win #PreSeason2022 #Dolphins #MikeMcDaniel  #magical #coach! My dream coach! @cwilkins42 Love ur playful energy man! Looks like everyone's having #Fun again!#FinsUp #Synergy #DolphinsFans #Miami    #swfl #Florida #NFL #Football #TikTok https://t.co/A2OlO2c06m,"['MiamiDolphins', 'Win', 'PreSeason2022', 'Dolphins', 'MikeMcDaniel', 'magical', 'coach', 'Fun', 'FinsUp', 'Synergy', 'DolphinsFans', 'Miami', 'swfl', 'Florida', 'NFL', 'Football', 'TikTok']",1,0,"[User(username='cwilkins42', id=432829404, displayname='Christian Wilkins', description=None, rawDescription=None, descriptionUrls=None, verified=None, created=None, followersCount=None, friendsCount=None, statusesCount=None, favouritesCount=None, listedCount=None, mediaCount=None, location=None, protected=None, linkUrl=None, linkTcourl=None, profileImageUrl=None, profileBannerUrl=None, label=None)]",,dream coach love ur playful energy man looks like everyones,0.9136,0.5,1.4136,True
33,1558937164255207425,2022-08-14 22:02:38+00:00,Nandito74Pena,My two cents on Dolphins preseason game: Jason 💰Sanders is back 🙌🏽🙌🏽🙌🏽 We are going to the Super Bowl #FinsUp @MiamiDolphins,['FinsUp'],1,0,"[User(username='MiamiDolphins', id=19853312, displayname='Miami Dolphins', description=None, rawDescription=None, descriptionUrls=None, verified=None, created=None, followersCount=None, friendsCount=None, statusesCount=None, favouritesCount=None, listedCount=None, mediaCount=None, location=None, protected=None, linkUrl=None, linkTcourl=None, profileImageUrl=None, profileBannerUrl=None, label=None)]","Coordinates(longitude=-85.037178, latitude=34.7016111)",two cents dolphins preseason game jason sanders back going super bowl,0.5994,-0.022222222222222237,0.5771777777777778,True
37,1558933069876400135,2022-08-14 21:46:22+00:00,Klutzkraft,"dolphins now stuck looking for a depth cb on par with trill, god knows where they'll find it #FinsUp",['FinsUp'],0,0,,,dolphins stuck looking depth cb par trill god knows theyll find,0.0258,0.0,0.0258,True
38,1558932927798513664,2022-08-14 21:45:48+00:00,JoeyJetsNYJ,"About to re watch all division games and the #Jets game 

#Bills #Patriots #Dolphins 

Seeing how I’m smarter then all twitter Doctors…. I’ll be giving a detailed breakdown of everything 

😂","['Jets', 'Bills', 'Patriots', 'Dolphins']",1,0,,,watch division games game seeing smarter twitter doctors giving detailed breakdown everything,0.6597,0.0,0.6597,True
39,1558932479968481282,2022-08-14 21:44:01+00:00,DolphinsViews,Miami Dolphins @ Tampa Bay Buccaneers Preseason Game-Week 1: Live Game Thread &amp; Game Information #DolphinsFootball #FinsUP #FinsNation #GoPhins #PhinsUp #GoFins https://t.co/KMuvY1OeCG,"['DolphinsFootball', 'FinsUP', 'FinsNation', 'GoPhins', 'PhinsUp', 'GoFins']",0,0,,,miami dolphins tampa bay buccaneers preseason game week 1 live game thread amp game information,0.0,-0.26590909090909093,-0.26590909090909093,False
40,1558932147590680576,2022-08-14 21:42:42+00:00,javierquevedo,"@BaldyNFL @OmarKelly @MiamiDolphins Miami Sound Machine. I like that Brian anda thank You for your work, I enjoy ir a lot, specially when you disect @MiamiDolphins tape. Keep the good work. #FinsUp",['FinsUp'],1,0,"[User(username='BaldyNFL', id=2957214987, displayname='Brian Baldinger', description=None, rawDescription=None, descriptionUrls=None, verified=None, created=None, followersCount=None, friendsCount=None, statusesCount=None, favouritesCount=None, listedCount=None, mediaCount=None, location=None, protected=None, linkUrl=None, linkTcourl=None, profileImageUrl=None, profileBannerUrl=None, label=None), User(username='OmarKelly', id=26035722, displayname='Omar Kelly', description=None, rawDescription=None, descriptionUrls=None, verified=None, created=None, followersCount=None, friendsCount=None, statusesCount=None, favouritesCount=None, listedCount=None, mediaCount=None, location=None, protected=None, linkUrl=None, linkTcourl=None, profileImageUrl=None, profileBannerUrl=None, label=None), User(username='MiamiDolphins', id=19853312, displayname='Miami Dolphins', description=None, rawDescription=None, descriptionUrls=None, verified=None, created=None, followersCount=None, friendsCount=None, statusesCount=None, favouritesCount=None, listedCount=None, mediaCount=None, location=None, protected=None, linkUrl=None, linkTcourl=None, profileImageUrl=None, profileBannerUrl=None, label=None), User(username='MiamiDolphins', id=19853312, displayname='Miami Dolphins', description=None, rawDescription=None, descriptionUrls=None, verified=None, created=None, followersCount=None, friendsCount=None, statusesCount=None, favouritesCount=None, listedCount=None, mediaCount=None, location=None, protected=None, linkUrl=None, linkTcourl=None, profileImageUrl=None, profileBannerUrl=None, label=None)]",,miami sound machine like brian anda thank work enjoy ir lot specially disect tape keep good work,0.8779,0.4642857142857143,1.3421857142857143,True
41,1558932107988189186,2022-08-14 21:42:32+00:00,OmarKelly,#Dolphins exploring secondary options after Trill Williams’ season-ending knee injury https://t.co/ZPPUqq9wsG,['Dolphins'],21,2,,,exploring secondary options trill williams season ending knee injury,-0.4215,-0.3,-0.7215,False
43,1558931336408309762,2022-08-14 21:39:28+00:00,tonyriggi,"@Trewilliams I'm so confident that there are big things ahead for your son as a Dolphin. As coach McDaniel said last night, this is nothing more than a setback. We all appreciate having your family as part of the Dolphins family. #FinsUp",['FinsUp'],1,0,"[User(username='Trewilliams', id=33990589, displayname='Tre Williams', description=None, rawDescription=None, descriptionUrls=None, verified=None, created=None, followersCount=None, friendsCount=None, statusesCount=None, favouritesCount=None, listedCount=None, mediaCount=None, location=None, protected=None, linkUrl=None, linkTcourl=None, profileImageUrl=None, profileBannerUrl=None, label=None)]",,im confident big things ahead son dolphin coach mcdaniel said last night nothing setback appreciate family part dolphins family,0.2363,0.16666666666666666,0.4029666666666667,True
44,1558930237391441920,2022-08-14 21:35:06+00:00,__kokito_,I have got 2 tickets for the Dolphins Vs Raiders preseason game. Anyone interested DM me. Free of charge. #Finsup,['Finsup'],5,2,,,got 2 tickets dolphins vs raiders preseason game anyone interested dm free charge,0.7184,0.08333333333333333,0.8017333333333334,True
45,1558929731105554434,2022-08-14 21:33:06+00:00,mrjohnnytoyou,#finsup some good baldy analysis here dolphins fans! https://t.co/wzxyPwbVde,['finsup'],1,0,,,good baldy analysis dolphins fans,0.4404,0.7,1.1404,True
48,1558927995057934342,2022-08-14 21:26:12+00:00,SSMiamiDolphins,#Dolphins exploring secondary options after Trill Williams’ season-ending knee injury #NFL https://t.co/kk6vc4d0Yk https://t.co/gfyewKYqr4,"['Dolphins', 'NFL']",13,8,,,exploring secondary options trill williams season ending knee injury,-0.4215,-0.3,-0.7215,False
50,1558927317233270784,2022-08-14 21:23:30+00:00,Trewilliams,Miami Dolphins 🐬 family you have been incredible I’m glad my Son is  #Dolphins you know How hard it is to reach this level and to know he’s appreciated means so much to a father of an incredible young man. #FinsUp,"['Dolphins', 'FinsUp']",2194,123,,,miami dolphins family incredible glad son know hard reach level know appreciated means much father incredible young man,0.7184,0.35833333333333334,1.0767333333333333,True
52,1558925571257679873,2022-08-14 21:16:34+00:00,jibs13ny,"@BaldyNFL @MiamiDolphins “Beautiful music” #BaldysBreakdowns are the best, getting me pumped for season opener #FinsUp","['BaldysBreakdowns', 'FinsUp']",1,0,"[User(username='BaldyNFL', id=2957214987, displayname='Brian Baldinger', description=None, rawDescription=None, descriptionUrls=None, verified=None, created=None, followersCount=None, friendsCount=None, statusesCount=None, favouritesCount=None, listedCount=None, mediaCount=None, location=None, protected=None, linkUrl=None, linkTcourl=None, profileImageUrl=None, profileBannerUrl=None, label=None), User(username='MiamiDolphins', id=19853312, displayname='Miami Dolphins', description=None, rawDescription=None, descriptionUrls=None, verified=None, created=None, followersCount=None, friendsCount=None, statusesCount=None, favouritesCount=None, listedCount=None, mediaCount=None, location=None, protected=None, linkUrl=None, linkTcourl=None, profileImageUrl=None, profileBannerUrl=None, label=None)]",,beautiful music best getting pumped season opener,0.8442,0.925,1.7692,True
53,1558924531200303104,2022-08-14 21:12:26+00:00,BaldyNFL,"@MiamiDolphins if I am a DolFan, or an opponent of the Fins, I am incessantly wondering what Mike McDaniel is thinking about at any moment of any day. Innovative flashes of brilliance can strike at any time 🤔 🤔🤔 #FinsUp #BaldysBreakdowns","['FinsUp', 'BaldysBreakdowns']",837,113,"[User(username='MiamiDolphins', id=19853312, displayname='Miami Dolphins', description=None, rawDescription=None, descriptionUrls=None, verified=None, created=None, followersCount=None, friendsCount=None, statusesCount=None, favouritesCount=None, listedCount=None, mediaCount=None, location=None, protected=None, linkUrl=None, linkTcourl=None, profileImageUrl=None, profileBannerUrl=None, label=None)]","Coordinates(longitude=-74.9442258, latitude=39.916215)",dolfan opponent fins incessantly wondering mike mcdaniel thinking moment day innovative flashes brilliance strike time,0.743,0.5,1.2429999999999999,True
55,1558923848304807936,2022-08-14 21:09:43+00:00,t_fins,Had a great time last night at Raymond James. Even in preseason it’s great to see a Dolphins victory! #FinsUp https://t.co/aMcZlxMmTj,['FinsUp'],2,0,,,great time last night raymond james even preseason great see dolphins victory,0.8481,0.5333333333333333,1.3814333333333333,True
