,ID,Date,User,Tweet,HashTags,Likes,Retweets,MentionUsers,LocationCoordinates,clean_Tweet,NLTK_Sentiment_Analysis,TextBlob_Sentiment_Analysis,Compound_Sentiment_Score,Positive_Sentiment
401,1558646630064209921,2022-08-14 02:48:09+00:00,CoachSwish29,"My Preseason Week 1 postgame speech, way to hang on and win! Saw some good things and some bad things. Get better and be ready to go next week. @MiamiDolphins @skylarjthompson #FinsUp https://t.co/sboW6flw22 https://t.co/OFHEYWbvle",['FinsUp'],3,0,"[User(username='MiamiDolphins', id=19853312, displayname='Miami Dolphins', description=None, rawDescription=None, descriptionUrls=None, verified=None, created=None, followersCount=None, friendsCount=None, statusesCount=None, favouritesCount=None, listedCount=None, mediaCount=None, location=None, protected=None, linkUrl=None, linkTcourl=None, profileImageUrl=None, profileBannerUrl=None, label=None), User(username='skylarjthompson', id=547199261, displayname='Skylar Thompson', description=None, rawDescription=None, descriptionUrls=None, verified=None, created=None, followersCount=None, friendsCount=None, statusesCount=None, favouritesCount=None, listedCount=None, mediaCount=None, location=None, protected=None, linkUrl=None, linkTcourl=None, profileImageUrl=None, profileBannerUrl=None, label=None)]",,preseason week 1 postgame speech way hang win saw good things bad things get better ready go next week,0.8225,0.25000000000000006,1.0725,True
402,1558646623479152640,2022-08-14 02:48:07+00:00,MidnightFire420,"@MiamiDolphins @AutoNation Thompson was decent, but defense got some clutch plays that won us that game. GG Bucs! #FinsUp",['FinsUp'],0,0,"[User(username='MiamiDolphins', id=19853312, displayname='Miami Dolphins', description=None, rawDescription=None, descriptionUrls=None, verified=None, created=None, followersCount=None, friendsCount=None, statusesCount=None, favouritesCount=None, listedCount=None, mediaCount=None, location=None, protected=None, linkUrl=None, linkTcourl=None, profileImageUrl=None, profileBannerUrl=None, label=None), User(username='AutoNation', id=39657792, displayname='AutoNation', description=None, rawDescription=None, descriptionUrls=None, verified=None, created=None, followersCount=None, friendsCount=None, statusesCount=None, favouritesCount=None, listedCount=None, mediaCount=None, location=None, protected=None, linkUrl=None, linkTcourl=None, profileImageUrl=None, profileBannerUrl=None, label=None)]",,thompson decent defense got clutch plays us game gg bucs,0.5719,-0.11666666666666668,0.45523333333333327,True
403,1558646244888788994,2022-08-14 02:46:37+00:00,ThisIsCrane,Dolphins win!!!! Let’s goooooo!!!! #FinsUp #ImNotOverReactingYouAre,"['FinsUp', 'ImNotOverReactingYouAre']",1,0,,,dolphins win let goooooo,0.5859,0.8,1.3859,True
408,1558646036381433856,2022-08-14 02:45:47+00:00,ScottG305,@MiamiDolphins QB controversy!!! Who is the true QB1 for #FinsUp ?,['FinsUp'],0,0,"[User(username='MiamiDolphins', id=19853312, displayname='Miami Dolphins', description=None, rawDescription=None, descriptionUrls=None, verified=None, created=None, followersCount=None, friendsCount=None, statusesCount=None, favouritesCount=None, listedCount=None, mediaCount=None, location=None, protected=None, linkUrl=None, linkTcourl=None, profileImageUrl=None, profileBannerUrl=None, label=None)]",,qb controversy true qb1,0.4215,0.35,0.7715,True
409,1558645941246255108,2022-08-14 02:45:25+00:00,TheDeniseFolsom,@MiamiDolphins @AutoNation Great game! So proud of you all!! #FinsUp #Win #BeatBucs #MIAvsTPA Hope #TrillWilliams is ok!🙏🏼 #SkylarThompson played awesome too! #Dolphins Rock!🐬🧡🐬🧡🐬🧡,"['FinsUp', 'Win', 'BeatBucs', 'MIAvsTPA', 'TrillWilliams', 'SkylarThompson', 'Dolphins']",0,0,"[User(username='MiamiDolphins', id=19853312, displayname='Miami Dolphins', description=None, rawDescription=None, descriptionUrls=None, verified=None, created=None, followersCount=None, friendsCount=None, statusesCount=None, favouritesCount=None, listedCount=None, mediaCount=None, location=None, protected=None, linkUrl=None, linkTcourl=None, profileImageUrl=None, profileBannerUrl=None, label=None), User(username='AutoNation', id=39657792, displayname='AutoNation', description=None, rawDescription=None, descriptionUrls=None, verified=None, created=None, followersCount=None, friendsCount=None, statusesCount=None, favouritesCount=None, listedCount=None, mediaCount=None, location=None, protected=None, linkUrl=None, linkTcourl=None, profileImageUrl=None, profileBannerUrl=None, label=None)]",,great game proud hope ok played awesome rock,0.9571,0.54,1.4971,True
411,1558645777278406658,2022-08-14 02:44:46+00:00,troopsports,"@MiamiDolphins Tackling was not good all game. WR and RB are deep, deep. OL is paper thin. Hopefully 5 NFLers in the group. DB is kinda thin too. Play calling on both sides was very vanilla. Skylar was OK, but there's something there. #FinsUp",['FinsUp'],4,0,"[User(username='MiamiDolphins', id=19853312, displayname='Miami Dolphins', description=None, rawDescription=None, descriptionUrls=None, verified=None, created=None, followersCount=None, friendsCount=None, statusesCount=None, favouritesCount=None, listedCount=None, mediaCount=None, location=None, protected=None, linkUrl=None, linkTcourl=None, profileImageUrl=None, profileBannerUrl=None, label=None)]",,tackling good game wr rb deep deep ol paper thin hopefully 5 nflers group db kinda thin play calling sides vanilla skylar ok theres something,0.8369,-1.586032892321652e-17,0.8369,True
412,1558645731694878726,2022-08-14 02:44:35+00:00,twizzjb,Dolphins at Buccaneers went down to the coaching turns out freezing the kicker is effective or maybe Jose Doink made the first one out of pure luck 🤔 #dolphins #football #unvaccinated,"['dolphins', 'football', 'unvaccinated']",0,0,,,dolphins buccaneers went coaching turns freezing kicker effective maybe jose doink made first one pure luck,0.6908,0.3547619047619048,1.0455619047619047,True
413,1558645639780732928,2022-08-14 02:44:13+00:00,finatic1972,"Dolphins WIN🔥🔥🔥 I don’t care that it’s a preseason game, I wanted the W!!!! Congrats Coach McDaniel on the 1st of many dubs #FinsUp #CheckYourPulse https://t.co/kwY3hyxNTb","['FinsUp', 'CheckYourPulse']",23,1,,,dolphins win care preseason game wanted w congrats coach mcdaniel 1st many dubs,0.886,0.3,1.186,True
414,1558645536399495170,2022-08-14 02:43:48+00:00,Aydensportsfan,Dolphins Win 26-24 Player of the Game Skylar Thompson #FinsUp,['FinsUp'],7,0,,,dolphins win 26 24 player game skylar thompson,0.5859,0.2,0.7859,True
416,1558645456741318664,2022-08-14 02:43:29+00:00,conlin_joseph,Mike McDaniel freezes the kicker and the Dolphins get the W in Tampa Bay 26-24. It was a really fun night with both positives and negatives to come out of it but overall good stuff and the Dolphins won. Gonna do a short post game video which should be up in about an hour. #FinsUp,['FinsUp'],2,0,,,mike mcdaniel freezes kicker dolphins get w tampa bay 26 24 really fun night positives negatives come overall good stuff dolphins gonna short post game video hour,0.8766,0.12,0.9966,True
418,1558645406355136512,2022-08-14 02:43:17+00:00,TBTimes_Bulls,"Officially, that was a 49-yard miss (off right upright) by Borregales. #Dolphins 26, #Bucs 24","['Dolphins', 'Bucs']",2,0,,,officially 49 yard miss right upright borregales 26 24,-0.1531,0.2857142857142857,0.13261428571428568,True
421,1558645269360627713,2022-08-14 02:42:45+00:00,amber_nicoleh,@MiamiDolphins cutest fan ecstatic about the first win of the preseason !#FinsUp https://t.co/1dfRCXdMHh,['FinsUp'],0,0,"[User(username='MiamiDolphins', id=19853312, displayname='Miami Dolphins', description=None, rawDescription=None, descriptionUrls=None, verified=None, created=None, followersCount=None, friendsCount=None, statusesCount=None, favouritesCount=None, listedCount=None, mediaCount=None, location=None, protected=None, linkUrl=None, linkTcourl=None, profileImageUrl=None, profileBannerUrl=None, label=None)]",,cutest fan ecstatic first win preseason,0.9217,0.525,1.4466999999999999,True
422,1558645222619463680,2022-08-14 02:42:33+00:00,CentralFl_911,"Dolphins trainers in the locker room with @TrillWilliams6.  Hope the kid is gonna be ok.  The W means nothing, we need him on the field.  #FinsUp https://t.co/mW9lMFKjTR",['FinsUp'],0,0,"[User(username='TrillWilliams6', id=1130519200563437568, displayname='Trill Williams', description=None, rawDescription=None, descriptionUrls=None, verified=None, created=None, followersCount=None, friendsCount=None, statusesCount=None, favouritesCount=None, listedCount=None, mediaCount=None, location=None, protected=None, linkUrl=None, linkTcourl=None, profileImageUrl=None, profileBannerUrl=None, label=None)]","Coordinates(longitude=-81.6902809, latitude=28.785679)",dolphins trainers locker room hope kid gonna ok w means nothing need field,0.6249,0.5,1.1249,True
423,1558645216696991745,2022-08-14 02:42:32+00:00,JustFacts65,"Dolphins win!
Get used to hearing that this year.
#FinsUp",['FinsUp'],0,0,,,dolphins win get used hearing year,0.5859,0.8,1.3859,True
425,1558645196925145088,2022-08-14 02:42:27+00:00,TheDeniseFolsom,@MiamiDolphins #MikeMcDaniel is so cool! #FinsUp #Winning! Great game team! Loved it! #MIAvsTPA #FinsUp🧡🐬🧡🐬🧡🐬🧡🐬🧡🐬🧡🐬🧡🐬🧡🐬🧡🐬🧡🐬🧡🐬🧡🐬🧡🐬🧡🐬🧡,"['MikeMcDaniel', 'FinsUp', 'Winning', 'MIAvsTPA', 'FinsUp']",0,0,"[User(username='MiamiDolphins', id=19853312, displayname='Miami Dolphins', description=None, rawDescription=None, descriptionUrls=None, verified=None, created=None, followersCount=None, friendsCount=None, statusesCount=None, favouritesCount=None, listedCount=None, mediaCount=None, location=None, protected=None, linkUrl=None, linkTcourl=None, profileImageUrl=None, profileBannerUrl=None, label=None)]",,cool great game team loved,0.8834,0.36249999999999993,1.2458999999999998,True
426,1558645188712611840,2022-08-14 02:42:25+00:00,Beastmike,"Seriously hope Trill Williams is ok. 

Never a bad thing to get a win. 

Keep it going. 

#FinsUp #Dolphins https://t.co/NpGKIP4Vyr","['FinsUp', 'Dolphins']",0,0,,,seriously hope trill williams ok never bad thing get win keep going,0.8765,0.32916666666666666,1.2056666666666667,True
427,1558645170479964160,2022-08-14 02:42:21+00:00,miami_fuego,Dolphins dub always feels great 🤩#FinsUp,['FinsUp'],19,3,,,dolphins dub always feels great,0.6249,0.8,1.4249,True
430,1558645037038292992,2022-08-14 02:41:49+00:00,gastoohigh1,@NFL @MiamiDolphins #FinsUp never doubt the menses of the sea🐬🐬🐬,['FinsUp'],2,0,"[User(username='NFL', id=19426551, displayname='NFL', description=None, rawDescription=None, descriptionUrls=None, verified=None, created=None, followersCount=None, friendsCount=None, statusesCount=None, favouritesCount=None, listedCount=None, mediaCount=None, location=None, protected=None, linkUrl=None, linkTcourl=None, profileImageUrl=None, profileBannerUrl=None, label=None), User(username='MiamiDolphins', id=19853312, displayname='Miami Dolphins', description=None, rawDescription=None, descriptionUrls=None, verified=None, created=None, followersCount=None, friendsCount=None, statusesCount=None, favouritesCount=None, listedCount=None, mediaCount=None, location=None, protected=None, linkUrl=None, linkTcourl=None, profileImageUrl=None, profileBannerUrl=None, label=None)]",,never doubt menses sea,0.2755,0.0,0.2755,True
432,1558644932994293760,2022-08-14 02:41:24+00:00,Cynthia_Noelle,WHAT A WAY FOR THE DOLPHINS TO WIN! Woohoo!! #CHAMPION #NFL #FinsUp https://t.co/Aw7EIJH3Zt,"['CHAMPION', 'NFL', 'FinsUp']",0,0,,,way dolphins win woohoo,0.7964,0.8,1.5964,True
434,1558644899569885185,2022-08-14 02:41:16+00:00,RodnyeTheoc,"Dolphins get the W in a pretty entertaining first preseason game, 2 more preseason games to go before the real season starts...#FinsUp 🙌🏾🐬🐬",['FinsUp'],1,0,,,dolphins get w pretty entertaining first preseason game 2 preseason games go real season starts,0.7269,0.16,0.8869,True
435,1558644816598208515,2022-08-14 02:40:57+00:00,ian693,Who gets as excited about a preseason win than Miami Dolphins fans!!! MIAMI DOLPHINS WIN!!!!!! #FinsUp https://t.co/KONdJsSOsQ,['FinsUp'],400,29,,,gets excited preseason win miami dolphins fans miami dolphins win,0.875,0.6583333333333333,1.5333333333333332,True
436,1558644746419052547,2022-08-14 02:40:40+00:00,WPBF_Yianni,"Mike McDaniel wins his first game as Dolphins coach 26-24 @WPBF25News #finsup 

Full highlights 11p https://t.co/kB299ujsQ2",['finsup'],7,3,"[User(username='WPBF25News', id=22214972, displayname='WPBF 25 News', description=None, rawDescription=None, descriptionUrls=None, verified=None, created=None, followersCount=None, friendsCount=None, statusesCount=None, favouritesCount=None, listedCount=None, mediaCount=None, location=None, protected=None, linkUrl=None, linkTcourl=None, profileImageUrl=None, profileBannerUrl=None, label=None)]",,mike mcdaniel wins first game dolphins coach 26 24 full highlights 11p,0.5719,0.125,0.6969,True
437,1558644729381736448,2022-08-14 02:40:36+00:00,DillonTartaro,"I wasn't blown away by the @MiamiDolphins performance tonight.

To be fair, I haven't been able to follow close this offseason, and it's preseason game one with a lot of the starters playing no time.

Skylar Thompson was the only player that really stood out.

Win though. #FinsUp",['FinsUp'],0,0,"[User(username='MiamiDolphins', id=19853312, displayname='Miami Dolphins', description=None, rawDescription=None, descriptionUrls=None, verified=None, created=None, followersCount=None, friendsCount=None, statusesCount=None, favouritesCount=None, listedCount=None, mediaCount=None, location=None, protected=None, linkUrl=None, linkTcourl=None, profileImageUrl=None, profileBannerUrl=None, label=None)]",,wasnt blown away performance tonight fair havent able follow close offseason preseason game one lot starters playing time skylar thompson player really stood win though,0.8008,0.36,1.1608,True
438,1558644716337598465,2022-08-14 02:40:33+00:00,m_nottage17,"The dolphins have a 100% win rate since my daughter was born 
#FinsUp",['FinsUp'],2,0,,,dolphins 100 win rate since daughter born,0.5859,0.8,1.3859,True
439,1558644715817402368,2022-08-14 02:40:33+00:00,Klutzkraft,"very nice performance by Thompson, don't wanna ask what was happening with defensive plays at the end, everyone looked very confused. #Dolphins",['Dolphins'],0,0,,,nice performance thompson dont wanna ask happening defensive plays end everyone looked confused,0.3818,0.09999999999999998,0.48179999999999995,True
442,1558644667838861314,2022-08-14 02:40:21+00:00,4taygoldolphins,"🚨Reporte🚨
McDaniel congela al Kicker de #Bucs y le sale: falla el FG.

Los #Dolphins ganan!!

MIA 26 - 24 TB
#FinsUp #MIAvsTB","['Bucs', 'Dolphins', 'FinsUp', 'MIAvsTB']",8,2,,,reporte mcdaniel congela al kicker de le sale falla el fg los ganan mia 26 24 tb,-0.296,0.0,-0.296,False
443,1558644638872850432,2022-08-14 02:40:14+00:00,Phost3,@MiamiDolphins YES! #finsup icing is he kicker rarely works but …,['finsup'],0,0,"[User(username='MiamiDolphins', id=19853312, displayname='Miami Dolphins', description=None, rawDescription=None, descriptionUrls=None, verified=None, created=None, followersCount=None, friendsCount=None, statusesCount=None, favouritesCount=None, listedCount=None, mediaCount=None, location=None, protected=None, linkUrl=None, linkTcourl=None, profileImageUrl=None, profileBannerUrl=None, label=None)]","Coordinates(longitude=-87.634643, latitude=24.396308)",yes icing kicker rarely works,0.4019,0.3,0.7019,True
446,1558644562662510592,2022-08-14 02:39:56+00:00,AaronJPresents,@MiamiDolphins Not bad for the first week of preseason for a bunch of guys trying to make the team. #FinsUp https://t.co/FNeY1n78hm,['FinsUp'],0,0,"[User(username='MiamiDolphins', id=19853312, displayname='Miami Dolphins', description=None, rawDescription=None, descriptionUrls=None, verified=None, created=None, followersCount=None, friendsCount=None, statusesCount=None, favouritesCount=None, listedCount=None, mediaCount=None, location=None, protected=None, linkUrl=None, linkTcourl=None, profileImageUrl=None, profileBannerUrl=None, label=None)]",,bad first week preseason bunch guys trying make team,-0.5423,-0.22499999999999992,-0.7672999999999999,False
447,1558644547265110016,2022-08-14 02:39:52+00:00,dolphinsgm2019,Let’s all say a prayer for @TrillWilliams6   He is having a great camp. 🐬👍 @MiamiDolphins #FinsUp,['FinsUp'],5,0,"[User(username='TrillWilliams6', id=1130519200563437568, displayname='Trill Williams', description=None, rawDescription=None, descriptionUrls=None, verified=None, created=None, followersCount=None, friendsCount=None, statusesCount=None, favouritesCount=None, listedCount=None, mediaCount=None, location=None, protected=None, linkUrl=None, linkTcourl=None, profileImageUrl=None, profileBannerUrl=None, label=None), User(username='MiamiDolphins', id=19853312, displayname='Miami Dolphins', description=None, rawDescription=None, descriptionUrls=None, verified=None, created=None, followersCount=None, friendsCount=None, statusesCount=None, favouritesCount=None, listedCount=None, mediaCount=None, location=None, protected=None, linkUrl=None, linkTcourl=None, profileImageUrl=None, profileBannerUrl=None, label=None)]",,let say prayer great camp,0.6249,0.8,1.4249,True
448,1558644543536484360,2022-08-14 02:39:52+00:00,dolphinslaxer,@MiamiDolphins That really looked my 9 iron shot on the second hole about 7 hours ago.  #finsup,['finsup'],3,0,"[User(username='MiamiDolphins', id=19853312, displayname='Miami Dolphins', description=None, rawDescription=None, descriptionUrls=None, verified=None, created=None, followersCount=None, friendsCount=None, statusesCount=None, favouritesCount=None, listedCount=None, mediaCount=None, location=None, protected=None, linkUrl=None, linkTcourl=None, profileImageUrl=None, profileBannerUrl=None, label=None)]",,really looked 9 iron shot second hole 7 hours ago,0.0,0.1,0.1,True
449,1558644527149338624,2022-08-14 02:39:48+00:00,RomeyDaHomie_,No good! Dolphins win! Lol let’s goooo! #FinsUp,['FinsUp'],0,0,,,good dolphins win lol let goooo,0.8591,0.7666666666666666,1.6257666666666666,True
450,1558644526624940037,2022-08-14 02:39:48+00:00,BacknineBobby,Dolphins Win!!!! 1-0 #FinsUp,['FinsUp'],1,0,,,dolphins win 1 0,0.5859,0.8,1.3859,True
455,1558644477803331586,2022-08-14 02:39:36+00:00,ThePhinsDude,McDaniel’s first of many wins this year. YLTSI @MiamiDolphins #FinsUp,['FinsUp'],12,1,"[User(username='MiamiDolphins', id=19853312, displayname='Miami Dolphins', description=None, rawDescription=None, descriptionUrls=None, verified=None, created=None, followersCount=None, friendsCount=None, statusesCount=None, favouritesCount=None, listedCount=None, mediaCount=None, location=None, protected=None, linkUrl=None, linkTcourl=None, profileImageUrl=None, profileBannerUrl=None, label=None)]",,mcdaniel first many wins year yltsi,0.5719,0.35000000000000003,0.9218999999999999,True
460,1558644465371340800,2022-08-14 02:39:33+00:00,DanielEliesen,"Dolphins win. 

Super Bowl confirmed. #FinsUp https://t.co/w4ygQ1OlZ0",['FinsUp'],3,0,,,dolphins win super bowl confirmed,0.8271,0.5111111111111111,1.338211111111111,True
461,1558644414414831617,2022-08-14 02:39:21+00:00,DolphinsTalkTom,Dolphins win 26-24.  Post Game wrap up show about to begin @DolphinsTalk #FinsUp,['FinsUp'],37,3,"[User(username='DolphinsTalk', id=358860802, displayname='DolphinsTalk.com', description=None, rawDescription=None, descriptionUrls=None, verified=None, created=None, followersCount=None, friendsCount=None, statusesCount=None, favouritesCount=None, listedCount=None, mediaCount=None, location=None, protected=None, linkUrl=None, linkTcourl=None, profileImageUrl=None, profileBannerUrl=None, label=None)]",,dolphins win 26 24 post game wrap show begin,0.5859,0.2,0.7859,True
463,1558644350170681344,2022-08-14 02:39:05+00:00,ZachWeinberger,"I’ve seen enough, Dolphins are winning the Super Bowl. #FinsUp https://t.co/a4QF4gYGeL",['FinsUp'],4,0,,,seen enough dolphins winning super bowl,0.8074,0.27777777777777773,1.0851777777777778,True
466,1558644279471398912,2022-08-14 02:38:49+00:00,PewterReport,The #Dolphins ice the kicker and #Bucs Borregales hits the post from 49 yards out. The Buccaneers lose their preseason opener to the Dolphins 26-24.,"['Dolphins', 'Bucs']",39,3,,,ice kicker borregales hits post 49 yards buccaneers lose preseason opener dolphins 26 24,-0.4019,0.0,-0.4019,False
468,1558643211584901125,2022-08-14 02:34:34+00:00,NumbersPicky,"Dolphins coach first game as head coach….

Blows game by not declining a holding penalty on what would have been 4th and 11…

#dolphins",['dolphins'],0,1,,,dolphins coach first game head coach blows game declining holding penalty would 4th 11,-0.4588,-0.18333333333333335,-0.6421333333333333,False
469,1558643132614459392,2022-08-14 02:34:15+00:00,tbolt87,The Miami Dolphins are playing football so me and @ScottyJwheeler cracked out some elite QB’s #FinsUp https://t.co/Dn7feWNum2,['FinsUp'],8,0,"[User(username='ScottyJwheeler', id=857011048204967936, displayname='Scotty J', description=None, rawDescription=None, descriptionUrls=None, verified=None, created=None, followersCount=None, friendsCount=None, statusesCount=None, favouritesCount=None, listedCount=None, mediaCount=None, location=None, protected=None, linkUrl=None, linkTcourl=None, profileImageUrl=None, profileBannerUrl=None, label=None)]",,miami dolphins playing football cracked elite qb,0.2023,0.0,0.2023,True
471,1558643013127118850,2022-08-14 02:33:47+00:00,SilversteinAdam,That looked really bad for Trill Williams. Damn. #Dolphins,['Dolphins'],1,0,,,looked really bad trill williams damn,-0.7574,-0.6999999999999998,-1.4573999999999998,False
472,1558643010723880961,2022-08-14 02:33:46+00:00,PhinsChris,Not good. Young man has had a nice camp. Hope he’s OK… #Dolphins https://t.co/fXttZivCa6,['Dolphins'],7,0,,,good young man nice camp hope ok,0.8689,0.475,1.3439,True
473,1558642857069744129,2022-08-14 02:33:09+00:00,Safid_Deen,That was the third injury I’ve seen Trill Williams suffer in the last two weeks. Two in this game alone. #Dolphins may have lost their best backup corner.,['Dolphins'],53,2,,,third injury seen trill williams suffer last two weeks two game alone may lost best backup corner,-0.6597,0.15,-0.5096999999999999,False
474,1558642493830340608,2022-08-14 02:31:43+00:00,MikeCugnoCBS4,Trill Williams gets carted off for the Dolphins after hurting his knee on a tackle. #Dolphins,['Dolphins'],5,0,,,trill williams gets carted dolphins hurting knee tackle,-0.4019,0.0,-0.4019,False
475,1558642216675020800,2022-08-14 02:30:37+00:00,csciria,Lets hope Williams is OK. And the Twitter doctors learned from last night. #Dolphins,['Dolphins'],1,0,,,lets hope williams ok twitter doctors learned last night,0.6249,0.25,0.8749,True
476,1558642175021355009,2022-08-14 02:30:27+00:00,HeyBeerMan1962,"@ian693 GO DOLPHINS!!!
Nfl network is replaying Phins/Bucs at 7am eastern Sunday morning if anyone out of the South Florida area wants to watch.
#FinsUp",['FinsUp'],2,1,"[User(username='ian693', id=239085537, displayname='Big E', description=None, rawDescription=None, descriptionUrls=None, verified=None, created=None, followersCount=None, friendsCount=None, statusesCount=None, favouritesCount=None, listedCount=None, mediaCount=None, location=None, protected=None, linkUrl=None, linkTcourl=None, profileImageUrl=None, profileBannerUrl=None, label=None)]",,go dolphins nfl network replaying phins bucs 7am eastern sunday morning anyone south florida area wants watch,0.0,0.2,0.2,True
477,1558642098567581696,2022-08-14 02:30:09+00:00,Sam_Dorr,"@JasonTaylor I'm a huge fan, and have been for decades. I own your jersey. That said, maybe don't insult #GatorNation on a broadcast with thousands upon thousands of South Florida UF alumni watching our #Dolphins; cane fans are a vocal minority, as you surely know.","['GatorNation', 'Dolphins']",0,0,"[User(username='JasonTaylor', id=472442403, displayname='Jason Taylor', description=None, rawDescription=None, descriptionUrls=None, verified=None, created=None, followersCount=None, friendsCount=None, statusesCount=None, favouritesCount=None, listedCount=None, mediaCount=None, location=None, protected=None, linkUrl=None, linkTcourl=None, profileImageUrl=None, profileBannerUrl=None, label=None)]",,im huge fan decades jersey said maybe dont insult broadcast thousands upon thousands south florida uf alumni watching cane fans vocal minority surely know,0.8482,0.45000000000000007,1.2982,True
478,1558642090434781186,2022-08-14 02:30:07+00:00,TheMozKnowz,This does not look good for #Dolphins CB Trill Williams. He’s had an excellent camp. Doctors are looking at his left leg. 🙏🙏🙏 #FinsUp https://t.co/g2mkvAH2JZ,"['Dolphins', 'FinsUp']",12,9,,,look good cb trill williams excellent camp doctors looking left leg,0.765,0.5666666666666667,1.3316666666666666,True
479,1558642018087276549,2022-08-14 02:29:49+00:00,SirLeeJay,"It's masterful how they're playing injured to run up the time 
#Dolphins https://t.co/kgpnqF1slp",['Dolphins'],0,0,,,masterful theyre playing injured run time,-0.2263,1.0,0.7737,True
480,1558642011577765889,2022-08-14 02:29:48+00:00,Canesfan4200,Trill Williams getting injured with 1:38 left?? Jesus why. #dolphins,['dolphins'],0,0,,,trill williams getting injured 1 38 left jesus,-0.4019,0.0,-0.4019,False
481,1558641999158419456,2022-08-14 02:29:45+00:00,PewterReport,#Bucs 2-minute drill does not get off to a promising start. It is third-and-11 following a -5 yard pass to Deven Thompkins. #Dolphins have to use their second timeout on an injury.,"['Bucs', 'Dolphins']",0,0,,,2 minute drill get promising start third 11 following 5 yard pass deven thompkins use second timeout injury,-0.0258,0.05,0.024200000000000003,True
