,ID,Date,User,Tweet,HashTags,Likes,Retweets,MentionUsers,LocationCoordinates,clean_Tweet,NLTK_Sentiment_Analysis,TextBlob_Sentiment_Analysis,Compound_Sentiment_Score,Positive_Sentiment
1783,1584233618444292096,2022-10-23 17:21:42+00:00,SportsWriterNY,"#Jaguars are able to answer quick with a touchdown by Travis Etienne! His first touchdown in the NFL!

#DUUUVAL | #NYGvsJAX 

https://t.co/lXGdRbrxsE","['Jaguars', 'DUUUVAL', 'NYGvsJAX']",1,0,,,able answer quick touchdown travis etienne first touchdown nfl,0.0,0.3611111111111111,0.3611111111111111,True
1785,1584233593035190272,2022-10-23 17:21:36+00:00,GiantInsider,"#Jaguars strikes right back on a Etienne 7 yard TD run.

After the penalty, Pederson goes for two and converts on an Etienne run.

#Jags 8
#Giants 7
6:58 1Q","['Jaguars', 'Jags', 'Giants']",9,0,,,strikes right back etienne 7 yard td run penalty pederson goes two converts etienne run 8 7 6 58 1q,-0.6705,0.14285714285714285,-0.5276428571428571,False
1786,1584233590518272000,2022-10-23 17:21:36+00:00,TheFakeSith,I don’t like the 2 point call but I will gladly take that! That’s a huge play there! #Jaguars,['Jaguars'],1,0,,,like 2 point call gladly take huge play,0.8225,0.45000000000000007,1.2725,True
1787,1584233570528550912,2022-10-23 17:21:31+00:00,LanceMedow,#Jaguars faced no third downs on their opening 6-play TD drive..attacked the edges of the #NYG defense #giantschat #NYGvsJAX,"['Jaguars', 'NYG', 'giantschat', 'NYGvsJAX']",2,0,,,faced third downs opening 6 play td drive attacked edges defense,-0.0258,0.0,-0.0258,False
1788,1584233563045535745,2022-10-23 17:21:29+00:00,wmc55,"Didn't like call, liked the result #Jaguars",['Jaguars'],2,0,,,didnt like call liked result,-0.5334,0.6,0.06659999999999999,True
1791,1584233532704325633,2022-10-23 17:21:22+00:00,A_J_Alexander92,Jacksonville’s offense looked like a well oiled machine on that drive. Need more of that. #Jaguars,['Jaguars'],0,0,,,jacksonville offense looked like well oiled machine drive need,0.3818,0.0,0.3818,True
1792,1584233517168218112,2022-10-23 17:21:18+00:00,MainManPlan,"LOL. I walked away and we went for 2. I mean, ok #Jaguars",['Jaguars'],0,0,,,lol walked away went 2 mean ok,0.6124,0.32916666666666666,0.9415666666666667,True
1793,1584233512516788226,2022-10-23 17:21:17+00:00,michaelmcd2916,Missed why Doug went for 2 but lol. Love him #jaguars,['jaguars'],0,0,,,missed doug went 2 lol love,0.7003,0.65,1.3503,True
1797,1584233461887356929,2022-10-23 17:21:05+00:00,KyilanThomas1,Best offensive drive I’ve seen all year #Jaguars,['Jaguars'],1,0,,,best offensive drive seen year,0.296,1.0,1.296,True
1798,1584233405872762880,2022-10-23 17:20:52+00:00,ChrisPorterFCN,"After a #giants penalty, the #jaguars get the ball on the 1 yard line and Doug Pederson decides to go for two and they convert.

#Jaguars 8, #Giants 7 1st qtr","['giants', 'jaguars', 'Jaguars', 'Giants']",4,3,,,penalty get ball 1 yard line doug pederson decides go two convert 8 7 1st qtr,-0.4588,0.0,-0.4588,False
1799,1584233399476449280,2022-10-23 17:20:50+00:00,RealMBB,Doug P! Smart football. Penalty means NOTHING on the kickoff. #Jaguars,['Jaguars'],3,0,,,doug p smart football penalty means nothing kickoff,-0.0772,0.21428571428571427,0.13708571428571426,True
1800,1584233392673280000,2022-10-23 17:20:49+00:00,GeneFrenette,"#Jaguars accept illegal formation penalty on PAT kick, take it and go for 2 points. Etienne walks into end zone to give Jags 8-7 lead.",['Jaguars'],3,0,,,accept illegal formation penalty pat kick take go 2 points etienne walks end zone give jags 8 7 lead,-0.6124,-0.5,-1.1124,False
1801,1584233392669065218,2022-10-23 17:20:49+00:00,WeTheLees,@swaggy_t1 scores his 1st career TD ! #Duuuval game is tied at 7. What a answer by the @Jaguars,['Duuuval'],0,0,"[User(username='swaggy_t1', id=2653998533, displayname='Travis Etienne Jr⁶𓅓', description=None, rawDescription=None, descriptionUrls=None, verified=None, created=None, followersCount=None, friendsCount=None, statusesCount=None, favouritesCount=None, listedCount=None, mediaCount=None, location=None, protected=None, linkUrl=None, linkTcourl=None, profileImageUrl=None, profileBannerUrl=None, label=None), User(username='Jaguars', id=59471027, displayname='Jacksonville Jaguars', description=None, rawDescription=None, descriptionUrls=None, verified=None, created=None, followersCount=None, friendsCount=None, statusesCount=None, favouritesCount=None, listedCount=None, mediaCount=None, location=None, protected=None, linkUrl=None, linkTcourl=None, profileImageUrl=None, profileBannerUrl=None, label=None)]",,scores 1st career td game tied 7 answer,0.0,-0.4,-0.4,False
1802,1584233384460832774,2022-10-23 17:20:47+00:00,GSportsboy,Congrats to Jacksonville Jaguars running back Travis Etienne on his first career touchdown. Must have meant a lot to him. #NFL #Jacksonville #Jaguars #NewYork #Giants,"['NFL', 'Jacksonville', 'Jaguars', 'NewYork', 'Giants']",1,0,,,congrats jacksonville jaguars running back travis etienne first career touchdown must meant lot,0.5267,0.125,0.6517,True
1803,1584233370514763776,2022-10-23 17:20:43+00:00,schrayguy,Travis Etienne scores his first career touchdown in the #NFL. The Jacksonville #Jaguars moved the ball well on that drive https://t.co/DjcpSfObsJ,"['NFL', 'Jaguars']",15,6,,,travis etienne scores first career touchdown jacksonville moved ball well drive,0.2732,0.25,0.5232,True
1804,1584233360351580161,2022-10-23 17:20:41+00:00,HaysCarlyon,"#Jaguars go for 2 after Giants penalty and Etienne runs it in. Jags lead 8-7. Scoring drive: 6 plays, 70 yards in 3:26. Key play: Trevor Lawrence connects on screen to Dan Arnold for 24-yard gain.",['Jaguars'],15,1,,,go 2 giants penalty etienne runs jags lead 8 7 scoring drive 6 plays 70 yards 3 26 key play trevor lawrence connects screen dan arnold 24 yard gain,0.5859,0.0,0.5859,True
1806,1584233355519832064,2022-10-23 17:20:40+00:00,theryanmichael,"#TrevorLawrence and the #Jaguars offense picking up a lot of slack after their defense folded early.

Lawrence 3 of 3 for 48 yards, ETN caps the drive off with a rushing TD.

2PC run by ETN.

Jags up 8-7.","['TrevorLawrence', 'Jaguars']",2,0,,,offense picking lot slack defense folded early lawrence 3 3 48 yards etn caps drive rushing td 2pc run etn jags 8 7,-0.128,0.1,-0.027999999999999997,False
1807,1584233348943081472,2022-10-23 17:20:38+00:00,MiaOBrienTV,"And now, after a #Giants penalty, #Jaguars go for 2 and get it on another Etienne run","['Giants', 'Jaguars']",19,1,,,penalty go 2 get another etienne run,-0.4588,0.0,-0.4588,False
1808,1584233339296227329,2022-10-23 17:20:36+00:00,NFL_DovKleiman,"#Jaguars Travis Etienne with his first career touchdown (@LaurieFitzptrck) 

https://t.co/EZ8TCQ9UGC",['Jaguars'],39,4,"[User(username='LaurieFitzptrck', id=30365182, displayname='Laurie Fitzpatrick', description=None, rawDescription=None, descriptionUrls=None, verified=None, created=None, followersCount=None, friendsCount=None, statusesCount=None, favouritesCount=None, listedCount=None, mediaCount=None, location=None, protected=None, linkUrl=None, linkTcourl=None, profileImageUrl=None, profileBannerUrl=None, label=None)]",,travis etienne first career touchdown,0.0,0.25,0.25,True
1809,1584233319449112576,2022-10-23 17:20:31+00:00,Connor_J_Hughes,"Doug Pederson: Still loves his two-point attempts. 

#Jaguars: 8
#Giants: 7","['Jaguars', 'Giants']",28,4,,,doug pederson still loves two point attempts 8 7,0.5719,0.0,0.5719,True
1811,1584233255095898112,2022-10-23 17:20:16+00:00,NFLUnlimited,First career TD for #Jaguars Travis Etienne. https://t.co/QyBnBUnnf2,['Jaguars'],0,1,,,first career td travis etienne,0.0,0.25,0.25,True
1813,1584233171767676928,2022-10-23 17:19:56+00:00,joe_B_1988,"ETN gets his first pro touchdown, offense executed perfectly, hell of a response #Jaguars #Duuuval","['Jaguars', 'Duuuval']",0,0,,"Coordinates(longitude=-87.022482, latitude=35.9945681)",etn gets first pro touchdown offense executed perfectly hell response,-0.34,0.625,0.285,True
1815,1584233115278774272,2022-10-23 17:19:42+00:00,jagzman04,Play calling and execution was mint on that drive 👌🏽 #Jaguars,['Jaguars'],2,1,,,play calling execution mint drive,0.34,0.0,0.34,True
1816,1584233108638793728,2022-10-23 17:19:41+00:00,agauthier66,"While the D is inefficient, Our franchise QB play with some confidence right now. Encouraging! #Jaguars",['Jaguars'],1,0,,,inefficient franchise qb play confidence right encouraging,0.8442,0.2857142857142857,1.1299142857142856,True
1818,1584233087587651584,2022-10-23 17:19:36+00:00,JC_DTWP,"Fantastic play call on the screen to Arnold vs an aggressive Defense. 

So happy for Etienne! 

#Jaguars",['Jaguars'],3,0,,,fantastic play call screen arnold vs aggressive defense happy etienne,0.8625,0.6000000000000001,1.4625000000000001,True
1819,1584233083955712000,2022-10-23 17:19:35+00:00,Demetrius82,"#Jaguars going for two after the Giants was called for an illegal formation penalty. So, they'll try to get the lead here early on against the Giants. They get an attempt from the 1-yard-line. 

#Analytics","['Jaguars', 'Analytics']",8,0,,,going two giants called illegal formation penalty theyll try get lead early giants get attempt 1 yard line,-0.765,-0.2,-0.9650000000000001,False
1823,1584232998349963264,2022-10-23 17:19:15+00:00,cschof_LFD109,The #Jaguars need to bring back the half gold helmets #Duval,"['Jaguars', 'Duval']",0,0,,,need bring back half gold helmets,0.0,-0.08333333333333333,-0.08333333333333333,False
1827,1584232966082875393,2022-10-23 17:19:07+00:00,askirkendall83,Great response from the jags and congratulations to Etienne on his first TD #Jaguars,['Jaguars'],0,0,,,great response jags congratulations etienne first td,0.8402,0.525,1.3652,True
1829,1584232950610415616,2022-10-23 17:19:03+00:00,GeneFrenette,#Jaguars answer with impressive 70-yard TD drive as Travis Etienne gets his first NFL touchdown on 7-yard run with 6:58 left in 1Q. Tied 7-7.,['Jaguars'],5,0,,,answer impressive 70 yard td drive travis etienne gets first nfl touchdown 7 yard run 6 58 left 1q tied 7 7,0.5106,0.4166666666666667,0.9272666666666667,True
1830,1584232924366639104,2022-10-23 17:18:57+00:00,MiaOBrienTV,"And there it is: Travis Etienne's long-awaited first career TD run!

The play-design on that drive was beautiful. #Jaguars had 5 first downs. Never got into a third-down situation. Doug in his bag.

Would be great if the Defense from Weeks 1-3 could show up....",['Jaguars'],83,15,,,travis etiennes long awaited first career td run play design drive beautiful 5 first downs never got third situation doug bag would great defense weeks 1 3 could show,0.8957,0.35000000000000003,1.2457,True
1831,1584232920931192832,2022-10-23 17:18:56+00:00,coachparker85,It’s a beautiful day for some @Jaguars football!  Thanks @lennycurry #Duuuval https://t.co/cSZS95svsg,['Duuuval'],9,0,"[User(username='Jaguars', id=59471027, displayname='Jacksonville Jaguars', description=None, rawDescription=None, descriptionUrls=None, verified=None, created=None, followersCount=None, friendsCount=None, statusesCount=None, favouritesCount=None, listedCount=None, mediaCount=None, location=None, protected=None, linkUrl=None, linkTcourl=None, profileImageUrl=None, profileBannerUrl=None, label=None), User(username='lennycurry', id=23536403, displayname='Lenny Curry', description=None, rawDescription=None, descriptionUrls=None, verified=None, created=None, followersCount=None, friendsCount=None, statusesCount=None, favouritesCount=None, listedCount=None, mediaCount=None, location=None, protected=None, linkUrl=None, linkTcourl=None, profileImageUrl=None, profileBannerUrl=None, label=None)]",,beautiful day football thanks,0.7783,0.525,1.3033000000000001,True
1833,1584232914857840643,2022-10-23 17:18:55+00:00,TheFakeSith,The first ever touchdown of Travis Etienne’s NFL career!! #Jaguars,['Jaguars'],0,0,,,first ever touchdown travis etienne nfl career,0.0,0.25,0.25,True
1835,1584232910831247360,2022-10-23 17:18:54+00:00,JonathanLOdom,Had to sell my tickets cause I’m sick but I’m ready! #Jaguars #NYGvsJAX https://t.co/Fhgzy5U2Lj,"['Jaguars', 'NYGvsJAX']",1,0,,,sell tickets cause sick ready,-0.2023,-0.2571428571428571,-0.45944285714285715,False
1837,1584232899477311488,2022-10-23 17:18:51+00:00,BoysBigApplePod,That was quick. Trevor Lawrence and the #Jaguars just ate up the #Giants defense! 7-7,"['Jaguars', 'Giants']",2,1,,,quick trevor lawrence ate defense 7 7,0.128,0.3333333333333333,0.4613333333333333,True
1839,1584232850001637376,2022-10-23 17:18:39+00:00,RealMBB,ETN asked for the ball. Love it! #Jaguars,['Jaguars'],4,0,,,etn asked ball love,0.6369,0.5,1.1369,True
1841,1584232836948627456,2022-10-23 17:18:36+00:00,Connor_J_Hughes,"The #Jaguars answer right back. Nice drive for them, too. Went right down field on Wink Martidale's defense — haven't see that much this year. 

That was a 6-play, 70-yard drive. Etienne took it in from seven out.",['Jaguars'],15,0,,,answer right back nice drive went right field wink martidales defense havent see much year 6 play 70 yard drive etienne took seven,0.6908,0.27428571428571424,0.9650857142857142,True
1842,1584232825204932609,2022-10-23 17:18:33+00:00,ChrisPorterFCN,"#Jaguars answer TRAVIS ETIENNE with the touchdown run!!!!!!!!!!!! JUST GIVE ETIENNE THE BALL!😆
 Game tied at 7, 1st qtr",['Jaguars'],2,0,,,answer travis etienne touchdown run give etienne ball game tied 7 1st qtr,0.0,-0.4,-0.4,False
1843,1584232816011010050,2022-10-23 17:18:31+00:00,MainManPlan,TOUCHDOWN! Offense looks much better! ETN SZN! #Jaguars,['Jaguars'],0,0,,,touchdown offense looks much better etn szn,0.2263,0.5,0.7263,True
1844,1584232779381776384,2022-10-23 17:18:22+00:00,HaysCarlyon,Travis Etienne with his first #Jaguars TOUCHDOWN! Fantastic answer from the offense.,['Jaguars'],64,5,,,travis etienne first touchdown fantastic answer offense,0.3818,0.325,0.7068,True
1846,1584232729775788032,2022-10-23 17:18:11+00:00,RealMBB,It’s all about 16. I don’t care how bad the defense is. #Jaguars,['Jaguars'],0,0,,,16 care bad defense,0.0516,-0.6999999999999998,-0.6483999999999999,False
1848,1584232716408872961,2022-10-23 17:18:07+00:00,Demetrius82,"First career- touchdown for #Jaguars RB Travis Etienne. He keeps the ball. 

Jaguars 6 (PAT pending), Giants 7",['Jaguars'],9,1,,,first career touchdown rb travis etienne keeps ball jaguars 6 pat pending giants 7,0.0,0.25,0.25,True
1852,1584232610024198145,2022-10-23 17:17:42+00:00,Jaguars,"Dan Arnold sends his regards on #NationalTightEndsDay! Gain of 24!

#NYGvsJAX | #DUUUVAL https://t.co/bKpgnNRcd5","['NationalTightEndsDay', 'NYGvsJAX', 'DUUUVAL']",72,14,,,dan arnold sends regards gain 24,0.5267,0.0,0.5267,True
1853,1584232514251821056,2022-10-23 17:17:19+00:00,Baseline_NY,"#Giants went pass-heavy on opening drive, perhaps to loosen up the #Jaguars run defense, ranked 3rd in the league. 

Daniel Jones 6 of 7 on the scoring drive.

#NYGvsJAX","['Giants', 'Jaguars', 'NYGvsJAX']",0,0,,,went pass heavy opening drive perhaps loosen run defense ranked 3rd league daniel jones 6 7 scoring drive,0.128,-0.1,0.027999999999999997,True
1858,1584232293010649088,2022-10-23 17:16:26+00:00,GroundAndPunt,Trevor Lawrence is freaking jacked #NYGvsJAX #jax #Jacksonville #Jaguars,"['NYGvsJAX', 'jax', 'Jacksonville', 'Jaguars']",0,0,,,trevor lawrence freaking jacked,-0.4215,0.0,-0.4215,False
1859,1584232281040121858,2022-10-23 17:16:24+00:00,asadMANCpak,"Big team win from behind Comeon Jaguars.
#DUUUVAL #Jaguars","['DUUUVAL', 'Jaguars']",0,0,,,big team win behind comeon jaguars,0.5859,0.13333333333333333,0.7192333333333333,True
1860,1584232204330115072,2022-10-23 17:16:05+00:00,DanielleUliano,Moms first Jags ( and NFL) game today! #Duuuval @Jaguars https://t.co/wiaSQTct7J,['Duuuval'],23,0,"[User(username='Jaguars', id=59471027, displayname='Jacksonville Jaguars', description=None, rawDescription=None, descriptionUrls=None, verified=None, created=None, followersCount=None, friendsCount=None, statusesCount=None, favouritesCount=None, listedCount=None, mediaCount=None, location=None, protected=None, linkUrl=None, linkTcourl=None, profileImageUrl=None, profileBannerUrl=None, label=None)]","Coordinates(longitude=-87.634643, latitude=24.396308)",moms first jags nfl game today,0.0,-0.07500000000000001,-0.07500000000000001,False
1861,1584232183232811008,2022-10-23 17:16:00+00:00,MainManPlan,Every throw Trevor throws is high. I don't get it. #Jaguars,['Jaguars'],0,0,,,every throw trevor throws high dont get,0.0,0.16,0.16,True
1864,1584231957810278400,2022-10-23 17:15:07+00:00,JaguarsViews,"Live updates: Jacksonville Jaguars, New York Giants face off at TIAA Bank Field #JacksonvilleJaguars #Jaguars #Jags #GoJags #JagsFans https://t.co/0TkqUIGvSz","['JacksonvilleJaguars', 'Jaguars', 'Jags', 'GoJags', 'JagsFans']",0,0,,,live updates jacksonville jaguars new york giants face tiaa bank field,0.0,0.13636363636363635,0.13636363636363635,True
1866,1584231908539441154,2022-10-23 17:14:55+00:00,Jaguars,"16 to 17 for a gain of 13!

#NYGvsJAX | #DUUUVAL https://t.co/mbHmpv3uhZ","['NYGvsJAX', 'DUUUVAL']",71,8,,,16 17 gain 13,0.5267,0.0,0.5267,True
1867,1584231878030422016,2022-10-23 17:14:47+00:00,flyingcbread,And here we go again Making a below average qb look like Tom Brady. #Jaguars,['Jaguars'],1,1,,,go making average qb look like tom brady,0.3612,-0.15,0.21120000000000003,True
1868,1584231874356211713,2022-10-23 17:14:47+00:00,TrumanDem,".@Jaguars making @Daniel_Jones10 look like Joe Montana.  This isn't rocket science its called watching film and connecting the dots. 

#DUUUVAL 
#Jaguars 
@NFL 
#Jacksonville","['DUUUVAL', 'Jaguars', 'Jacksonville']",0,0,"[User(username='Jaguars', id=59471027, displayname='Jacksonville Jaguars', description=None, rawDescription=None, descriptionUrls=None, verified=None, created=None, followersCount=None, friendsCount=None, statusesCount=None, favouritesCount=None, listedCount=None, mediaCount=None, location=None, protected=None, linkUrl=None, linkTcourl=None, profileImageUrl=None, profileBannerUrl=None, label=None), User(username='Daniel_Jones10', id=2369205626, displayname='Daniel Jones', description=None, rawDescription=None, descriptionUrls=None, verified=None, created=None, followersCount=None, friendsCount=None, statusesCount=None, favouritesCount=None, listedCount=None, mediaCount=None, location=None, protected=None, linkUrl=None, linkTcourl=None, profileImageUrl=None, profileBannerUrl=None, label=None), User(username='NFL', id=19426551, displayname='NFL', description=None, rawDescription=None, descriptionUrls=None, verified=None, created=None, followersCount=None, friendsCount=None, statusesCount=None, favouritesCount=None, listedCount=None, mediaCount=None, location=None, protected=None, linkUrl=None, linkTcourl=None, profileImageUrl=None, profileBannerUrl=None, label=None)]",,making look like joe montana isnt rocket science called watching film connecting dots,0.3612,0.0,0.3612,True
1869,1584231870719369216,2022-10-23 17:14:46+00:00,JC_DTWP,"First opening drive TD for the Giants in 14 games. 🤣🤣🤣🤣

#Jaguars 🤦🏻‍♂️🤦🏻‍♂️🤦🏻‍♂️",['Jaguars'],0,0,,,first opening drive td giants 14 games,0.0,0.25,0.25,True
1870,1584231855263735808,2022-10-23 17:14:42+00:00,Demetrius82,First play from scrimmage for the #Jaguars offense goes to former Giants tight end Evan Engram for a gain of 13 yards.,['Jaguars'],3,0,,,first play scrimmage offense goes former giants tight end evan engram gain 13 yards,0.5859,0.023809523809523808,0.6097095238095238,True
1871,1584231818294808576,2022-10-23 17:14:33+00:00,MiaOBrienTV,"Etienne is the RB to start for #Jaguars 

Trevor immediately goes to Engram for a first-down, and the #Giants fans all just flinched","['Jaguars', 'Giants']",6,1,,,etienne rb start trevor immediately goes engram first fans flinched,0.0,0.25,0.25,True
1872,1584231762472804352,2022-10-23 17:14:20+00:00,clayharbs82,Matt Ryan looked like Peyton Manning now Daniel Jones is looking like Eli against the Jags. This Defense is NOT looking good. #Jaguars,['Jaguars'],9,0,,"Coordinates(longitude=-74.026675, latitude=40.683935)",matt ryan looked like peyton manning daniel jones looking like eli jags defense looking good,0.8126,0.7,1.5126,True
1873,1584231719078883330,2022-10-23 17:14:10+00:00,Demetrius82,#Jaguars third-string running back JaMycal Hasty is the team's kick returner with Jamal Agnew out. He has a nice return to the 30-yard-line.,['Jaguars'],6,3,,,third string running back jamycal hasty teams kick returner jamal agnew nice return 30 yard line,0.4215,0.19999999999999998,0.6214999999999999,True
1874,1584231658420510720,2022-10-23 17:13:55+00:00,MiaOBrienTV,"With Agnew out, it's JaMycal Hasty with the first return for #Jaguars. 20-yard return and hit a nice hole",['Jaguars'],5,2,,,agnew jamycal hasty first return 20 yard return hit nice hole,0.4215,0.425,0.8465,True
1876,1584231529768660992,2022-10-23 17:13:24+00:00,FreddyBricks,Daniel Jones been in a box all year and his coach look at the jaguars an said nah we letting that bitch fly today 🤣🤣🤣🤣 #duuuval,['duuuval'],0,0,,,daniel jones box year coach look jaguars said nah letting bitch fly today,-0.6369,0.8,0.16310000000000002,True
1877,1584231512387354624,2022-10-23 17:13:20+00:00,TealBlackBold,Tre got torched. The #Giants offense did that effortlessly. #Jaguars,"['Giants', 'Jaguars']",0,0,,"Coordinates(longitude=-87.634643, latitude=24.396308)",tre got torched offense effortlessly,-0.25,0.0,-0.25,False
1878,1584231480796282881,2022-10-23 17:13:13+00:00,SGiven12,Welp another #Jaguars loss. I guess we start looking at the draft for CB and O-line help.,['Jaguars'],0,0,,,welp another loss guess start looking draft cb line help,0.1027,0.0,0.1027,True
1879,1584231478421991426,2022-10-23 17:13:12+00:00,lilhurricane619,Thats what every #jaguars fan wants. Griffin out and this is what you get. Hope you happy,['jaguars'],1,0,,,thats every fan wants griffin get hope happy,0.836,0.5,1.3359999999999999,True
1881,1584231439612071937,2022-10-23 17:13:03+00:00,lloydr1l,Not a good start for #jaguars defense. Looked like butter.,['jaguars'],0,0,,,good start defense looked like butter,0.7096,0.7,1.4096,True
1882,1584231421219991552,2022-10-23 17:12:59+00:00,richard_herlihy,⁦@tmacksparkle⁩ well Tasha my eyes are on #Giants vs #Jaguars on my Big TV and on my Sunday Ticket it’s #Lions vs #Cowboys #Browns vs #Ravens #Packers vs #Commanders and #Bucs vs #Packers what’s say ya? https://t.co/qjmMqTaT91,"['Giants', 'Jaguars', 'Lions', 'Cowboys', 'Browns', 'Ravens', 'Packers', 'Commanders', 'Bucs', 'Packers']",1,0,"[User(username='tmacksparkle', id=98529780, displayname='Tasha Mack', description=None, rawDescription=None, descriptionUrls=None, verified=None, created=None, followersCount=None, friendsCount=None, statusesCount=None, favouritesCount=None, listedCount=None, mediaCount=None, location=None, protected=None, linkUrl=None, linkTcourl=None, profileImageUrl=None, profileBannerUrl=None, label=None)]",,well tasha eyes vs big tv sunday ticket vs vs vs vs say ya,0.2732,0.0,0.2732,True
1883,1584231418204332032,2022-10-23 17:12:58+00:00,DenisGorman,"Before the Jaguars offense takes the field, here is a piece I wrote about the improving Trevor Lawrence for ⁦@NewsdaySports⁩. #NFL #NYG #NYGiants #Giants #Jags #Jaguars  https://t.co/MSx88Jj3G9","['NFL', 'NYG', 'NYGiants', 'Giants', 'Jags', 'Jaguars']",0,0,"[User(username='NewsdaySports', id=14310003, displayname='Newsday Sports', description=None, rawDescription=None, descriptionUrls=None, verified=None, created=None, followersCount=None, friendsCount=None, statusesCount=None, favouritesCount=None, listedCount=None, mediaCount=None, location=None, protected=None, linkUrl=None, linkTcourl=None, profileImageUrl=None, profileBannerUrl=None, label=None)]",,jaguars offense takes field piece wrote improving trevor lawrence,0.2023,0.0,0.2023,True
1884,1584231345017958400,2022-10-23 17:12:40+00:00,wmc55,Why do we endure this every damn week? #Jaguars,['Jaguars'],1,0,,,endure every damn week,-0.4019,0.0,-0.4019,False
1885,1584231242148769792,2022-10-23 17:12:16+00:00,UselssTipster,One man offence. Should do this easily. One of the best runners in the NFL. #Giants #Jaguars https://t.co/CRi0ts5zQ0,"['Giants', 'Jaguars']",0,0,,,one man offence easily one best runners nfl,0.6597,0.7166666666666667,1.3763666666666667,True
1886,1584231210498527232,2022-10-23 17:12:08+00:00,dusty784,Ok @FOXTV you can change the #Jaguars game to something else now. I've seen enough.,['Jaguars'],0,0,"[User(username='FOXTV', id=16537989, displayname='FOX', description=None, rawDescription=None, descriptionUrls=None, verified=None, created=None, followersCount=None, friendsCount=None, statusesCount=None, favouritesCount=None, listedCount=None, mediaCount=None, location=None, protected=None, linkUrl=None, linkTcourl=None, profileImageUrl=None, profileBannerUrl=None, label=None)]",,ok change game something else ive seen enough,0.296,0.033333333333333326,0.3293333333333333,True
1888,1584231136741314560,2022-10-23 17:11:51+00:00,Jaguars_Jungle_,"Touchdown #Giants. New York marches down the field on their opening drive converting two third downs. Great pass by Daniel Jones to Darius Slayton beating Tre Herndon for six. #Jaguars first opening drive coming up. 

0-7","['Giants', 'Jaguars']",0,0,,,touchdown new york marches field opening drive converting two third downs great pass daniel jones darius slayton beating tre herndon six first opening drive coming 0 7,0.2732,0.2965909090909091,0.5697909090909091,True
1889,1584231091711320064,2022-10-23 17:11:40+00:00,RealMBB,Sounds like a Giants home game. Did FOX put a mic boom in their section? #Jaguars,['Jaguars'],0,0,,,sounds like giants home game fox put mic boom section,0.3612,-0.4,-0.0388,False
