,ID,Date,User,Tweet,HashTags,Likes,Retweets,MentionUsers,LocationCoordinates,clean_Tweet,NLTK_Sentiment_Analysis,TextBlob_Sentiment_Analysis,Compound_Sentiment_Score,Positive_Sentiment
1067,1584270040169209857,2022-10-23 19:46:26+00:00,TheRealCSharp,Mate that was ANOTHER crap spot for the @Jaguars Why didn’t Doug challenge it ffs?! #DUUUVAL,['DUUUVAL'],1,0,"[User(username='Jaguars', id=59471027, displayname='Jacksonville Jaguars', description=None, rawDescription=None, descriptionUrls=None, verified=None, created=None, followersCount=None, friendsCount=None, statusesCount=None, favouritesCount=None, listedCount=None, mediaCount=None, location=None, protected=None, linkUrl=None, linkTcourl=None, profileImageUrl=None, profileBannerUrl=None, label=None)]",,mate another crap spot doug challenge ffs,-0.7269,-0.8,-1.5269,False
1068,1584270005222354945,2022-10-23 19:46:18+00:00,Sports_24x7_,"On 4th &amp; 1, Trevor Lawrence no gain tackled by Jaylon Smith &amp; Adoree' Jackson .. turnover on downs
#Giants 13 #Jaguars 17 4th https://t.co/erYCWZ47Sr","['Giants', 'Jaguars']",0,0,,,4th amp 1 trevor lawrence gain tackled jaylon smith amp adoree jackson turnover downs 13 17 4th,0.5267,0.0,0.5267,True
1070,1584270000675647488,2022-10-23 19:46:17+00:00,thesameJay,Kick the damn field goal!! There’s being aggressive and being stupid. You telling me the kicker can’t kick that?!! #jaguars,['jaguars'],1,0,,,kick damn field goal aggressive stupid telling kicker kick,-0.7717,-0.7999999999999999,-1.5716999999999999,False
1071,1584269948599562240,2022-10-23 19:46:04+00:00,RealMBB,"You’re chasing the game if the Giants score a TD against your porous defense. Instead, worst case, you’re driving 20-20 and maybe a FG wins it. Now you absolutely require a TD to win. #Jaguars",['Jaguars'],1,0,,,chasing game giants score td porous defense instead worst case driving 20 20 maybe fg wins absolutely require td win,0.6326,-0.019999999999999973,0.6126,True
1072,1584269944241369088,2022-10-23 19:46:03+00:00,B_Yamz,Do #Jaguars need to hire a Challenge guy? This is getting ridiculous #DUUUVAL #Giants #NFL #WTFDoug,"['Jaguars', 'DUUUVAL', 'Giants', 'NFL', 'WTFDoug']",0,0,,,need hire challenge guy getting ridiculous,-0.296,-0.3333333333333333,-0.6293333333333333,False
1074,1584269903925678080,2022-10-23 19:45:54+00:00,mattjack389,They keep leaving points on the field… feels like they are trying to find a way to lose this game… we know what happens next #Jaguars,['Jaguars'],0,0,,,keep leaving points field feels like trying find way lose game know happens next,-0.0516,-0.2,-0.2516,False
1075,1584269878545948674,2022-10-23 19:45:48+00:00,LyfeReflect,I told y’all the refs don’t want us winning shit #Jaguars,['Jaguars'],0,0,,,told refs want us winning shit,0.0258,0.15,0.17579999999999998,True
1076,1584269853900541952,2022-10-23 19:45:42+00:00,lloydr1l,Are the #Jaguars the worst 3/1 and 4/1 team in the NFL? Every.F'n.Week,['Jaguars'],0,0,,,worst 3 1 4 1 team nfl every fn week,-0.6249,-1.0,-1.6249,False
1077,1584269834279301121,2022-10-23 19:45:37+00:00,JvilleJaguars,Remember how that 4th and 1 killed them last week?  This is how teams lose #Jaguars,['Jaguars'],1,0,,,remember 4th 1 killed last week teams lose,-0.802,-0.1,-0.902,False
1078,1584269831926226945,2022-10-23 19:45:36+00:00,drunkjeremy904,The Kirk play was a first. The following run was a first down. These spots are fucking terrible #jaguars,['jaguars'],0,1,,"Coordinates(longitude=-87.634643, latitude=24.396308)",kirk play first following run first spots fucking terrible,-0.2484,-0.125,-0.3734,False
1079,1584269810044612608,2022-10-23 19:45:31+00:00,GoatHouseNFL,Massive stop by the #Giants defense. #Jaguars were on the move once again.,"['Giants', 'Jaguars']",7,1,,,massive stop defense move,-0.1779,0.0,-0.1779,False
1080,1584269793309249536,2022-10-23 19:45:27+00:00,CallDT,"Travis Etienne, Jr., doesn't get the 1 yard on a direct snap, followed by Trevor Lawrence not getting the yard on 4th-&amp;-1 on a keeper.

Instead of kicking a FG to go up 7, #Jaguars turn the ball over on downs on the #Giants 20 w/ 11:25 to go","['Jaguars', 'Giants']",0,0,,,travis etienne jr doesnt get 1 yard direct snap followed trevor lawrence getting yard 4th amp 1 keeper instead kicking fg go 7 turn ball downs 20 w 11 25 go,0.0,0.1,0.1,True
1081,1584269710535069696,2022-10-23 19:45:07+00:00,1010XLLauren,"I would have kicked the FG - #Jaguars lead 17-13 after turning the ball over on downs, 11:25 left to play in the game",['Jaguars'],11,0,,,would kicked fg lead 17 13 turning ball downs 11 25 left play game,0.34,-0.2,0.14,True
1082,1584269699046866944,2022-10-23 19:45:05+00:00,JonathanLOdom,Bad coaching decision right there could cost us big. #NYGvsJAX #Jaguars,"['NYGvsJAX', 'Jaguars']",5,0,,,bad coaching decision right could cost us big,-0.5423,-0.13809523809523805,-0.680395238095238,False
1083,1584269698664833024,2022-10-23 19:45:05+00:00,boldcitybooks,Loads of questionable coaching decision in that last set of downs. #jaguars,['jaguars'],0,0,,,loads questionable coaching decision last set downs,-0.296,-0.25,-0.546,False
1084,1584269697737842688,2022-10-23 19:45:04+00:00,Jaguars_Jungle_,"The #Jaguars fail on fourth and inches as they try the QB sneak one to many times in a game. The #Giants will get the ball back near their own 20 yard line.

17-13","['Jaguars', 'Giants']",0,0,,,fail fourth inches try qb sneak one many times game get ball back near 20 yard line 17 13,-0.5423,-0.05000000000000001,-0.5923,False
1085,1584269662548021248,2022-10-23 19:44:56+00:00,joe_B_1988,We couldn’t have possibly telegraphed that play anymore than we did. Complete failure #Jaguars,['Jaguars'],0,0,,"Coordinates(longitude=-87.022482, latitude=35.9945681)",possibly telegraphed play anymore complete failure,-0.2263,-0.07222222222222223,-0.29852222222222224,False
1088,1584269630121836544,2022-10-23 19:44:48+00:00,JvilleJaguars,How the hell was that the spot for Kirk?  Horrendous job by these officials so far today  #Jaguars,['Jaguars'],3,0,,,hell spot kirk horrendous job officials far today,-0.8555,0.1,-0.7555000000000001,False
1089,1584269615798312961,2022-10-23 19:44:45+00:00,sportsbettingm3,CHALLENGE THE FUCKING SPOT INSTEAD OF GOING FOR IT #JAGUARS,['JAGUARS'],3,0,,,challenge fucking spot instead going,0.0772,-0.6,-0.5227999999999999,False
1090,1584269594667077632,2022-10-23 19:44:40+00:00,I_Am_Sal__,Big time stop now PLEASE score a fucking touchdown #NFL #Giants #BigBlue #GoGiants #Jaguars,"['NFL', 'Giants', 'BigBlue', 'GoGiants', 'Jaguars']",0,0,,,big time stop please score fucking touchdown,0.0258,-0.3,-0.2742,False
1092,1584269564593913856,2022-10-23 19:44:33+00:00,dickardgreen,Why the fuck we have Robinson if we ain’t gonna use him!. Why not challenge the spot of the ball on the Kirk Sweep? Wtf are we doing ? @Jaguars #Jaguars,['Jaguars'],0,0,"[User(username='Jaguars', id=59471027, displayname='Jacksonville Jaguars', description=None, rawDescription=None, descriptionUrls=None, verified=None, created=None, followersCount=None, friendsCount=None, statusesCount=None, favouritesCount=None, listedCount=None, mediaCount=None, location=None, protected=None, linkUrl=None, linkTcourl=None, profileImageUrl=None, profileBannerUrl=None, label=None)]",,fuck robinson gonna use challenge spot ball kirk sweep wtf,-0.7906,-0.45,-1.2406,False
1093,1584269547091021824,2022-10-23 19:44:28+00:00,RealMBB,Kick the FG and maybe have a TD lead at home in the 4th? Does that sound crazy? Apparently. #Jaguars,['Jaguars'],1,1,,,kick fg maybe td lead home 4th sound crazy apparently,-0.34,-0.04999999999999999,-0.39,False
1094,1584269541651009536,2022-10-23 19:44:27+00:00,I_Am_Sal__,YES BIG TIME STOP! #NFL #Giants #BigBlue #GoGiants #Jaguars,"['NFL', 'Giants', 'BigBlue', 'GoGiants', 'Jaguars']",0,0,,,yes big time stop,0.128,0.0,0.128,True
1095,1584269525255483393,2022-10-23 19:44:23+00:00,Sports_24x7_,"On 3rd &amp; 1, Etienne no gain
#Giants 13 #Jaguars 17 4th https://t.co/JKXgJ8shSM","['Giants', 'Jaguars']",0,0,,,3rd amp 1 etienne gain 13 17 4th,0.5267,0.0,0.5267,True
1096,1584269523900768256,2022-10-23 19:44:23+00:00,askirkendall83,Kick the god damn field goal! #Jaguars,['Jaguars'],0,0,,,kick god damn field goal,-0.1531,0.0,-0.1531,False
1098,1584269502988324865,2022-10-23 19:44:18+00:00,Kylethe_bino13,why do they always mark etienne short when he’s clearly passed it?? same with kirk?? that both of those were firsts? #jaguars,['jaguars'],1,0,,,always mark etienne short clearly passed kirk firsts,0.4019,0.05000000000000001,0.45189999999999997,True
1099,1584269495526248449,2022-10-23 19:44:16+00:00,Demetrius82,"Wow. #Jaguars don't get fourth-and-inches and turn the football over on downs after an impressive-looking drive. 

Doug Pederson is upset and talking to the refs right now about what transpired. It looked like a first down on the Christian Kirk, second-down play.",['Jaguars'],134,3,,,wow dont get fourth inches turn football downs impressive looking drive doug pederson upset talking refs right transpired looked like first christian kirk second play,0.8555,0.2336734693877551,1.089173469387755,True
1101,1584269470670802944,2022-10-23 19:44:10+00:00,psppod,Amazing how Kirk had the 1st down a few plays ago and the refs just said “fuck it” #Jaguars,['Jaguars'],2,0,,,amazing kirk 1st plays ago refs said fuck,0.3182,0.10000000000000003,0.4182,True
1102,1584269465813852160,2022-10-23 19:44:09+00:00,cborys,Why does Doug Peterson hate field goals??!!! #jaguars #DUUUVAL,"['jaguars', 'DUUUVAL']",3,0,,,doug peterson hate field goals,-0.5719,-0.8,-1.3719000000000001,False
1104,1584269372599635968,2022-10-23 19:43:47+00:00,Redlandsnole11,"@Demetrius82 D, your Jag fan in Cali here.

On the missed extra point, whose fault did it appear to be ?
Poor kick,  poor blocking, bad snap  ?

Thanks man #Jaguars",['Jaguars'],0,0,"[User(username='Demetrius82', id=15216982, displayname='Demetrius Harvey', description=None, rawDescription=None, descriptionUrls=None, verified=None, created=None, followersCount=None, friendsCount=None, statusesCount=None, favouritesCount=None, listedCount=None, mediaCount=None, location=None, protected=None, linkUrl=None, linkTcourl=None, profileImageUrl=None, profileBannerUrl=None, label=None)]",,jag fan cali missed extra point whose fault appear poor kick poor blocking bad snap thanks man,-0.9001,-0.26,-1.1601,False
1106,1584269321471422464,2022-10-23 19:43:35+00:00,Ryebread78,Jaguars get fucked on 2 consecutive spots. Holy shit. #Jaguars,['Jaguars'],2,0,,,jaguars get fucked 2 consecutive spots holy shit,-0.8402,-0.4,-1.2402,False
1107,1584269287929225216,2022-10-23 19:43:27+00:00,LyfeReflect,Look at these refs tryna find a way 2 cheat lol #Jaguars,['Jaguars'],1,0,,,look refs tryna find way 2 cheat lol,-0.0516,0.8,0.7484000000000001,True
1108,1584269281738432520,2022-10-23 19:43:25+00:00,Connor_J_Hughes,"Huge defensive stand for the bend-but-don't-break #Giants defense. 

#Jaguars went for it on 4th &amp; inches. They didn't get it. 

Turnover on downs. Still a four-point game.","['Giants', 'Jaguars']",28,2,,,huge defensive stand bend dont break defense went 4th amp inches didnt get turnover downs still four point game,0.257,2.7755575615628914e-17,0.257,True
1109,1584269279351824384,2022-10-23 19:43:25+00:00,RealMBB,Unprofessional by whining on social media while you’re on the clock. #Jaguars https://t.co/94qLEAiPxB,['Jaguars'],2,0,,,unprofessional whining social media clock,-0.6369,0.03333333333333333,-0.6035666666666667,False
1111,1584269185143611392,2022-10-23 19:43:02+00:00,MiaOBrienTV,"Lord, 

I am just asking

To stop giving the #Jaguars questionable spots",['Jaguars'],200,12,,,lord asking stop giving questionable spots,-0.25,-0.5,-0.75,False
1115,1584268894386106368,2022-10-23 19:41:53+00:00,clayharbs82,Huge play for Evan Engram. Love seeing the TE get the rock! #Jaguars,['Jaguars'],9,0,,"Coordinates(longitude=-74.026675, latitude=40.683935)",huge play evan engram love seeing te get rock,0.836,0.45000000000000007,1.286,True
1116,1584268800031350784,2022-10-23 19:41:30+00:00,PresshubU,Giants vs Jaguars Giants vs. #Jaguars predictions and picks: Defense rules in Jacksonville https://t.co/3LlYMhdHrZ,['Jaguars'],0,0,,,giants vs jaguars giants vs predictions picks defense rules jacksonville,0.128,0.0,0.128,True
1118,1584268753121910787,2022-10-23 19:41:19+00:00,CallDT,".@Trevorlawrencee turning these 3rd downs into something late, finding Zay Jones &amp; then Evan Engram, getting closer to the #Giants redzone.

#Jaguars #NFL","['Giants', 'Jaguars', 'NFL']",0,0,"[User(username='Trevorlawrencee', id=1416537146, displayname='Trevor Lawrence', description=None, rawDescription=None, descriptionUrls=None, verified=None, created=None, followersCount=None, friendsCount=None, statusesCount=None, favouritesCount=None, listedCount=None, mediaCount=None, location=None, protected=None, linkUrl=None, linkTcourl=None, profileImageUrl=None, profileBannerUrl=None, label=None)]",,turning 3rd downs something late finding zay jones amp evan engram getting closer redzone,0.0,-0.15,-0.15,False
1120,1584268539933777920,2022-10-23 19:40:28+00:00,OllieBah26,Huge 3rd and 10 conversion! #Jaguars are putting on a clinic on what it means to actually want to win versus the #giants #NFL. Can they turn it around? 🫣🫣 https://t.co/ji0diVtF9S,"['Jaguars', 'giants', 'NFL']",0,0,,,huge 3rd 10 conversion putting clinic means actually want win versus turn around,0.7506,0.30000000000000004,1.0506000000000002,True
1122,1584268482262183936,2022-10-23 19:40:15+00:00,RealMBB,"Called a timeout to call THAT fucking play. Doug, man… #Jaguars",['Jaguars'],1,0,,,called timeout call fucking play doug man,0.4005,-0.6,-0.19949999999999996,False
1125,1584268322161319936,2022-10-23 19:39:36+00:00,Demetrius82,#Jaguars RG Brandon Scherff is in the blue tent right now. Cole Van Lanen is in the game for him.,['Jaguars'],12,0,,,rg brandon scherff blue tent right cole van lanen game,0.0,-0.038095238095238106,-0.038095238095238106,False
1126,1584268260203118593,2022-10-23 19:39:22+00:00,Kolby_Sports,"My Week 7 NFL game predictions:

#Titans over #Colts
#Ravens over #Browns
#Bengals over #Falcons
#Lions over #Cowboys
#Packers over #Commanders
#Buccaneers over #Panthers
#Jaguars over #Giants","['Titans', 'Colts', 'Ravens', 'Browns', 'Bengals', 'Falcons', 'Lions', 'Cowboys', 'Packers', 'Commanders', 'Buccaneers', 'Panthers', 'Jaguars', 'Giants']",0,0,,,week 7 nfl game predictions,0.0,-0.4,-0.4,False
1127,1584268166787538944,2022-10-23 19:38:59+00:00,RealMBB,Won’t need that timeout later. Fuck. #Jaguars,['Jaguars'],0,0,,,need timeout later fuck,-0.5423,-0.2,-0.7423,False
1131,1584267943721897984,2022-10-23 19:38:06+00:00,morris22200,New York Giants go to Domination  Jacksonville Jaguars in that games. Jacksonville Jaguars do not know how win big games. #NYGvsJAX #DUUUVAL,"['NYGvsJAX', 'DUUUVAL']",0,0,,,new york giants go domination jacksonville jaguars games jacksonville jaguars know win big games,0.5574,0.31212121212121213,0.8695212121212121,True
1133,1584267917201670145,2022-10-23 19:38:00+00:00,JaguarsViews,Watch: Marvin Jones Jr. makes ridiculous one-handed grab #JacksonvilleJaguars #Jaguars #Jags #GoJags #JagsFans https://t.co/0r4tJfzFec,"['JacksonvilleJaguars', 'Jaguars', 'Jags', 'GoJags', 'JagsFans']",0,0,,,watch marvin jones jr makes ridiculous one handed grab,-0.3612,-0.3333333333333333,-0.6945333333333333,False
1134,1584267842375258112,2022-10-23 19:37:42+00:00,RealMBB,Big Boy Lawrence throw. Damn did he drive that one. Believe in the kid. #Jaguars,['Jaguars'],11,1,,,big boy lawrence throw damn drive one believe kid,-0.4019,0.0,-0.4019,False
1137,1584267421598482433,2022-10-23 19:36:02+00:00,LyfeReflect,Anytime jags gain momentum refs throw a flag  #Jaguars,['Jaguars'],1,0,,,anytime jags gain momentum refs throw flag,0.5267,0.0,0.5267,True
1140,1584267317558796288,2022-10-23 19:35:37+00:00,MiaOBrienTV,"Welp, all week, the #Jaguars players were asked why the #Giants have had success.

""They win the fourth quarter. That's what we need to do.""

Let's see how this goes","['Jaguars', 'Giants']",32,6,,,welp week players asked success win fourth quarter thats need lets see goes,0.8176,0.3666666666666667,1.1842666666666668,True
1142,1584267137514078208,2022-10-23 19:34:54+00:00,ArcHofstra,"End of 3rd Quarter:
Giants 13-17 Jaguars

A fourth down stop for the #Jaguars has them in front after a Lawrence TD dive. Jacksonville has the ball, facing a third down situation near midfield.

#NYG #JAX #NFL","['Jaguars', 'NYG', 'JAX', 'NFL']",0,0,,,end 3rd quarter giants 13 17 jaguars fourth stop front lawrence td dive jacksonville ball facing third situation near midfield,-0.296,0.025,-0.27099999999999996,False
1145,1584267002608508928,2022-10-23 19:34:22+00:00,The3rdharris,If we have to have the kill shot now otherwise We are losing this game like the last 3 weeks.. #Duuuval #NFL #Jaguars,"['Duuuval', 'NFL', 'Jaguars']",3,0,,,kill shot otherwise losing game like last 3 weeks,-0.7003,-0.2,-0.9003000000000001,False
1147,1584266968344895488,2022-10-23 19:34:14+00:00,JvilleJaguars,"Phew, these refs are getting a little crazy w these flags.  That was not holding on Cam #Jaguars",['Jaguars'],3,0,,,phew refs getting little crazy w flags holding cam,-0.2748,-0.39375,-0.66855,False
1149,1584266912967819264,2022-10-23 19:34:00+00:00,joe_B_1988,I get this officiating crew might be new but they are way too flag happy in this one #Jaguars,['Jaguars'],1,0,,"Coordinates(longitude=-87.022482, latitude=35.9945681)",get officiating crew might new way flag happy one,0.5719,0.4681818181818182,1.040081818181818,True
1151,1584266825956675584,2022-10-23 19:33:40+00:00,Sports_24x7_,"Lawrence 5-yd rush negated by Cam Robinson holding penalty
#Giants 13 #Jaguars 17 3rd https://t.co/mVdAFZM5sE","['Giants', 'Jaguars']",0,0,,,lawrence 5 yd rush negated cam robinson holding penalty 13 17 3rd,-0.4588,0.0,-0.4588,False
1156,1584266608179957761,2022-10-23 19:32:48+00:00,RealMBB,What the fuck did Cam do to get that flag? He won the edge. #Jaguars,['Jaguars'],2,0,,,fuck cam get flag edge,-0.5423,-0.4,-0.9423,False
1159,1584266288574390273,2022-10-23 19:31:32+00:00,CallDT,"Doug Pederson's challenge WORKS as catch is reversed &amp; 4th-&amp;-2 instead became 4th-&amp;-4 with the ball returning to the Jaguars late in the 3rd Q, ahead 17-13.

#Jaguars #Giants #NFL","['Jaguars', 'Giants', 'NFL']",0,0,,,doug pedersons challenge works catch reversed amp 4th amp 2 instead became 4th amp 4 ball returning jaguars late 3rd q ahead 17 13,0.0772,-0.15,-0.07279999999999999,False
1160,1584266217916809217,2022-10-23 19:31:15+00:00,Sports_24x7_,"JAX wins the challenge overturned to an incomplete pass .. punting unit on
#Giants 13 #Jaguars 17 3rd https://t.co/jeCPMfi93T","['Giants', 'Jaguars']",0,0,,,jax wins challenge overturned incomplete pass punting unit 13 17 3rd,0.6124,0.15,0.7624000000000001,True
1161,1584266068259876865,2022-10-23 19:30:39+00:00,Jaguars_Jungle_,"The call on the field was reversed and the #Giants will punt the football. Great stop by the #Jaguars defense, Travon Walker captured his 2nd sack of the season and Rayshawn Jenkins made a great play to disrupt that third down pass. 

17-13","['Giants', 'Jaguars']",0,0,,,call field reversed punt football great stop defense travon walker captured 2nd sack season rayshawn jenkins made great play disrupt third pass 17 13,0.872,0.4,1.272,True
1162,1584265879709417472,2022-10-23 19:29:54+00:00,UCFJAGFAN,Why are people questioning J Rob? Have they seen what Etienne is doing? #Jaguars,['Jaguars'],2,0,,,people questioning j rob seen etienne,-0.6124,0.0,-0.6124,False
1163,1584265795500093441,2022-10-23 19:29:34+00:00,MainManPlan,Nice challenge Doug. Big time balls there #Jaguars,['Jaguars'],2,0,,,nice challenge doug big time balls,0.4767,0.3,0.7767,True
1164,1584265786247389184,2022-10-23 19:29:32+00:00,LyfeReflect,Great nfl team that can hang with the best of em costly penalties and self inflicted woes cost them games #Jaguars https://t.co/Ykr2l7ISbL,['Jaguars'],0,0,,,great nfl team hang best em costly penalties self inflicted woes cost games,0.7184,0.9,1.6184,True
1166,1584265742366613504,2022-10-23 19:29:21+00:00,MR_PROPagiorgio,"There’s nothing worse than when NFL wide receivers/tight ends/anyone running routes comes up 1-2 yards short on a crossing out!! Bro, get to the fucking line to gain or work your way up field an extra yard! What good is it if you immediately get tackled!! 🗑 #giants #jaguars","['giants', 'jaguars']",1,0,,,nothing worse nfl wide receivers tight ends anyone running routes comes 1 2 yards short crossing bro get fucking line gain work way field extra yard good immediately get tackled,0.8455,-0.08265306122448979,0.7628469387755102,True
1167,1584265577652051969,2022-10-23 19:28:42+00:00,Sports_24x7_,"On 3rd &amp; 4, Jones to Hudson for 2-yds .. JAX challenges the ruling on the field of a complete pass
#Giants 13 #Jaguars 17 3rd https://t.co/MMowK2lUSL","['Giants', 'Jaguars']",1,0,,,3rd amp 4 jones hudson 2 yds jax challenges ruling field complete pass 13 17 3rd,0.0772,0.03333333333333333,0.11053333333333334,True
1169,1584265309044645888,2022-10-23 19:27:38+00:00,dschwalbe94,The jaguars are undefeated against the jaguars. If we played every game like we do against ourselves…watch out #jaguars,['jaguars'],2,2,,,jaguars undefeated jaguars played every game like watch,0.5994,-0.4,0.19940000000000002,True
1170,1584265188991471616,2022-10-23 19:27:09+00:00,RealMBB,Ballsy review from Doug P where they’re at it in the game. But the right one. #Jaguars,['Jaguars'],1,0,,,ballsy review doug p game right one,0.0,-0.05714285714285716,-0.05714285714285716,False
1171,1584265149669441536,2022-10-23 19:27:00+00:00,JaguarsViews,"Evan Neal injury: Latest on Giants OT's knee, more #JacksonvilleJaguars #Jaguars #Jags #GoJags #JagsFans https://t.co/jym1m7CMAv","['JacksonvilleJaguars', 'Jaguars', 'Jags', 'GoJags', 'JagsFans']",0,0,,,evan neal injury latest giants ots knee,-0.4215,0.5,0.07850000000000001,True
1174,1584264710177714178,2022-10-23 19:25:15+00:00,RealMBB,J.J. Watt was notorious for jumping offsides. So I’ll let 44 off in his rookie season. #Jaguars,['Jaguars'],0,0,,,j j watt notorious jumping offsides let 44 rookie season,-0.4404,0.0,-0.4404,False
1176,1584264574890803200,2022-10-23 19:24:43+00:00,TrumanDem,"Jags D really going the stupid route to lose this game.  Incredible incompetence here... 

Jags 
#Jaguars 
@Jaguars 
#DUUUVAL 
#Jacksonville","['Jaguars', 'DUUUVAL', 'Jacksonville']",0,0,"[User(username='Jaguars', id=59471027, displayname='Jacksonville Jaguars', description=None, rawDescription=None, descriptionUrls=None, verified=None, created=None, followersCount=None, friendsCount=None, statusesCount=None, favouritesCount=None, listedCount=None, mediaCount=None, location=None, protected=None, linkUrl=None, linkTcourl=None, profileImageUrl=None, profileBannerUrl=None, label=None)]",,jags really going stupid route lose game incredible incompetence jags,-0.8651,-0.024999999999999967,-0.8900999999999999,False
1177,1584264536164442112,2022-10-23 19:24:34+00:00,MainManPlan,Both teams have had penalties at the worst times today. #Jaguars,['Jaguars'],0,0,,,teams penalties worst times today,-0.6249,-1.0,-1.6249,False
1180,1584264349467934720,2022-10-23 19:23:49+00:00,Demetrius82,"Sack by #Jaguars OLB Travon Walker. Josh Allen had initial pressure, so it was a collab. That's Walker's second sack of his career/the season.",['Jaguars'],38,3,,,sack olb travon walker josh allen initial pressure collab thats walkers second sack career season,-0.296,0.0,-0.296,False
1185,1584264180407840768,2022-10-23 19:23:09+00:00,HaysCarlyon,SACK! Travon Walker gets Daniel Jones for a loss of 2. First of the game for the #Jaguars.,['Jaguars'],17,1,,,sack travon walker gets daniel jones loss 2 first game,-0.3182,-0.07500000000000001,-0.3932,False
1188,1584263963071893504,2022-10-23 19:22:17+00:00,MainManPlan,Are we going to have to put a QB spy out for shitty Daniel Jones? #Jaguars,['Jaguars'],0,0,,,going put qb spy shitty daniel jones,-0.5574,0.0,-0.5574,False
1190,1584263549001822209,2022-10-23 19:20:38+00:00,ErvPierce,#jaguars #nflfox  biased tv personnel drove me to listen to radio and watch replays. NFL is in NY,"['jaguars', 'nflfox']",1,0,,,biased tv personnel drove listen radio watch replays nfl ny,-0.2732,0.0,-0.2732,False
1191,1584263547349270529,2022-10-23 19:20:38+00:00,Sports_24x7_,"Logan Cooke 57-yd punt .. Richie James fair-catch at NYG 33
#Giants 13 #Jaguars 17 3rd https://t.co/ounj7Ds9dv","['Giants', 'Jaguars']",1,0,,,logan cooke 57 yd punt richie james fair catch nyg 33 13 17 3rd,0.3182,0.35,0.6681999999999999,True
1192,1584263524372844545,2022-10-23 19:20:33+00:00,DanSchneierNFL,"Huge stop by the #Giants D to force a three and out right after missing on the 4th and goal. 
Somehow the #Jaguars flip the field w/ an absurd punt though. WTF was that punt.
That was a chance to lose the momentum for good there (if the Jags had a clock-bleeding scoring drive).","['Giants', 'Jaguars']",34,2,,,huge stop force three right missing 4th goal somehow flip field w absurd punt though wtf punt chance lose momentum good jags clock bleeding scoring drive,-0.5719,0.030952380952380953,-0.540947619047619,False
1195,1584263190770159617,2022-10-23 19:19:13+00:00,Baseline_NY,"#Giants Brian Daboll showing faith in his offense, and defense with that 4th down call. G-Men get the ball back after a #Jaguars 3 and out.","['Giants', 'Jaguars']",0,0,,,brian daboll showing faith offense defense 4th call g men get ball back 3,0.3182,0.0,0.3182,True
